index,event_id,filename,anumber,sentence_count,report_type,sentence_idx,sentence_triggers,event_text,label,lower_idx,upper_idx,DATE,LOCATION,MINERAL,ORE_DEPOSIT,ROCK,STRAT,TIMESCALE,TRIGGER
1389,a108656_a108656_v2_report_45,a108656_a108656_v2_report.json,108656,139,Final Surrender,45,"mineralisation, anomalism, anomalism, anomalism, potential, possible","Outcrop, although limited, within the area mapped is dominated by mafic (basalt and dolerite) and ultramafic sequences with intercalated sediments. A series of regional compilation and assessment of previous exploration including drilling, soil sampling, and geochemical data was undertaken during the reporting period to identify anomalous zones that could be targeted. Targeting criteria was applied across all tenements and included the following aspects: large and secondary structures major NW structures providing fluid access, and minor NE structures constraining mineralisation, both associated with Au and Cu anomalism redox boundary observable from ME/ASD data lithology identification (via ME analysis) geophysical features alteration assemblages observed from ASD data magnetic highs and lows associated with Au anomalism/alteration Au anomalism This resulted in identification of 18 potential targets across the region which were subsequently ranked, with prioritized targets assigned a possible model. Field trips were conducted on each target area to check access, historical drilling, and any interesting geological features observable. During 2008, Jigsaw Geoscience was commissioned by Integra Mining to undertake a regional bedrock geological interpretation (Figure 7).",False,45,45,2008,,,,"basalt, dolerite, sediments, bedrock",,,"anomalous, could be, mineralisation, anomalism, anomalism, anomalism, potential, possible"
152,a094855_e77_3697_2012s_11001551_3,a094855_e77_3697_2012s_11001551.json,94855,55,Final Surrender,3,"prospectivity, mineralisation","August 2010 This Annual Report summarises all exploration activities conducted by Gondwana within the surrendered tenement P77/3697 for the period ending 13th July 2012. The tenement is located within the Southern Cross Granite-Greenstone Terrane, in the southern portion of the Yilgarn Mineral Field south of the Marvel Loch Township. No recent work was undertaken in the tenement, except for assessment of the regional aeromagnetic data indicating the tenement has low prospectivity for gold mineralisation. 1.0 Introduction.4 2.0 Access and Locality.5 3.0 Regional Geology.6 4.0 Work Conducted.11 5.0 Discussion.12 Gondwana Resources explores a portfolio of prospective tenements in the Southern Cross Greenstone Belt, south of St Barbaras Marvel Loch Gold Operations and 80km north of Western Areas Forrestania Nickel Operations. The Southern Cross area is a well recognised regional gold mining centre with excellent established infrastructure.",False,3,3,"August 2010, the period ending 13th July 2012","Southern Cross, Marvel Loch, Southern Cross, Marvel Loch, Forrestania, Southern Cross","gold, Gold, Nickel, gold",,"Granite, Greenstone",Greenstone Belt,,"prospectivity, mineralisation, prospective"
397,a075914_widgie_c862007_07a_10591003_45,a075914_widgie_c862007_07a_10591003.json,75914,185,Annual,45,"mineralisation, exploration potential","The Cassini prospect is located within the highly prospective lithologies that host Ni sulphide mines which include Miitel, Mariners, Redross and Wannaway. These operations are currently owned and operated by Mincor Resources. INTRODUCTION.4 DRILL SUMMARY.5 UPDATED GEOLOGY .5 1.1 ULTRAMAFIC .5 1.2 MAFIC .5 1.3 ARCHEAN SEDIMENTS .6 1.4 VEINING .6 1.5 STRUCTURE .6 NICKEL MINERALISATION .6 DATA ANALYSIS .6 1.6 DATABASE INTEGRITY.6 1.7 SURVEY CONTROL.6 1.8 SURVEYING .6 1.9 SAMPLING AND ASSAYING TECHNIQUES .7 1.9.1 QA/QC.7 CONCLUSIONS.8 RECOMMENDATIONS .8 REFERENCES .10 APPENDICIES.11 1.10 SOUTHERN GEOSCIENCE MEMORANDUM .11 Cassini Nickel Project: Geological Report and Exploration Potential Table Of Contents iii 1.11 GEOLOGICAL LOGS.30 1.12 XROSS SECTIONS .55 1.13 DRILL HOLE COLLARS.56 1.14 DRILL HOLE SURVEYS.57 1.15 ASSAYS .59 1.10 Southern Geoscience Memorandum SOUTHERN GEOSCIENCE CONSULTANTS PTY LTD A.C.N. During February and March nine RC holes were drilled for a total of 1778m at the Cassini Prospect (EL 15/625) for JMS.",False,45,45,"February, March, 1778","Miitel, Mariners","sulphide, NICKEL, Nickel",,SEDIMENTS,,ARCHEAN,"prospect, highly prospective"
316,a074325_e77-1159 2006 annual report_17579552_154,a074325_e77-1159 2006 annual report_17579552.json,74325,185,Annual,154,prospect,"Exploration programmes conducted over the Evanston Project in the previous period had been directed towards the enhancement of the known gold deposits. Mineral Resource and Ore Reserve Estimates had been prepared to cover the six main deposits of Python, Dolly Pot, Dugite and Goldstream at Marda Central and King Brown and Golden Orb. During the current period, the companys main focus at Evanston was the infill drilling programme at the Golden Orb prospect. This has had the intent to upgrade the prospects resource potential. This programme has been conducted at Golden Orb which is to the east of Exploration Licence 77/1159.",False,154,155,,,,gold deposits,,,,"prospect, prospects, potential"
219,a072234_c160_1997 a03_18507715_15,a072234_c160_1997 a03_18507715.json,72234,142,Annual,15,anomalous,"A mineralised high level epithermal field (~20 km2 mapped) has been recognised in late Archaean to Fortescue Group rocks via collective geological, structural, geochemical features. This field was emplaced into part of the Warrawoona rocks, although principally into and syn the Mt Roe Basalt and lessor into the overlying Hardey Formation volcanosediments with evidence of minor reactivation well up into the Kylena Formation. Geochemically the system is variably anomalous in Au-Ag-As-Hg-Sb-W-Mo-Se and lessor Cu-Pb. Hydrothermal mineralisation in veins and breccias is dominated by silica (multiple textures including dominantly chalcedonic/opaline, micro crystalline quartz, banded colloform silica and quartz pseudomorphing platy calcite), extensive chlorite, sericite, some kaolin and carbonate alteration with significant sulphide in breccia veins (mainly pyrite, possibly arsenical pyrite). Geochemical data has been processed by Carras Mining to determine assay relationships between samples thereby allowing sample grouping (based on geochemical features) and then assessment of anomalism within those individual groups.",False,15,15,,,"Hydrothermal, silica, opaline, crystalline quartz, silica, quartz, calcite, chlorite, sericite, kaolin, carbonate, sulphide, pyrite, pyrite",,"Basalt, breccias, breccia","Fortescue Group, Hardey Formation, Kylena Formation",Archaean,"anomalous, mineralisation, extensive, significant, possibly, anomalism"
378,a075529_red billabong combined annual report-2007_c12-2004_14278992_319,a075529_red billabong combined annual report-2007_c12-2004_14278992.json,75529,349,Annual,319,anomalous,"As the maglag sample collected at the same site, and the subsequent maglag (NSS306451453), panned concentrate (NSS306760-762) and -80# (SV, NSS305443-445) sampling failed to duplicate the result no further work for the area is planned. The sampling of the costeans and drill spoils in the historic drilling area at Station Creek (MO5570) returned samples elevated in Ni and Cr. No other anomalous areas were highlighted. Within the tenement areas, the most prospective search targets are considered to be; Polymetallic mineralization (zinc, copper, lead and silver) at Emull and Location 5 hosted by sheared and faulted Koongie Park Formation in a contact zone with the Emull Gabbro intrusion. High grade gold mineralization similar to Nicholsons Find.",False,319,319,,,"zinc, copper, lead, silver, gold",,,"Koongie Park Formation, Emull Gabbro",,"anomalous, prospective, mineralization, High grade, mineralization"
614,a080941_08-044 e803465 annual report_8684482_15,a080941_08-044 e803465 annual report_8684482.json,80941,27,Annual,15,broad,"Tenement Area (blocks) Grant Expiry Commitment Rent Registered holder E80/3465 44 22.08.06 21.08.11 $44,000.00 $4,844.84 NADL 4.0 Geology The licence is located within the North Australian Craton, which is described as a stable block of deformed and metamorphosed Palaeoproterozoic age rocks. The Kimberley Basin forms the platform cover to the craton and consists of a succession of sedimentary and volcanics rocks of Proterozoic age. The terrain formed by the Kimberley Basin is rugged and is essentially a broad plateau dissected by strong jointing that has resulted in a well developed drainage system. The oldest unit that crops out within the licence is the Warton Sandstone which is a white quartz sandstone heavily dissected by jointing. The Carson Volcanics conformably underly the Warton Sandstone and may be exposed within the licence.",False,15,16,,"Kimberley Basin, Kimberley Basin",quartz,,sandstone,"Warton Sandstone, Carson Volcanics, Warton Sandstone",Proterozoic,broad
122,a087875_p38_3805_2010_10348021_66,a087875_p38_3805_2010_10348021.json,87875,123,Annual,66,mineralisation,On 12 July 1982 Kennecott entered into a Joint Venture Agreement with Hill Minerals NL (Hill Minerals). Under the terms of the agreement Hill Minerals had the right to earn an interest by contributing exploration dollars to the project. Hill Minerals carried out a programme of RAB drilling designed to test the extent of gold mineralisation beneath the old workings. Results included 1 m @ 18.7 g/t from 26 m. In April 1982 Carpentaria entered into a Joint Venture Agreement with Esso Exploration & Production Australia Inc (Esso). The Duketon Joint Venture covered 50 Mineral claims and 3 Gold Mining Leases in the area surrounding the historical Duketon Mining Centre.,False,66,66,"12 July 1982, April 1982",Australia,"dollars, gold, Gold",,,,,mineralisation
1109,a095419_earaheedy cofunded governmentindustry exploration drilling program_final report_2012_16263095_157,a095419_earaheedy cofunded governmentindustry exploration drilling program_final report_2012_16263095.json,95419,181,Co-Funded Drilling,157,"prospect, prospect","Low to moderate grade manganese enrichment was intercepted at the Blue Cliffs Prospect in drill holes EARC0022 EARC0026 and EARC0028 EARC0034, and in the Blue Nugget Prospect in drill holes EARC0037 EARC0040 (Table 4 Table 6). Manganese enriched packages are thin, between 1-8m thick, and grade between 5.6% - 38.4% Mn (using a cut-off grade of 5% Mn) (Table 4 Table 6). Manganese enrichment is from surface or near surface, flat-lying, comparable laterally across the Blue Cliffs Prospect, and discontinuous at the Blue Nugget Prospect. Manganese is interpreted to have enriched siltstone chert packages of the Frere Formation. Manganese enrichment is associated with iron enrichment (hematitegoethite, up to 51% Fe however, typically 20% - 30% Fe) and elevated phosphorus percentages accompany from surface manganese and iron enrichment zones (0.1% - 0.9% P).",False,157,157,,"Cliffs, Cliffs","manganese, Manganese, Manganese, Manganese, Manganese, iron, manganese, iron",,"siltstone, chert",Frere Formation,,"enriched, enriched"
24,a075685_p2403750_2007a_final_070802_17442983_26,a075685_p2403750_2007a_final_070802_17442983.json,75685,361,Annual,26,prospect,"Drill Collar Plan (1:25,000) Figure 6: .Siberia North Regional Aeromagnetics List of Appendices Appendix 1. Logging Codes and Algorithm Appendix 2.Cross Sections & Strip Logs Appendix 3.Beneficiation (Screening) Data Appendix 4.Digital Data INCO Australia Limited Partnership, Siberia North Prospect Tenement P24/3750 2005-2007 Annual Report Page 1 of 24 . 1.0 Introduction The Siberia North Prospect is located approximately 80km north north west of Kalgoorlie. The prospect, which is considered to be prospective for nickel, is part of Herons larger Siberia Project and the Kalgoorlie Nickel Project (KNP) which is subject to a farm-in agreement with Inco Australia Limited Partnership (IALP). Works completed during the 2005-2007 reporting period were completed by IALP in order to fulfil farm-in agreement commitments.",False,26,26,"2005-2007, 2005-2007","Australia, Siberia, Siberia, Kalgoorlie, Siberia, Kalgoorlie, Australia","nickel, Nickel",,,,,"prospect, prospective"
992,a090146_depot_springs_e29_703_2011a_15722771_17,a090146_depot_springs_e29_703_2011a_15722771.json,90146,44,Annual,17,mineralization,"The tenement is situated over vacant Crown Land about 110 km west-northwest of Leonora, and to the west of Sturt Meadows Station. Lake Barlee is 31 km to the southwest. The tenement was originally acquired on the proximity and perceived structural relationship to the Cathedral nickel mineralization at Mt Alexander, 25 km to the south. The tenement is entirely covered to the east, south and north by BHP Billitons Mt Alexander JV with Western Areas NL. There have been no reported results since the initial 2 discovery holes by the JV in 2008.",False,17,17,2008,"Leonora, Lake Barlee, southwest",nickel,,,,,mineralization
1040,a092319_atr p24_4076 2011_16682913_152,a092319_atr p24_4076 2011_16682913.json,92319,165,Annual,152,prospects,Excelsior Gold Limited. Geological Survey of Western Australia. Prospects Drilled: nil List of Assays: nil DUE DATE: 8 January 2012 PREPARED BY: Tracy Fowler DATE: 10/01/2012 DISTRIBUTION: Department of Mines and Petroleum (1) Minara Resources Limited (1) GPM Resources Pty Ltd (1) Location: The tenement is located approx 50 kilometres (km) north northwest of Kalgoorlie in the Eastern Goldfields Region of Western Australia.,False,152,153,8 January 2012,"Western Australia, Kalgoorlie, Goldfields, Western Australia",Gold,,,,,Prospects
342,a074768_athlone verification report 2006_17320389_5,a074768_athlone verification report 2006_17320389.json,74768,6,Annual,5,further drilling,"Work done: Exploration in 2006 consisted of a ground magnetic survey and rock chip sampling (3 samples). Results: The ground magnetic survey intersections assisted with definition of lithologies and rock chip sampling results validated previous reports. Conclusions: The results were encouraging, and further drilling was planned.",False,3,5,2006,,,,,,,further drilling
492,a078381_e29_586_2008a_12183611_242,a078381_e29_586_2008a_12183611.json,78381,381,Annual,242,"further exploration, potential","The boundary between granite and greenstone is weakly anomalous in gold. The best assay results for nickel and associated elements and gold for the 200708 Snake Hill soil program are shown in the table below. Heron Resources Ltd, Snake Hill Project (E29/586) Annual Report 2008 iii Best assay results for 200708 Snake Hill soil sampling program (E29/586) Element Assay results Ni 0.114% Cu 79 ppm Pt 7 ppb Pd 9 ppb Co 64 ppm Cr 2630 ppm Au 0.085 ppm Conclusions: Further exploration will focus on the nickel potential of the project area and will begin with a review of the soil assay results. Reconnaissance RAB drilling may be undertaken. Heron Resources Ltd, Snake Hill Project (E29/586) Annual Report 2008 iv VERIFICATION SHEET Exploration work type File name Format Office studies Literature search Database compilation Computer modelling Reprocessing of data General research Report preparation E29_586_2008A.pdf PDF Other (specify)",False,241,243,"2008, 2008",,"gold, nickel, gold, nickel",,"granite, greenstone",,,"anomalous, Further exploration, potential"
371,a075376_atr_2007_c296_1996_final_16721632_93,a075376_atr_2007_c296_1996_final_16721632.json,75376,132,Annual,93,extensive,The southern portion of the lease exhibits poor outcrop with an abundance of cover especially in the south west. Cover is underlain by a granodiorite-porphyry. To the north outcrop is extensive with a range of hills orientated north south. The Prince of Wales workings are situated on the crest of this hill line. The sequence strikes north - south and the axis of a major south plunging anticline is interpreted to extend through the lease.,False,93,93,,south west,,,"granodiorite, porphyry",,,extensive
846,a086400_c230_1998_annual report 2009 final_15241305_58,a086400_c230_1998_annual report 2009 final_15241305.json,86400,218,Annual,58,prospects,"The model for gold mineralisation along the Melville Shear Zone is stacked, thrust-related zones occurring within northwest-trending, steep north-easterly dipping splays. Significant results from Prosperitys reverse circulation drilling programs at the Melville Deposit include:- 15m @ 5.6 g/t Au (incl. The locations of the historic mines and prospects are shown in Figure 6. The Applecross Prospect lies approximately 500 metres north-northeast of the Melville Deposit. These results are of similar tenor to results including 2m @ 15.8g/t Au and 8m @ 5.1g/t Au reported from previous drilling completed approximately 100 metres further north.",False,58,58,,,gold,,,,,"mineralisation, Significant, prospects"
900,a087440_e31_700_ps_2010_12214054_3,a087440_e31_700_ps_2010_12214054.json,87440,35,Partial Surrender,3,high grades,"The region falls within the Edjudina Terrane (Swager et al., 1990) of the Eastern Goldfields Province and is bound by the Claypan fault to the west and the Pinjin fault to the east. This region differs from the domains to the west with minor volumes of metabasalt and metakomatiite and more prolific calc-alkaline andesitic complexes with associated clastic rocks as well as BIF, chert and metasedimentary sequences intruded by metadolerite (Swager,1995a,1997). The region has undergone greenschist metamorphism although high grades upto amphibolite can occur close to granite margins. Locally the geology consists of intermediate schists and sediments with BIF forming prominent north west trending ridges. The basaltic schists tend to form more flat to gently undulating landforms and shallow surficial sediments cover most of the region and outcrop is limited.",False,3,3,1990,"Goldfields, Pinjin fault",,,"metabasalt, metakomatiite, BIF, chert, metasedimentary sequences, metadolerite, greenschist, amphibolite, granite, schists, sediments, BIF, basaltic, schists, sediments",,,high grades
91,a084467_e77_1196 psr 2009_16042683_67,a084467_e77_1196 psr 2009_16042683.json,84467,90,Partial Surrender,67,prospectivity,"The central group of surrendered blocks have extensive areas of depositional cover including sheetwash and dune sand (Greenfield, 2001). Sporadic basement outcrop and aeromagnetic images indicate that they are underlain by foliated granite. Aeromagnetic highs are coincident with outcropping foliated granite in several areas, downgrading prospectivity. Five blocks at the northern end of the Licence and the southernmost block were surrendered as imaged aeromagnetics indicates these are underlain by granite and have low potential. Southern Cross Goldfields Limited (SXG) has secured a substantial tenement position within the Marda-Diemals Greenstone Belt through purchase of tenements from Polaris Metals NL, International Goldfields Ltd and Transit Holdings Ltd.",False,67,67,2001,"Southern Cross, Goldfields, Goldfields",,,"sheetwash, sand, granite, granite, granite",Greenstone Belt,,"extensive, prospectivity, potential, substantial"
1397,a109235_finalsurrenderjutsonrockse38-1541_22,a109235_finalsurrenderjutsonrockse38-1541.json,109235,74,Final Surrender,22,"discovered, prospecting","Gold mineralisation occurs in quartz filled shears and fractures at the historic gold prospects Chapmans Reward (Jutson Rocks), Langs Find and Rutters Soak. The only recorded production is 26.65 ounces from 15 tonnes at Chapmans Reward in 1925. 4.0 PREVIOUS EXPLORATION In 1923 a State Prospecting Party discovered visible gold in prospecting pits at Chapmans Reward with selected sampling from pit walls and dump material assaying up to 201 g/t. Additional sampling of quartz veins at Langs Find returned assays of 208g/t and 165g/t Au, while a sample from quartz veins within mafics at Mt Shenton assayed 2.2g/t Au. In 1971 Kennecott Exploration(Australia) Pty Ltd conducted soil sampling, rock chip sampling and costeaning over tremolite chlorite komatiites in the Jutson Rocks area in search for nickel sulphides.",False,22,23,"1925, 1923, 1971",,"Gold, quartz, gold, gold, tremolite, chlorite, nickel, sulphides",,"quartz veins, quartz veins, komatiites",,,"mineralisation, prospects, discovered, prospecting"
648,a081372_kunann2008_9454551_1020,a081372_kunann2008_9454551.json,81372,2890,Annual,1020,bright,"Finegrained alteration biotite (dark brown) forms small flakes and aggregates in the altered groundmass. x20, Image P5183150) This view illustrates the partly preserved primary holocrystalline igneous, rather than fragmental, texture of groundmass in the andesite porphyry. Small oriented lath shapes of primary groundmass plagioclase (oriented NE-SW) are distinguishable, despite moderately strong replacement by albite (white to grey) and biotite (reddish brown), sericite (small bright pale yellow flakes), and opaques (right, magnetite). x20, Image P5183149) This view captures a relict primary apatite microphenocryst (grey, centre) which has suffered sculpting of crystal margins where small alteration biotite flakes (reddish brown) have formed. The presence of apatite microphenocrysts in the andesite porphyry suggests that the andesitic magma was geochemically evolved (ie elevated abundances of large-ion lithophile elements including K, P, and probably Ce).",False,1020,1020,,"grey, grey","biotite, plagioclase, albite, biotite, sericite, magnetite, apatite, crystal, biotite, apatite",,"andesite, porphyry, andesite, porphyry",,,"bright, presence of"
972,a088981_p63 1750 2010a_16413648_59,a088981_p63 1750 2010a_16413648.json,88981,83,Annual,59,mineralisation,"A RAB drilling program of 44 drillholes for 2513m was completed to test the anomalous trend. No significant gold mineralisation was indicated in the drilling and it was concluded that the soil anomalism was developed from lateritised enrichment over weak bedrock shearing. Page 4 Page 5 Avoca Resources have completed exploration for nickel PGM mineralisation in this area. Exploration completed includes review of Ni-Cu exploration by previous explorers over the dyke, structural interpretations based on aeromagnetic data, regolith mapping based on Landsat images, an orientation geochemical program, reconnaissance geological mapping and rock chip sampling, soil sampling programs, comprehensive open file searches and digital data capture, airborne EM data purchase and interpretations and detailed geological mapping. Avoca also completed rock chip sampling, considerable surface TEM surveying over 7 separate targets, 5 RC drill holes over 2 target areas and downhole EM surveying.",False,59,59,,,"gold, nickel",PGM,"bedrock, regolith",,,"anomalous, significant, mineralisation, anomalism, mineralisation"
132,a090300_c175_2008_2011a_11012050_196,a090300_c175_2008_2011a_11012050.json,90300,332,Annual,196,"potential, significant, mineralisation","At Twilight (North) weak Au enrichments (5m at 101ppb Au and 5m at 44ppb Au) in drill hole KARC005, associated with a sequence of hydrothermally altered mafics containing disseminated to massive sulphides, suggests potential for significant Au mineralisation nearby.",True,196,196,,,sulphides,,,,,"potential, significant, mineralisation"
734,a084034_bs_2009_16186954_154,a084034_bs_2009_16186954.json,84034,258,Annual,154,significant,"1239m of shallow (maximum depth 93m) slimline RC drilling (in 16 angle holes) was completed in the Halleys area. All drill samples were bagged and 259 5m composite samples were collected for assay. Significant intervals were split sampled through a riffle splitter, totalling 314 samples were sent for assay. All samples were sent to Genalysis and analysed for Au, Ag, As, Co, Cr, Cu, Fe, Mn, Ni, P, Pb, Pt, Pd, S, Ti, V, Zn, using a combination of 4 acid digest ICP_OES for the multi-elements and 25g/t fire-assay MS for precious metals. QA/QC was completed at the rate of 1 standard per hundred samples and 4 replicate samples per 100; Therefore 5% of the samples were QA/QC.",False,154,155,,,,precious metals,,,,Significant
865,a086713_c53-2009-2010 annual reportduchess-paradise_9770633_151,a086713_c53-2009-2010 annual reportduchess-paradise_9770633.json,86713,303,Annual,151,"supporting, correlation","Image over Philydrum-90 Mile Anticline area, showing appearance of inferred laminated Hardman Fm (Ph) and light-toned Cherrabun Mbr (Phc?). 10 Government sheets as Cenozoic cover with weak bedding trends. In the west, a few dark beds are present in unit Ph, supporting the correlation with areas south and east of the Fitzroy River. In the far west, the laminated Hardman Fm beds are underlain by diagnostic pale-toned soils that are quite easy to detect on Landsat. Although it is very poorly exposed, it has been noted elsewhere that the Kirkby Range Mbr (map unit Phk?)",False,151,152,,,,,,,Cenozoic,"supporting, correlation"
314,a074321_jh_c150_2006_2006a_11969721_351,a074321_jh_c150_2006_2006a_11969721.json,74321,548,Annual,351,mineralization,"The first of two reports written in 1969 for Carr Boyd Minerals Ltd reported the results of a surface sampling and mapping programme. The massive hematite ores were found to be more variable in volume than first predicted, but of higher grades. The second report recorded the results of a first pass drilling programme conducted without adequate geological knowledge and as such the results were apparently inconclusive as to the size and origin of the mineralization. The locations of the holes, drilling type, assay results and other details on this drilling programme have not been sighted. The Jack Hills Project lies in the Murchison Province of the Archaean Yilgarn Craton of Western Australia.",False,351,352,1969,"Jack Hills, Murchison, Yilgarn Craton, Western Australia",hematite,,,,Archaean,"higher grades, mineralization"
