index,event_id,filename,anumber,sentence_count,report_type,sentence_idx,sentence_triggers,event_text,label,lower_idx,upper_idx,DATE,LOCATION,MINERAL,ORE_DEPOSIT,ROCK,STRAT,TIMESCALE,TRIGGER
1363,a106481_p16_2748_2015a_164,a106481_p16_2748_2015a.json,106481,209,Annual,164,"further exploration, potential, mineralization",FURTHER EXPLORATION Results from previous exploration work in the Seven Seas Project area point to the potential for shallow economical gold mineralization in the region of which the P16/2748 tenement forms part of.,True,164,164,,,gold,,,,,"FURTHER EXPLORATION, potential, mineralization"
1266,a101809_e47_1763_2013ps_15789857_31,a101809_e47_1763_2013ps_15789857.json,101809,38,Partial Surrender,31,"prospective, mineralisation, prospect","The majority of MMIF outcrop is of the Nammuldi Member with limited exposure of McLeod and Mount Newman members. Most of the Mt Newman exposures are mineralised and localised mineralisation is also seen throughout the Nammuldi member. E47/1763 also is comprised of outcropping Dales Gorge Member of the Brockman Iron Formation which has been prospective for mineralisation in FMG's Sheila Valley prospect to the north, however none of this ground was surrendered. Table 1: Geology Summary Tenement Activity Holes Drilled (Surrendered Blocks) Metres Drilled (Surrendered Blocks) E47/1763 (19 blocks dropped) Geological reconnaissance and mapping, RC Drilling, downhole geophysical surveying 105 3734 Publicly available data and historic exploration reports were compiled.",False,31,33,,Newman,,,,"MMIF, Nammuldi Member, Mount Newman members, Nammuldi member, Dales Gorge Member, Brockman Iron Formation",,"mineralisation, prospective, mineralisation, prospect"
552,a079711_hill_50_annual_2008_11920544_100,a079711_hill_50_annual_2008_11920544.json,79711,335,Annual,100,optimisation,"The steep south dipping southern contact with ultramafics contained some higher grades associated with thick quartz veins. A cut-back and renewal of mining occurred between March and May 2004 finishing at 437.5mRL. Re optimisation was conducted in 2006-07 and further residual ore was identified at ambient gold prices that warranted another cut back. Production commenced in May 2007 and for the period July to August 2007 (when mining ceased) a total of 66,550 t were mined at a grade of 1.27 g/t for the recovery of 2,406 oz gold. 3.1-5 Golden Stream Open Pit (M58/185) Delineation of the Golden Stream felsic/mafic contact hosted mineralisation was initiated in 2005.",False,100,101,"between March, May 2004, 2006-07, May 2007, the period July to August 2007, 2005",,"gold, gold",,quartz veins,,,"higher grades, optimisation, mineralisation"
969,a088884_c122_2009_2009_2010a_16893512_35,a088884_c122_2009_2009_2010a_16893512.json,88884,72,Annual,35,prospective,"Tracks to areas of interest and grid trees in those areas can be cleared using this approach either calcrete sampling or aircore drilling can use these access tracks with only a minimal initial environmental footprint. The repeat and infill calcrete sampling around the BHP Au anomalous calcrete samples should be completed. Reconnaissance lines of aircore over prospective geology should also be planned together with calcrete sampling, as discussed in CSAs previous memorandum. Geochemical sampling contractors such as Pathfinder or AusEx Exploration Services should be contacted for quotes on collecting calcrete samples. Possible contractors, including local farmers, Esperance based contractors or the contractors working on the Parmango road, able to clear the main access routes into the areas of interest should be identified and their rates and availability determined.",False,35,35,,Esperance,,,"calcrete, calcrete, calcrete, calcrete, calcrete",,,"anomalous, prospective, Possible"
1440,a091672_c261_1997_2011a_12941159_137,a091672_c261_1997_2011a_12941159.json,91672,1496,Annual,137,broad,"The survey area is however located within two Priority 3 Ecological Communities known as Mt Holland and North Ironcap which form part of the Ironcap Hills vegetation complexes. To date none of the Ironcap Hills within the Forrestania region are within Conservation Reserves. There has been broad scale regional surveys of the Forrestania area conducted by Beard (1972) and Newbey & Hnatuick (1988) however detailed data for each Banded Ironstone Formation that forms the Ironcap Hills Vegetation Complex is limited. Beard (1972) defined the vegetation of the greenstone belt stretching from Mt Holland (SW) to Hatter Hill (NE) as the Forrestania system. This system includes granites, quartzites, and banded ironstones that formed prominent rocky ridges.",False,137,138,"1972, 1988, 1972","Forrestania, Forrestania, Forrestania",,,"Ironstone, granites, quartzites, ironstones",greenstone belt,,broad
676,a081890_file verification list_12419589_4,a081890_file verification list_12419589.json,81890,6,Annual,4,prospect,Drill sample Stream sediment Soil Rock chip Laterite Water Biogeochemistry Isotope Whole Rock Mineral analysis Other (specify) Radiometrics Magnetics Gravity Digital terrain modelling Electromagnetics SP/AP/EP IP AMT Resistivity Complex resistivity Seismic reflection Seismic refraction Well logging Geophysical interpretation Other (specify) Regional Reconnaissance Prospect Underground Costean Aeromagnetics Radiometrics Electromagnetics Gravity Digital terrain modelling Other (specify),False,4,5,,,,,"sediment, Laterite",,,
714,a082844_c109_2001_2009a_14921034_51,a082844_c109_2001_2009a_14921034.json,82844,323,Annual,51,significant,"RC drilling was also conducted on 80 metre stepout sections to test the northwest extensions of the Salt Creek mineralisation. The initial phase of sterilization drilling for the location of the waste dumps at Salt Creek was conducted during the work year. A summary drill hole plan with significant intercepts is presented in Figure 9 and detailed collar locations are shown in Plate II. The RC rigs use a 5.5 inch sized face sampling RC hammer bit that delivers the sample into the cyclone and each metre is collected in a green plastic bag. A riffle is used to split the main sample to yield a second sample 1/8th of the mass of the original sample, which is collected in a calico bag.",False,51,51,the work year,"Salt Creek, Salt Creek",,,plastic,,,"mineralisation, significant"
1190,a098835_by_2919_2013s_16415698_58,a098835_by_2919_2013s_16415698.json,98835,84,Final Surrender,58,"mineralisation, mineralisation","No field programs were enacted as the company changed focus. Exploration Licence, 69/2919, formed part of Emergents Marymia Gold Project is situated 91 km northeast of the Plutonic Gold Mine. The exploration target is gold and sediment-hosted base metal mineralisation within the Palaeoproterozoic sediments, and gold mineralisation in Archaean rocks. The tenement reported here, E69/2685, is located 80km northeast of the Plutonic Gold Mine in the Murchison Mineral Field of Western Australia. The target is base metals, iron ore and gold: work is at an early stage.",False,57,59,,"Plutonic Gold Mine, Plutonic Gold Mine, Murchison, Western Australia","Gold, gold, gold, gold","base metal, base metals, iron ore","sediment, sediments",,Archaean,"mineralisation, mineralisation"
1261,a101663_yeelirrie_e57_739_2013s_16248651_48,a101663_yeelirrie_e57_739_2013s_16248651.json,101663,77,Final Surrender,48,mineralisation,"Exploration for uranium in the granite sequence has been minimal, and there has been only cursory investigation of other channels within the valley. In 1970, regional radiometric surveys defined a large and intense anomaly in the Yeelirrie Valley drainage system. Shallow auger drilling by Western Mining Corporation in 1971 showed a large body of carnotite mineralisation hosted by calcrete. Over the subsequent 12 years, over 6,000 drill holes comprising reverse circulation (RC) and diamond drilling defined a sizeable resource of 35 Mt of 0.15% U3O8, for 52,500 t of U3O8. Permission to mine was refused under the three mines policy which limited uranium exports during the 1980s.",False,48,48,"1970, 1971, the subsequent 12 years, the 1980s",Yeelirrie,"carnotite, diamond","uranium, uranium","granite, calcrete",,,mineralisation
276,a073410_de_2006a_15311021_96,a073410_de_2006a_15311021.json,73410,122,Annual,96,"mineralisation, significant","Altona-Cosmopolitan: A significant number of old workings lie along the Altona trend, which strikes north-south and dips -50o to the east. It is parallel to similar structures at Cosmopolitan to the west and the Champion deposits to the northwest and all appear to be high angle reverse faults with steeply plunging ore shoots. All three deposits lie within a north to northeast trending corridor of mineralisation that defines the Kookynie mining centre and occur along structures of significant strike extent, up to 2.5km in the case of the Champion Trend. The magnetic interpretation suggests these three deposits and the Puzzle deposit may all lie within or along the contact of the same granite body although there is a significant degree of extrapolation under cover. The radiometric data indicates the granite is potassium rich and this may in part reflect an alteration phenomena (sericite/K fsp).",False,96,98,,Kookynie,sericite,,"granite, granite",,,"significant, mineralisation, significant, significant"
1150,a097305_sr e38_1866_2013_12618201_59,a097305_sr e38_1866_2013_12618201.json,97305,148,Partial Surrender,59,rise,"The Siliciclastic Sequences are the youngest Archaean rocks and are predominantly turbidites but include carbonaceous shale, sandstone, conglomerate, chert and magnetic shale (BIF). A regional, four-stage, contractional deformation history has been constructed for the Eastern Goldfields (Morey, 2007): D1 - the earliest shortening event is characterised by a roughly NS directed thrusting and recumbent folding that resulted in large scale repetition of the greenstone sequences. D2 - a major stage of ENE-WSW shortening which gave rise to NNW trending, regional, upright folds and major reverse faulting/thrusting. This deformation episode was associated with multiple shortening episodes and intervening extensional stages. D3 - further ENE-WSW shortening reactivated NNW-trending D2 structures to produce dominantly sinistral strikeslip ductile faults.",False,59,59,2007,Goldfields,,,"turbidites, shale, sandstone, conglomerate, chert, shale, BIF, greenstone",,Archaean,rise
93,a084529_e59_1340_2009a_14015571_162,a084529_e59_1340_2009a_14015571.json,84529,165,Final Surrender,162,prospects,"It was noted that the digital data supplied by the previous operator could not be opened, and that no further copies of the data could be obtained. No further reports were submitted for this tenement and it was surrendered. Prospects: Carlaminda Assays: Ag; As; Au; Bi; Co; Cr; Fe; Mn; Mo; Ni; Pb; Sb; V; Zn Drilling: Type No. No further reports were submitted and the tenements were surrendered. Prospects: Carlaminda Assays:",False,162,162,,,,,,,,"could be, Prospects, Prospects"
429,a076792_bassit bore e09-1088 annual tech rep-07_11592146_44,a076792_bassit bore e09-1088 annual tech rep-07_11592146.json,76792,50,Annual,44,"extensive, significant","Field reconnaissance mapping and prospecting identified extensive areas of decomposed and altered granitic rocks in the area of the quartz breccia, and confirmed a significant target beneath cover along strike.",True,44,44,,,quartz,,"granitic rocks, breccia",,,"extensive, significant"
794,a085161_p26_3331_2009s_15432178_169,a085161_p26_3331_2009s_15432178.json,85161,314,Final Surrender,169,"mineralisation, correlation, mineralisation","An idealised komatiite sheet flow stratigraphic succession in descending order is: gabbro (non cumulate) pyroxenite pyroxene cumulates (including harrisite) OOC olivine orthocumulate, thin heterogeneous units oMC olivine mesocumulate, upper oAC olivine adcumulate, thick uniform sheet flow sequence oMC basal olivine mesocumulate oOC basal thin unit olivine orthocumulate Textural interpretations are an important exploration guide, and are a prime basis for drillhole siting. Strong drilling results can be rapidly encountered through effective field interpretation of komatiite facies based on textural observations. Some sulphide mineralisation has been noted in the fresh ultramafics, but there does not appear to be any correlation between the sulphides and elevated nickel mineralisation within the ultramafics at depth. Drill log data indicates that the ultramafics consist of orthocumulate serpentinites and olivinites, while the granites contain lenses of felsic porphyry, and fine-grained diorites and rhyolites. The mafics consist of gabbro, dolerite and basalt.",False,169,169,,,"pyroxene, olivine, olivine, olivine, olivine, olivine, sulphide, sulphides, nickel",,"komatiite, gabbro, pyroxenite, komatiite, serpentinites, granites, porphyry, diorites, rhyolites, gabbro, dolerite, basalt",,,"mineralisation, correlation, mineralisation"
990,a090079_mt webber_cr568_e45-2496_a_2011_11477965_323,a090079_mt webber_cr568_e45-2496_a_2011_11477965.json,90079,503,Annual,323,follow up work,"The northern area was tested by the Sipa RAB program (to 30m) and by the five RC holes (to 100m). Three other RC holes (ABRC080, 191-2) were drilled by Atlas south of the anomaly in 2007/08 without success. Follow-up work in this area that should be considered: Ground geophysics (EM); and Preliminary drilling to follow-up targets from the geochemistry and/or geophysics. At Brass Buckle a malachite-chalcocite-chalcopyrite gossan returned rock chip samples up to 0.56g/t Au, 29% Cu and 92g/t Ag. Surface copper mineralisation was also located close-by at Primavera, Double Bar, Double Bar Extended (not on SRR ground, see page 76).",False,323,324,2007/08,,"malachite, chalcocite, chalcopyrite, copper",,gossan,,,mineralisation
179,a101970_c91_2005_2013a_clampton_camer 2013_12642867_14,a101970_c91_2005_2013a_clampton_camer 2013_12642867.json,101970,164,Annual,14,"anomalous, warranting follow up","At the Yarbu North target auger soil sampling defined two extensive areas of strongly anomalous gold in soils (Andromeda North and Andromeda South). Reconnaissance RAB drilling of Andromeda North returned several plus g/t gold intersections requiring follow-up RAB drilling. Widely spaced reconnaissance auger soil sampling along the inferred position of the Clampton Shear Zone (CSZ) within E77/864 returned anomalous gold results up to 746 ppb, warranting follow-up infill soil sampling followed by RAB drilling. A single RAB drill traverse testing a discrete aeromagnetic high along the CSZ returned anomalous gold, suggesting that aeromagnetic highs are high priority targets for follow-up RAB drilling. Exploration undertaken by Polaris during 2006 comprised infill auger soil sampling and follow-up reconnaissance RAB drilling.",False,14,14,2006,,"gold, gold, gold, gold",,,,,"extensive, anomalous, anomalous, anomalous"
28,a076310_hppl balfour downs final_11143793_3,a076310_hppl balfour downs final_11143793.json,76310,143,Annual,3,proposed,"Twelve proposed drill pad locations were surveyed, as well as approximately 7 km of proposed track connecting proposed drill pads and existing access tracks (Figure 2.1, Appendix C). Quadrats measuring 50 m x 50 m were surveyed at each of the 12 proposed drill pad locations. Proposed access tracks were surveyed using a foot traverse of the central alignment, along with a 25 m wide buffer either side of the centre line. This provided a 50 m wide survey corridor for each proposed track. The position of each proposed drill pad and access track was established using a GPS.",False,3,3,,,,,,,,"proposed, proposed, proposed, proposed, Proposed, proposed, proposed"
497,a078454_c89_2004_mainrpt_2008a_16652760_265,a078454_c89_2004_mainrpt_2008a_16652760.json,78454,350,Annual,265,mineralised,"17 Table 8 PWA Boorara Total (All Categories) Resource Summary 0.5g/t COG OK models, June 2006 . 18 Table 9 PWA Diamond Drillhole Collars . 22 Table 10 PWA Diamond drilling mineralised intercepts (NOTE not adjusted for recovery) . 27 Table 11 Descriptive statistics all composites within sulphur wireframes . 39 Table 12 Descriptive statistics all composites within zinc wireframes .",False,265,265,June 2006,Boorara,"Diamond, Diamond, sulphur, zinc",,,,,mineralised
181,a102360_m47_1471_2014p_9497100_9,a102360_m47_1471_2014p_9497100.json,102360,141,Partial Surrender,9,mineralisation,"No CID, nor elevated iron assays, were observed in these holes. The CID was mapped as continuous in strike in this area- however 2013 field observations demonstrated sub-continuous outcrop/subcrop in this area. Figure 7: Rocklea Project Mineralisation (CID) Page 15 of 24 It is located 35km west of Tom Price and 60km north of Paraburdoo. CID was first discovered proximal to Hardey River, north of Rocklea Station, in a scout drilling programme conducted in 1974 by Hamersley Exploration Pty Ltd (HamEx).",False,9,9,"2013, 1974","Tom Price, Paraburdoo, Hamersley",iron,"CID, CID, CID, CID",,,,discovered
938,a088191_for_c261_1997_2010a_14726625_1390,a088191_for_c261_1997_2010a_14726625.json,88191,1814,Annual,1390,rises,"Hannans Reward Flora and Vegetation Survey Botanica Consulting 16 Banksia viscida (P3) This priority species is a densely branched, non-lignotuberous shrub which grows 0.4-1m high. It has orange flowers that appear between July and October. It inhabits lateritic rises (WAHERB, 2010). This species was located within the Mixed Mallee vegetation group. GPS co-ordinates of the location and population size of this species are provided in Appendix 11.",False,1390,1390,"between July and October, 2010",,,,Mixed,,,rises
235,a072409_western tanami combined annual report_14271769_990,a072409_western tanami combined annual report_14271769.json,72409,1640,Annual,990,high grade,"Metallurgical testwork conducted upon variability composites from Coyote Gold Project for Tanami Gold NL. Geology and Mineralisation of the Coyote Gold Deposit, 2005, Volume 1 Carras, Nov 2003. High grade cutting analysis. Report on check assaying at Coyote Fawcett, June 2005. Findings on assaying conducted to June 2005.",False,989,990,"2005, Nov 2003, June 2005, June 2005",,"Gold, Gold",Gold Deposit,,,,High grade
241,a072670_e52_1598_2005a_10458772_83,a072670_e52_1598_2005a_10458772.json,72670,90,Annual,83,higher grade,"This postulated magma driven epithermal system is considered to at least partly explain the lack of Zn at the Abra Resource compared to more conventional basin margin hydrothermal sedex type deposits. A global inferred resource at the Abra Resource, quoted back in 1987, was 200 Mt at 1.8% Pb, 0.18%Cu, 6g/t Ag and 0.18g/t Au and had very low Zn values, with sphalerite only occurring in the lower stringer zone5,6. Abra Mining are currently resuming diamond drilling to identify a smaller higher grade resource with grades expected to be above 10% Pb but restricted to maybe only some 1km or more of strike. Geological Survey of Western Australia. Geological Survey of Western Australia.",False,83,83,"1987, 0.18%Cu","Western Australia, Western Australia","hydrothermal, sphalerite, diamond",,,,,higher grade
1002,a090404_rb_e80-2612_2011a_14159889_267,a090404_rb_e80-2612_2011a_14159889.json,90404,276,Annual,267,mineralisation,"The Emull base metal occurrence within the E80/2612 tenement area is hosted by altered and contact metamorphosed calc-silicate rocks, which have been partially assimilated by the Emull gabbro. The deposit was recognised as a series of copper stained, siliceous gossans located adjacent to the contact between the Emull gabbro and felsic volcanic rocks of the Koongie Park Formation. Thin semi-massive and disseminated mineralisation is confined to 4 discontinuous but apparently stratabound lenses, dominated by sphalerite, with subordinate chalcopyrite and galena. The largest lens has a strike length of 500m and a maximum width of 50m. The genesis of mineralisation at Emull is not certain, although models based on an origin as a volcanic hosted massive sulphide (VHMS) deposit partially assimilated during intrusion of gabbro, or as a skarn developed during intrusion of gabbro into carbonate units within the Koongie Park Formation, have been proposed.",False,267,268,,"galena, genesis","silicate, copper, sphalerite, chalcopyrite, sulphide, carbonate","base metal, VHMS","gossans, felsic volcanic rocks, gabbro, skarn, gabbro","Emull gabbro, Emull gabbro, Koongie Park Formation, Koongie Park Formation",,"mineralisation, mineralisation, proposed"
1123,a096028_sr_e69-2236_2012_11112214_1890,a096028_sr_e69-2236_2012_11112214.json,96028,3698,Final Surrender,1890,broader,"Complications of Anomaly Interpretation In the grading process, small, discrete conductors were given a better grade than larger bodies, which were assumed to be lithological. Lithological conductors are generally formational (i.e. composed of a particular stratigraphic unit), with extended strike lengths, broader anomalies, and moderate to large electromagnetic responses. Often their conductivity is due to graphitic content rather than economic mineralisation. However the conclusion should not be drawn that larger conductors are definitely not mineralised.",False,1890,1892,,,,,,,,"broader, economic mineralisation"
383,a075664_2007 annual report_26mar2007_16608207_230,a075664_2007 annual report_26mar2007_16608207.json,75664,299,Annual,230,prospective,Magnetite is not common in the felsic units. City Resources believed the area was prospective for gold mineralisation as it was close the Bamboo Creek Shear Zone and North Pole mining centres. They completed programmes of: Bulk Stream Sediment sampling; Bulk Soil sampling; Rock chip sampling of fault systems; General geological reconnaissance of prospective areas; and Re-assaying of diamond drill pulps for gold. City Resources detected low grade gold anomalism in both rock chips and soil sampling programmes. These results were disappointing and City Resources allowed the exploration licence to lapse.,False,230,232,,Bamboo,"Magnetite, gold, diamond, gold, gold",,Sediment,,,"prospective, mineralisation, prospective, low grade, anomalism"
414,a076489_norseman_18510587_31,a076489_norseman_18510587.json,76489,130,Annual,31,exploration drilling,"Rose S. and Kelly S. (2005) Central Norseman Gold Operations Resource and Reserve Statement March 31 2005. Appendix 1 Drill Hole Data Appendix 2 Croesus Mining NL lithology codes Appendix 3:Norseman Operations Mineral resource and Ore Reserve Report, 30/06/2007. Additional exploration activity involved field reconnaissance, data review, geological interpretation, geophysical review and interpretation and the preparation of exploration drilling programmes. In June 2006 Croesus Mining NL, the manager of the Norseman operations, entered Administration. This resulted in the restriction of exploration activity while the operation while attempts were made to re-structure the operation, or complete a sale of the operation.",False,31,32,"2005, March 31 2005, 30/06/2007, June 2006","Norseman, Norseman, Norseman",Gold,,,,,exploration drilling
169,a100272_c74!2012 warrawagine_20131209_2013 combined annual report_17162825_88,a100272_c74!2012 warrawagine_20131209_2013 combined annual report_17162825.json,100272,199,Annual,88,extensive,"Jones et al (2013), details the structural controls and timing of fault hosted manganese at Woodie Woodie. Consolidated Minerals Ltd, Ripon Hills project located 13km to the south of E45/3853 may represent the most significant undeveloped manganese resource in the province and is currently the focus of an extensive drilling campaign by Consolidated Minerals Ltd. Balfour Downs (Nicholas Downs) operated by Hancock Prospecting Pty Ltd has been in care and maintenance since ceasing operation in 2011. Shaw River Manganese Ltd, have conducted extensive exploration on their Barramine Project situated 7km to the east of E45/3854 and E45/3854 since 2009. Although numerous manganese intersections from RC drilling have been announced, no resource exists in the public domain. The only significant announcement relating to manganese in recent times appears to have come from Spitfire Resources Ltd.",False,88,88,"2013, 2011, 2009","Woodie Woodie, Nicholas Downs","manganese, manganese, Manganese, manganese, manganese",,,,,"significant, extensive, extensive, significant"
1378,a107516_20151130_e45_3615_partial surrender_95,a107516_20151130_e45_3615_partial surrender.json,107516,206,Partial Surrender,95,extensive,"The dykes range in thickness, being between 10 to 100 metres. h. FORTESCUE GROUP The weakly metamorphosed volcanic and sedimentary Neo Archean Fortescue Group is the most widespread supracrustal succession in the region. The succession is confined to the east along the western margin of the extensive northeast Pilbara Sub Basin of the Fortescue Basin. The Fortescue Group uncomformably overlies, or is faulted against, the Mount Edgar Granitic Complex, the Marble Bar, Kelly and McPhee Greenstone belts, and the Gorge Creek Group. The Black Range Dolerite Suite is considered to be part of the feeder dyke system for the Mount Roe Basalt.",False,95,95,,"Pilbara, Fortescue Basin, Marble Bar",,,,"FORTESCUE GROUP, Fortescue Group, Fortescue Group, Greenstone belts, Gorge Creek Group, Black Range Dolerite Suite, Mount Roe Basalt",Archean,extensive
