index,event_id,filename,anumber,sentence_count,report_type,sentence_idx,sentence_triggers,event_text,label,lower_idx,upper_idx,DATE,LOCATION,MINERAL,ORE_DEPOSIT,ROCK,STRAT,TIMESCALE,TRIGGER
1387,a108629_a108629_v1_report_77,a108629_a108629_v1_report.json,108629,99,Final Surrender,77,"potential, confirm the presence","The area is of geochemical interest because it is a clear As-MoCd-Bi peak, within a larger elevated zone that is coincident with the mapped outcrop and associated soils. There is broadly elevated Au in the original and infill auger. This area is of interest mainly because of the potential to confirm the presence and fertility of the Hootanui Shear with reconnaissance mapping. Though close to outcrop, the peak pathfinder anomaly is north and west of the prominent breakaway and mapped granite exposure in other words, the anomaly appears to be in sand cover, which makes it potentially more significant. The rock chip sample was taken as a follow up to ground inspections on an anomalous Ni in soil anomaly (auger) from sand dominated terrain.",False,77,78,,,,,"granite, sand, sand",,,"potential, confirm the presence, potentially, significant, anomalous"
29,a076418_sabbathm51-322_annuareport2006_2007_15687559_3,a076418_sabbathm51-322_annuareport2006_2007_15687559.json,76418,57,Annual,3,mineralisation,"Geology: Gold mineralisation is related to the development of shear zones and quartz veins focused along a mafic - felsic contact with historical shafts and workings located over approximately 500 metres of strike. The Sabbath deposit is an Achaean aged gold deposit located approximately 15 kilometres north of Meekatharra in Western Australia. Gold mineralisation is related to the development of shear zones and quartz veins focused along a mafic - felsic contact with historical shafts and workings located over approximately 500 metres of strike. During the last four years Au Mining has spent in excess of $170,000 conducting drilling and prefeasibility activities and in that time has conducted systematic drilling and earthsawing over approximately 400 metres of strike length which has defined a JORC compliant indicted resource of 145,000 t @ 2.52 g/t Au, located within 50 metres of the surface. Some of the more significant intersections returned included 8m @ 15.92 g/t Au and 16m @ 4.28 g/t Au, with a number of intersections requiring follow up drilling with mineralization open at depth.",False,3,3,"Sabbath, the last four years","Meekatharra, Western Australia","Gold, Gold",gold deposit,"quartz veins, quartz veins",,,"mineralisation, mineralisation, significant, mineralization, open at depth"
1384,a108234_wodgina_e45-2404_cr930_s_2015_77,a108234_wodgina_e45-2404_cr930_s_2015.json,108234,103,Final Surrender,77,prospective,"Lithologies are predominantly metamorphosed to amphibolite facies; however there are remnants of unaltered basalts and sediments in the more central portions of the belt. The mafic volcanics are thought to belong to the Warrawoona Group; the clastic sediments are tentatively assigned to the Corboy Formation and the BIFs and cherts to the Cleaverville Formation. The prospective Cleaverville Formation usually occurs near the centre, sitting on older Warrawoona Group volcano-sediments, which occupy the flanks near the granites. Cleaverville Formation sediments occupy a complex central position between the outer amphibolites and the three inner bodies of maficultramafics and sit unconformably on the Warrawoona Group over most of the area, but are interpreted to overlie Corboy Formation sediments in the south. They are dominated by fine-grained sediments, which include siltstones, interbedded siltstones and cherts, BIFs and bedded cherts.",False,77,77,,,,,"amphibolite, basalts, sediments, clastic sediments, BIFs, cherts, sediments, granites, sediments, amphibolites, sediments, sediments, siltstones, siltstones, cherts, BIFs, cherts","Warrawoona Group, Corboy Formation, Cleaverville Formation, Cleaverville Formation, Warrawoona Group, Cleaverville Formation, Warrawoona Group, Corboy Formation",,prospective
1400,a109355_a109355_v1_report_10,a109355_a109355_v1_report.json,109355,69,Final Surrender,10,mineralization,"South of Turee Creek, polymetalic gold platinum mineralisation has been located along the Bresnahan/Wyloo contact. BP Minerals defined gold mineralisation in the Neerambah springs area south of Paraburdoo. Gold mineralization is adjacent to the contact zone between the Pilbara Block and Ashburton Basin hosted by sediments of the Wyloo Group. Secondary uranium mineralisation north of Turee Creek Homestead within the Bresnahan Group was tested by Noranda. As with the BP gold targets this mineralisation is adjacent to the major structural contact between the Pilbara Block and Ashburton Basin.",False,10,12,,"Wyloo, Paraburdoo, Pilbara Block, Ashburton Basin, Homestead, Pilbara Block, Ashburton Basin","gold, platinum, gold, Gold, gold",uranium,sediments,"Wyloo Group, Bresnahan Group",,"mineralisation, mineralisation, mineralization, mineralisation, mineralisation"
1434,a087151_lake_giles_e30_322_annual_report_2010 (replacement)_16599869_37,a087151_lake_giles_e30_322_annual_report_2010 (replacement)_16599869.json,87151,102,Annual,37,possibly,This elongated lense shaped belt is bounded by major north-northwest trending fault/shear zones. The Archaean sequence has been intensely folded. At least five possibly sinistral (anti-clockwise) fault zones of similar but slightly more northwesterly trend are interpreted within the widest part of the belt. These are believed to successively repeat the layered succession. Also two northerly trending sinistral faults obliquely crosscut the belt in this area.,False,37,38,,,,,,,Archaean,possibly
537,a079371_ab_e47-1528-i_2008a_14453449_294,a079371_ab_e47-1528-i_2008a_14453449.json,79371,343,Annual,294,potential,"Representative bulk sampling of the alluvial fan material to validate the conceptual resource and feasibility of mining and upgrading this material. A detailed, low level magnetic and radiometric survey to refine the interpretation of the Ashburton BIFs and possible structures hosting copper-gold mineralisation. Review and further evaluation of the copper gold potential of the project area. The potential for DSO hematite from the associated gossanous material should be evaluated at the same time. Detailed mapping and sampling of BIF layers interpreted at the base of the Ashburton Formation for potential DSO hematite.",False,294,295,,,"copper, gold, copper, gold, hematite, hematite","DSO, DSO","BIFs, BIF",Ashburton Formation,,"possible, mineralisation, potential, potential, potential"
939,a088231_doon doon ar 2010 e80-3745_12057696_59,a088231_doon doon ar 2010 e80-3745_12057696.json,88231,98,Annual,59,potential,"This licence formed part of a much larger group of tenement which was explored from 1976 onwards by the Ashton Exploration JV which led to the discovery of several kimberlite dykes along the western edge of the Halls Creek Mobile Belt including the Argyle Pipe. This work initially comprised a regional drainage sampling followed up later by additional sampling and aeromagnetic surveys. Two magnetic anomalies (DUN07 and DUN08) within E80/2294 were identified as having the potential to be caused by diamondiferous diatremes. Follow-up gravity surveys did not reveal a characteristic low typical of a concealed kimberlite pipe. However, loam samples collected at both anomalies tested positive for kimberlitic indicator minerals and the chemistry of the chromite grains from DUN08 was typical of a kimberlitic/lamproitic source.",False,59,60,1976,"Halls Creek, Argyle",chromite,,"kimberlite, kimberlite",,,potential
580,a080365_e15_755_2008p_18189780_118,a080365_e15_755_2008p_18189780.json,80365,153,Partial Surrender,118,anomalous,"All sampling was conducted by North Eastern Goldfields Exploration Pty Ltd (Andrew Pumphrey), a Kalgoorlie-based geochemical contractor and geologist, who provided a log of the pedogenic carbonate content of each sample and the surface geology/regolith at each sample location. Samples were assayed at Genalysis Laboratories in Perth for gold using aqua regia digest and a low level AAS finish (1ppb Au detection limit, Genalysis code; B/ETA) and for arsenic (10ppm As), copper (1ppm Cu), nickel (1ppm Ni), lead (1ppm Pb) and zinc (1ppm Zn) using aqua regia digest and a standard AAS finish (detection limits in brackets, Genalysis code; B/AAS. Numerous anomalies and anomalous trends were identified by the auger programmes and several direct drill targets were generated in the northern and southern parts of the project area. Figure 3: Map showing auger sampling within surrendered area of E15/755. The conclusion from the data review was that the QVR Project has not been adequately explored for gold.",False,118,118,,"Goldfields, Kalgoorlie, Perth","carbonate, gold, arsenic, copper, nickel, lead, zinc, gold",,regolith,,,anomalous
200,a108408_a108408_v1_report_222,a108408_a108408_v1_report.json,108408,224,Final Surrender,222,mineralisation,"A very low impact (Niton) surface geochemical programme was planned to test this contact from the Emily Ann mine in the North to a location 9km south of the Windy Hill camp. Test work indicated that Niton analysis of the 36 micron fraction of samples would be sufficient to show up and near-surface mineralisation. Test work was conducted over the Maggie Hays mineralisation. Due to falling nickel prices and the Operations being put back into a Care & Maintenance position, this programme was put on hold.",False,222,222,,Maggie Hays,nickel,,,,,"mineralisation, mineralisation"
369,a075365_widge_p154638_07a_16804060_40,a075365_widge_p154638_07a_16804060.json,75365,96,Annual,40,possible,"This programme of work proceeded over a period of some 3.5 years until late 1997 and comprised the drilling of 88 vertical aircore holes for a total of 6731 metres along east to west drill traverse lines spaced at irregular intervals. Towards the end of the programme, 5 inclined RC holes were drilled for a total of 645 metres to test further zones of elevated nickel values obtained from earlier aircore drilling but only one hole reached target because of difficulty in penetrating thick transported overburden. Owing to these drilling difficulties, continuation of this follow-up programme was abandoned and no down hole geophysical surveying was possible. Drill samples were selectively analysed for nickel, chromium, cobalt, zinc and gold at variable drill sample intervals based on geology. However, most mafic and ultramafic sequences were sampled over 2 or 1 metre intervals.",False,40,40,"some 3.5 years, late 1997",,"nickel, nickel, chromium, zinc, gold",,,,,possible
1075,a093990_annual report 20120618_e77_1648_12564418_38,a093990_annual report 20120618_e77_1648_12564418.json,93990,85,Annual,38,mineralization,"5 2.2 Local Geology E77/1648-I is located 50 km east of Cliffs Asia Pacific Iron Ore Pty Ltd Mt Jackson mining centre. Significant mineralization within the Mt Jackson mining centre consists of: 2.2.1 J1 Deposit This deposit forms a prominent ridge at the western end of the Mount Jackson Range and is exposed over a strike length of approximately 2km and dipping to the north east at 80 to 85 degrees. The sedimentary hanging wall suite is comprised of BIF, meta-sediments and black shale with pyritic mineralization. The foot wall to mineralisation is basalt. A hydrated cap of usually vitreous goethite overlies the primary mineralisation of thick macroporous goethite interspersed with thin hydro-hematite zones.",False,38,38,,"Cliffs, Jackson, Jackson, Mount Jackson","goethite, goethite, hematite",Iron Ore,"BIF, sediments, black shale, basalt",,,"Significant, mineralization, mineralization, mineralisation, mineralisation"
633,a081133_c198_2007_text_2008a_15349268_260,a081133_c198_2007_text_2008a_15349268.json,81133,476,Annual,260,significantly,"There are a substantial number of additional constraints and relationships on the database to keep the integrity of the database at a high standard. At some stage in the coming six or so months, it is recommended that the FerrAus Database be audited by Senior Staff at Maxwell GeoServices in order to check that no major relationships/constraints etc. have been dropped or significantly altered. A couple of further recommendations are below: Ensure all Alpha records are less than 90 degrees in tblDHStructureOrient Ensure all Beta records are between 0 and 360 degrees in tblDHStructureOrient Ensure all Recovery_Pct values in tblDHCoreRecovery are all reasonable values. The constraint was changed to allow up to 2000% in order for all data to be loaded through.",False,260,260,the coming six or so months,,,,,,,"substantial, significantly"
860,a086644_m24_39_ 2009a_8567832_56,a086644_m24_39_ 2009a_8567832.json,86644,163,Annual,56,"high grade, mineralisation","Hydromorphic activity is also favoured in structurally prepared weathering zones, which accounts for the more localised nature of high grade Ni-Co mineralisation. The prospective (for nickel laterite mineralisation) eastern Kalpini ultramafic sequence is formed by a range of komatiite lithologies within a single thick, fractionated flow unit.",True,56,57,,,nickel,,"laterite, komatiite",,,"high grade, mineralisation, prospective, mineralisation"
1050,a092677_e53_1525_2011a_14832057_97,a092677_e53_1525_2011a_14832057.json,92677,160,Annual,97,"potential, prospect, encouraging, prospects","Both these sets of former workings appear to be on line with the Forked Stick East structure. Two samples taken from Otho, 440m further east from Alban and where minor former workings are hosted by sheared ultramafics, returned 0.55 ppm Au, YARS059, and 0.11 ppm Au, YARS058. These samples are not considered to be representative of the potential of any prospect, however they are encouraging in that certain of the prospects have received only limited previous exploration. One rockchip sample was collected from E53/1525. The rockchip sample locations are shown on Figure 5.",False,97,98,,,,,,,,"potential, prospect, encouraging, prospects"
748,a084342_mandilla_2009_m15_633_e15_789_annual_16231744_473,a084342_mandilla_2009_m15_633_e15_789_annual_16231744.json,84342,586,Annual,473,significant,"Figure 1 Mandilla Project Location Figure 2 Mandilla Tenement Location Figure 3 Regional Geology Figure 4 Local Geology Figure 5 East Mandilla Schematic Long Section Figure 6 East Mandilla Deposit Optimal Pit Design Figure 7 Mandilla Project Bedrock Anomaly Summary Plan White Range Gold involved steep high grade quartz reefs with Quartzite walls. Significant dilution was incurred at this mine because of the necessity to blast ore and waste simultaneously. The introduction of a wet trommel screen after the crushing process at this mine reduced the ore stream by approximately 40% and saved unnecessary grinding and treatment costs. Location: The Mandilla Project is located 60 km south of Kalgoorlie and 20 km south west of Kambalda, in the Eastern Goldfields Province of Western Australian .",False,473,474,,"Long, Kalgoorlie, south west, Kambalda, Goldfields","Gold, quartz",,"Bedrock, Quartzite",,,"high grade, Significant"
54,a079257_full compilation of report_16797693_127,a079257_full compilation of report_16797693.json,79257,163,Annual,127,mineralisation,"It appears to have been discovered in the early 1950s, as a result of ground prospecting activities of United Uranium. It is not clear whether United Uraniums airborne radiometric survey of the area contributed to the discovery. No United Uranium report has been sighted by the present author, but a Rio Tinto Report of 1955 describes the mineralisation as being on fracture surfaces within, and adjacent to, coarse fault breccia zones which have been intruded by dolerite. The identified uranium mineralisation (mostly torbernite) is hosted by both granite and dolerite, as well as by the breccia clasts which include both Proterozoic sediment and granite. The fault breccia was interpreted to be part of the Dunham Fault (Denham Fault Zone).",False,127,127,"the early 1950s, 1955",Denham,torbernite,"Uranium, Uraniums, Uranium, uranium","fault breccia, dolerite, granite, dolerite, breccia, sediment, granite, fault breccia",,Proterozoic,"discovered, mineralisation, mineralisation"
320,a074492_battler_glendower_2006_combined_annual_report_13969668_118,a074492_battler_glendower_2006_combined_annual_report_13969668.json,74492,755,Annual,118,proposed,"St Barbara Limited 1 2 POLARIS METALS NL Report number 2007-7 SUMMARY OF MINERAL EXPLORATION ACTIVITIES During the reporting period 1 November 2005 to 31 October 2006 Polaris Metals NL completed: a review and update of the previous optimisation study of the Battler gold resource. an extensive drillhole rehabilitation program over the Battler deposit. an Independent Geological Study of the Battler-Glendower project forming part of a proposed new float, Regatta Resources Limited FIGURES Figure 1 Location Map. 9 Figure 2 Tenements. INTRODUCTION The Battler-Glendower Project is managed by Polaris Metals NL, the holder of the tenements.",False,118,118,October 2006,,gold,,,,,"optimisation, extensive, proposed"
594,a080573_c28_1997_2008a_15225641_1403,a080573_c28_1997_2008a_15225641.json,80573,1522,Annual,1403,could be,"The taxon needs urgent survey and evaluation of conservation status before consideration can be given to declaration as threatened fauna. Priority Four Taxa in need of monitoring. (P4) Taxa which are considered to have been adequately surveyed, or for which sufficient knowledge is available, and which are considered not currently threatened or in need of special protection, but could be if present circumstances change. These taxa are usually represented on conservation lands. Priority Five Taxa in need of monitoring.",False,1403,1403,,,,,,,,could be
937,a088191_for_c261_1997_2010a_14726625_224,a088191_for_c261_1997_2010a_14726625.json,88191,1814,Annual,224,possible,"OftheMLEMsurveys,onlythe2008surveyusingtheB?FieldSQUIDsensorisconsideredgoodqualityand effective in termsof identifying significantbedrockconductors.Figure2 shows theareacoveredby this surveyandthetwootherMLEMprogrammesfrom2004and2006,whichareconsideredpoorquality.The 2006surveyinparticularisanextremelynoisydatasetandnotmuchbetterthanastratigraphicconductor identifier.Althoughpartoftheareacoveredbythe2006surveyhasnowbeenflownwithVTEM,thatdoes notmeantheareahasnowbeeneffectivelytestedwithanappropriateEMmethod.TheVTEMsystemin reality isonlyarelativelyshallowpenetratingtechnique,sodeeperand/orhighlyconductivetargetscan stillbeundetectable.At some stage, furthergroundbasedEM in theseparticularareasandanyothers consideredprospectiveshouldbehighontheprioritylist. Fivenewanomalieshavebeen identified fromthehistoricalgroundEMsurveys.Allrequiresomesortof ground EM follow?up to confirm, except for target F2 which has been effectively modelled and recommendedfordrilltesting.AsummaryofeachanomalyisincludedinTable1. ApproxLocation Comments/Recommendations M1 750300E,6416450N WestofBeautifulSundaydeposit.Possible, short strike length,high conductancetargetidentifiedin2006MLEM.Withinlowinmagnetic image, approx 1km east of barren massive sulphides (pyrrhotite) drilled by Image Resources. Recommend FLEM approx 2?3 days, $10k.Mediumpriority. M2 750150E,6421450N Veryinterestinglocationoffsetfrommaintrendsandassociatedwith localisedmagnetic feature.Anomalous Pb,Au,Ag geochem but no nickelsocouldbeadifferentdeposittypeseeFigure3.Orientation ofsourceuncertainsorecommendfurtherMLEM.Highpriority.",False,224,224,2?3 days,,"sulphides, pyrrhotite",,,,,"Possible, Anomalous"
914,a087700_pad_mer_10_vol1_17392978_94,a087700_pad_mer_10_vol1_17392978.json,87700,860,Annual,94,mineralization,"The results of the optimisation study indicated relatively minor surpluses compared to the September 2008 optimization. This surplus is relatively low and it is anticipated that when pit designs are completed, the surplus can be easily erased hence it is not economical to mine the Bellevue deposit at this time. In April 2009, an infill drilling programme was designed to extend the western and northern end of the Bellevue gold mineralization in an attempt to further increase the resource estimate. In June 2009, the drilling programme was undertaken. A total of 14 drillholes for 1175 metres was completed.",False,94,95,"September 2008, April 2009, June 2009",,gold,,,,,"optimisation, mineralization"
434,a076906_c210-2007-2007a_pe_17072026_64,a076906_c210-2007-2007a_pe_17072026.json,76906,395,Annual,64,prospect,"Four metre composite samples were also collected and submitted for analysis for all drillholes. The one metre samples were submitted for intervals with visible alteration (quartz veining, sericite-chloritesulphidecarbonate alteration). A total number of 9 Aircore holes for 153m were drilled in QE1 South prospect to follow up anomalies from previous drilling (Table 9. and Figure 7. A total number of 40 Aircore holes for 1972m were drilled to test paleochannel; lignite-and gravel-bearing sands at base of paleochannel (Table and Figure ). Aircore Drilling Program, Lake Penny Prospect Prospect Tenement Hole ID HoleType Azi Dip Number Holes Total metres Target/Comment Lake Penny Paleo- channel E25/273 RYAC039-RYAC067 AC 0 -90 29 1390m Test paleochannel; lignite- and gravel-bearing sands at base of paleochannel E27/291 RYAC068-RYAC078 AC 0 -90 11 582m Test paleochannel; lignite - and gravel-bearing sands at base of paleochannel Total 1972m Figure 8.",False,64,64,1972,,"quartz, sericite",,"lignite, gravel, sands, gravel, sands, lignite, gravel, sands",,,prospect
1133,a096566_e5700871_2011-12_final_surrender_16317612_28,a096566_e5700871_2011-12_final_surrender_16317612.json,96566,122,Final Surrender,28,"prospective, mineralisation",CRA obtained this intersection testing an EM anomaly. More recently Gateway Mining obtained anomalous copper and zinc values in RAB holes in the vicinity of the Eds Bore Donkey Well unit. The Eds Bore Donkey Well unit is prospective for VMS style base metal mineralisation. Prospectivity of this unit is dependent on the effectiveness of the geophysical surveys conducted by CRA in the early 80s and the subsequent drill follow-up. A review of the geophysical data by geophysical consultants is recommended.,False,28,29,the early 80s,,"copper, zinc","VMS, base metal",,,,"anomalous, prospective, mineralisation, Prospectivity"
1215,a099754_e08-2178_hamersley range_atr_2012-13_11955560_202,a099754_e08-2178_hamersley range_atr_2012-13_11955560.json,99754,419,Annual,202,"potentially, mineralised","The second zone was located SW of this trend, and was initially witnessed from across the south side of a local creek during the 1st day's observations. The trend of this zone across the creek was not directly observed, but extensive quartz lag just off the northern boundary of the tenement is possibly related to a more extensive zone of alteration and veining. An additional main area of potentially mineralised veining occurs in an area immediately off an access track in the NE area of the tenement. Extensive quartz veining was found near the eastern boundary of the tenement, exhibiting similar width zones and individual vein dimensions to that detected over the NW part. As mentioned previously, veining at this site seemed more localised, decreasing in intensity along strike to the NW and becoming patchier.",False,202,203,the 1st day's,,"quartz, quartz",,lag,,,"trend of, extensive, possibly, extensive, potentially, mineralised, Extensive, patchier"
941,a088256_e31_454a10_11142761_35,a088256_e31_454a10_11142761.json,88256,36,Annual,35,prospect,"Hawthorn Resources Limited A.C.N. Hawthorn Resources Limited ABN 44 009 157 439 SAVANNAH PROJECT E31/454 ANNUAL REPORT FOR THE PERIOD 6 February 2009 TO 5 February 2010 BY Ian Moody PRIVATE AND CONFIDENTIAL NOT TO BE COPIED OR DISTRIBUTED DISTRIBUTION: Department of Minerals & Petroleum, Perth Hawthorn Resources Limited, Melbourne Level 2, 90 William Street, Melbourne 3000 Hawthorn Resources Limited A.C.N. PROJECT: Savannah PROSPECT: TENEMENTS: E31/454 REPORTING PERIOD: 6 February 2009 to 5 February 2010 AUTHOR: Ian Moody",False,35,35,"ANNUAL, THE PERIOD, February 2010, 6 February 2009 to 5, February 2010","SAVANNAH, Perth, Savannah",,,,,,
1375,a107293_figure 10 petrography images_60,a107293_figure 10 petrography images.json,107293,347,Final Surrender,60,patchy,"It is speculated that the matrix might have locally contained traces of fine grained sulphides (e.g. pyrite), that were subsequently destroyed by supergene oxidation. The rock has patchy minor impregnation by supergene goethite and hematite, mainly in the matrix, but also locally coating detrital grains (Fig. The textural and compositional characteristics of the rock indicate that it is a medium grained, quartz-rich sandstone (orthoquartzite). b) Alteration and structure: It is interpreted that the rock underwent diagenetic alteration that largely affected the matrix, with subsequently imposed supergene alteration.",False,60,61,,,"sulphides, pyrite, goethite, hematite, quartz",,"sandstone, orthoquartzite",,,patchy
398,a075934_c232_1994_biblio_datasheet_15204645_4,a075934_c232_1994_biblio_datasheet_15204645.json,75934,5,Annual,4,"significant, potential, increase the existing, further drilling","Conclusions: The significant intersects enhance the potential to increase the existing resource at Whistler, and thus further drilling is warranted.",True,4,4,,,,,,,,"significant, potential, increase the existing, further drilling"
