index,event_id,filename,anumber,sentence_count,report_type,sentence_idx,sentence_triggers,event_text,label,lower_idx,upper_idx,DATE,LOCATION,MINERAL,ORE_DEPOSIT,ROCK,STRAT,TIMESCALE,TRIGGER
1193,a098900_e77_1737_2013_a_15138732_104,a098900_e77_1737_2013_a_15138732.json,98900,129,Annual,104,"mineralisation, presence of","The preservation of chert mesolayers within zones of hematite alteration suggests that these jaspilite occurrences essentially represent domains that were exposed to the same, second-stage hypogene fluid that precipitated hematite in the orebodies at Windarling. However, in contrast, these more peripheral hematitic alteration domains lacked the earlier hypogene dolomite alteration and were therefore not subject to the same level of iron-oxide concentration that accompanied the leaching of dolomite. The other line of field evidence that points to the formation of jaspilite during the second-stage hypogene hydrothermal event (that formed iron-ore mineralisation) is the presence of massive to irregular bodies of red and translucent chalcedony within some jaspilite units. These jasperoid bodies display transitional or diffuse boundaries with the host jaspilite units, and may be up to 50 m long and extend across strike for up to 20 m. Chalcedony takes the form of diffuse replacement zones and more distinct dilational veins. The veins appear to have formed during a progressive hydrothermal event, during which early hematitic chalcedonic replacement zones or veins are cross-cut or replaced by later barren white chalcedony.",False,104,104,,"Windarling, long","hematite, hematite, dolomite, iron, oxide, dolomite, hydrothermal, iron, chalcedony, Chalcedony, hydrothermal, chalcedony",,"chert, jaspilite, jaspilite, jaspilite, jasperoid, jaspilite",,,"mineralisation, presence of"
1100,a094950_pad_mer_12_vol_7_12748665_1619,a094950_pad_mer_12_vol_7_12748665.json,94950,1776,Annual,1619,potential,The performance of these transects will be discussed in depth below. The TSFs were active until 2001 and historical seepage from these facilities resulted in elevated shallow water table levels and concentrations of key contaminants. A seepage recovery system was installed in 1998 to reduce the potential impact on the local groundwater regime and the wider environment. The recovery system included equipping a number of the existing monitoring bores and purpose built recovery bores with airwell-type recovery pumps to reduce groundwater mounding and contaminant levels. The groundwater collected was recovered and returned back to the surface of the TSFs for evaporation.,False,1619,1619,"2001, 1998",,,,,,,potential
511,a078846_sfr_dg_c1642005_2008a_14425618_206,a078846_sfr_dg_c1642005_2008a_14425618.json,78846,296,Annual,206,mineralisation,"Elsewhere within the Project area gold is associated with weak quartz stockworks within coarser sediments, sandstone, arkoses and quartz-rich grits which are also aligned along south-westerly trends and in massive quartz veins. Regionally, gold mineralisation has been mined from the Padbury Group at the Labouchere and Nathan Deep South mines. However, to date no gold mineralisation has been found within the Padbury Group rocks present within the Project. This sequence of fine grained sediments, including the Robinson Range Formation of banded and granular iron formation, forms a broad syncline, south-westerly trending and closed at the eastern end. The total strike length of the iron formation present within the Project is 26 km.",False,206,206,,,"gold, quartz, quartz, gold, gold",,"sediments, sandstone, arkoses, quartz veins, sediments, granular iron formation, iron formation","Padbury Group, Padbury Group, Robinson Range Formation",,"mineralisation, mineralisation, broad"
402,a076113_c384-1996_2007a_10099681_461,a076113_c384-1996_2007a_10099681.json,76113,1835,Annual,461,significant,No evidence of this species was found during the Phase I or Phase II surveys of Whim Creek. The project area could support the Peregrine Falcon (Other specially protected fauna [WC Act]) as part of a larger foraging territory. The project area would only be significant for this species if it contained a nest site. Peregrine Falcons are widespread throughout Australia but not common. No Peregrine Falcons were observed during the Phase I and II surveys of Whim Creek.,False,461,461,,"Whim Creek, Australia, Whim Creek",,,,,,"support, significant"
1197,a099104_e29_807_2013a_16751713_42,a099104_e29_807_2013a_16751713.json,99104,84,Annual,42,mineralisation,"Volcanology of the Archean Lunnon Basalt and its relevance to nickel, sulphide-bearing trough structures at Kambalda, Western Australia. Deformation Controls on the dynamics of fluid flow in mesothermal gold systems. Fractures, Fluid Flow and Mineralisation. Archean Volcanic and Sedimentary Environments of the Eastern Goldfirlds Province, Western Australia a Field Guide. Geological Survey of Western Australia.",False,42,43,,"Kambalda, Western Australia, Western Australia, Western Australia","nickel, sulphide, gold",,,Lunnon Basalt,"Archean, Archean",
981,a089456_ar_c237-2008_feb2011_15059213_284,a089456_ar_c237-2008_feb2011_15059213.json,89456,2358,Annual,284,significantly,"One possible explanation for this involves the infiltration of an Fe-rich melt into the main cumulus crystal pile and its cooling as an intercumulus melt in the crystal pile. This leads to a major shift in Fo in these olivines to lower Fo values (a process very well documented in cumulate assemblages from numerous layered intrusions; Irvine 1980; Naslund 1984) with little or no change in their Ni content, because of the far higher olivine-Ni KD (partition coefficient) with decreasing temperature (KD = 7-8 at 1250C and increases to ~20 at 1100C: Li and Ripley, 2010). If the residual melt achieved sulphide saturation, then the sulphides that crystallized would be significantly more Ni-poor and Cu-rich than magmatic sulphides formed from parental basaltic magmas. This is in keeping with the observation that the dominant sulphide at the Navigator Prospect, albeit in very small amounts, is chalcopyrite. In this model, the Fe-rich residual melts percolating down may become relatively more Ni-rich by dissolving any interstitial sulphides encountered as they do so, as S capacity at sulphide saturation increases significantly as melt Fe contents increase.",False,284,284,"1984, 2010",,"crystal, crystal, leads, olivines, olivine, sulphide, sulphides, sulphides, sulphide, chalcopyrite, sulphides, sulphide",,basaltic,,,"possible, significantly, significantly"
137,a091433_e25_323_2011s_17782632_73,a091433_e25_323_2011s_17782632.json,91433,91,Final Surrender,73,prospect,"The Belches Gold Project which was managed by BHP Minerals, General Gold Resources, Mt Monger Gold Project and Solomon (Australia) at various stages during the period 1993 to 2004 and covered the north eastern and south eastern corners of tenement E25/323. In March 1997 Mt Monger Gold Project Pty Ltd drilled 23 aircore holes in the north eastern corner of E25/323, in the vicinity of Integra Minings Swan Lake prospect. These holes were drilled as part of a larger drilling program targeting the intensely folded and demagnetized Maxwell BIF at Mt Mongers Jaws Prospect. No anomalous results were returned from the drilling on E25/323 with the peak gold value being 0.015ppm Au. In 1997/1998 conducted auger sampling in the south eastern corner and north eastern corner on all areas that were not covered by the salt lake.",False,73,73,"the period 1993 to 2004, March 1997, 1997/1998",Australia,"Gold, Gold, Gold, Gold, gold, salt",,BIF,,,"prospect, anomalous"
1006,a090803_annual report e59-1626 - 18 july 2011_15250423_27,a090803_annual report e59-1626 - 18 july 2011_15250423.json,90803,45,Annual,27,"significant, high grade",8.0 CONCLUSIONS Significant deposits of high-grade gypsum suitable for plaster-board and other uses have been defined.,True,27,27,,,gypsum,,,,,Significant
1044,a092465_kimbers well surrender report 2011_11290601_122,a092465_kimbers well surrender report 2011_11290601.json,92465,139,Final Surrender,122,prospect,"It is thought that large regional pegmatite dykes became conduits for the uranium out of the Morrissey suit and into palaeochannels possibly even as far as into to the Carnarvon Basin. At Kimbers Well 1 Prospect, rock chip sample 0237 assayed 430 ppm U. At Kimbers Well 2 Prospect, rock chip sample 0238 assayed 235 ppm U. Best RAB drill intercept was 1m @ 115 ppm in KW6. High grade copper results have been discovered on the tenement.",False,121,123,0237,Carnarvon Basin,copper,uranium,pegmatite,,,"possibly, High grade, discovered"
67,a080621_c15_2005_2009s_15031973_37,a080621_c15_2005_2009s_15031973.json,80621,71,Final Surrender,37,mineralisation,"The 2006 results from Coastal were disappointing with only one 2m drilled interval reporting above 50% Fe and two intervals above 40%. Drilling in 2007 included a total of twenty-three RC holes drilled within the four tenements included in this report (see plan pFe08_050). Results of this programme were discouraging, with no holes intercepting mineralisation, and only one 2m interval reporting an Fe assay result above 40% (see Appendix 1). Full details of methods of sample collection and rig specifications have been included in previous reports (Faragher, 2007; Heaslop, 2008). 6.1 RC Drilling .3 6.2 Interpretation of Drilling Results .3 6.3 Additional Exploration Activities .4",False,37,37,"2006, 2007, 2007, 2008",,,,,,,mineralisation
788,a085041_unlock-c39_2005_2009a_18186423_2711,a085041_unlock-c39_2005_2009a_18186423.json,85041,6428,Annual,2711,proposed,"Therefore the proposed clearing would not breach this Principle. Cardinia While the Cardinia project area has disturbance in the form of grazing and exploration activities, it has not been extensively cleared, and the vegetation type appears widespread throughout the area. Therefore the proposed clearing would not breach this Principle. Raeside The Raeside project area vegetation continues to the north over the rail-line, south and west of the proposed clearance area, and despite disturbance is not considered to be remnant vegetation. Therefore the proposed clearing would not breach this Principle.",False,2711,2712,,,,,,,,"proposed, proposed, proposed, proposed"
1352,a106004_a106004_v1_report_131,a106004_a106004_v1_report.json,106004,149,Annual,131,substantial,"Warrawoona Stage (3525 3420 Ma) is the oldest event and involved the eruption of the Warrawoona Group volcanic rocks and emplacement of granitic rocks of the Callina and Tambina Supersuites. Two periods of deformation and contact-style metamorphism also occurred during this stage. The second formational event, Kelly Stage (3350 3290 Ma), involved the deposition of Kelly Group volcanic rocks, emplacement of the Emu Pool Supersuite and an interval of substantial deformation and metamorphism. The final Sulpur Springs Stage (3275 -3225 Ma) encompassed deposition of the Sulphur Springs Group, emplacement of the Cleland Supersuite and another major period of deformation and metamorphism. The GSWA interpreted bedrock geology of the project area is shown on Figure 2.",False,131,131,,,,,"volcanic rocks, granitic rocks, volcanic rocks, bedrock","Warrawoona Group, Tambina Supersuites, Kelly Group, Emu Pool Supersuite, Sulphur Springs Group, Cleland Supersuite",,substantial
1460,a106061_e40_195 final surrender report vrification listing_4,a106061_e40_195 final surrender report vrification listing.json,106061,12,Final Surrender,4,prospect,"Drill sample Stream sediment Soil C62_2006_A_2007_WAGS3_SOIL.TXT txt Rock chip C62-2006_WASG3_ROCKCHIP_2011A.TXT txt Other (specify) DRILLING Diamond Reverse circulation 2008 2008 2010 2010 2010 2012 2012 2012 Appendix_3a_DRILLING DATA.zip Appendix_3b_Jeedamya DHEM data.zip Appendix_5b_Drilling_Data.zip Appendix_5c_Drill_sections_and_plans.zip Appendix_5d_Geological_Mapping_Packaged_Mapinfo_Workspace.zip Appendix_7a_Drilling_Data.zip Appendix_7b_Drill_sections_and_plans.zip Appendix_7c_Drilling_Packaged_Mapinfo_Workspace.zip zip zip zip zip zip zip zip zip Rotary air blast Air-core Auger Groundwater drilling All drilling logging_codes.zip zip ABSTRACT LOCATION: E40/195 is situated approximately 57 km south of Leonora. GEOLOGY: The Jeedamya area occurs at the southern extension of the Jeedamya Felsic Volcanic Complex. In the region of the Jeedamya VMS prospect, the volcanic package constitutes a bimodal assemblage of felsic and mafic extrusive and intrusive rocks, with minor intercalated sediment, ash and tuff, which are typically metamorphosed and structurally complex. Thick ridgeforming basalt caps the metavolcanics in the Jeedamya VMS region, with the fault contact between these units being a focus for the sulphide mineralisation. WORK DONE: The majority of work was focussed on the Jeedamya VMS target.",False,4,5,2008 2008 2010 2010 2010 2012 2012 2012,Leonora,"Diamond, sulphide","VMS, VMS, VMS","sediment, intrusive rocks, sediment, ash, tuff, basalt",,,"prospect, mineralisation"
893,a087164_c175_2008_2010a_12022223_46,a087164_c175_2008_2010a_12022223.json,87164,224,Annual,46,discover,"Comprehensive review of regional geographical, geological, geophysical, geochemical and drilling datasets to identify and prioritise areas prospective for nickel sulphides. Compilation of a basement geology interpretation map for the Kawana Project area. Reinterpretation of the historical Quartz Ridge drill hole geology and geochemistry in three dimensions using MapInfo Discover 3D. Field-based logistical and geological reconnaissance that includes mapping of existing access tracks and cleared grid lines. A total of 94 rock chip samples were assayed in the field for a multi-element suite using a Niton XRF analyser.",False,46,46,,,"nickel, sulphides, Quartz",,,,,prospective
541,a079470_doir annual report 2008 - minnie creek project_12212524_161,a079470_doir annual report 2008 - minnie creek project_12212524.json,79470,186,Annual,161,"prospect, prospect, anomalism","Overlimits triggered by Cu or Mo >500ppm were then analysed by ICP-AES A program rock chip sampling was completed on the Hidden Valley grid in parallel with soil sampling which identified new areas of quartz veining and gossanous material. Summary rock chip sampling details and assays are given in Appendix_2. At the Nina prospect (previously referred to as the Tungsten prospect) 312 soil samples over a first pass 250m x 50m and infill 125m x 50m grid were collected with results expanding a large zone of prior identified tungsten anomalism. Initial rock chip sampling completed during 2007 returned tungsten grades up to 2.60% W with evidence of mineralisation over 200m strike. The results of new work indicates that a broader zone of tungsten mineralization, 2,000m long and 800m wide is present and open along strike in both directions.",False,161,161,2007,long,"quartz, Tungsten, tungsten, tungsten, tungsten",,,,,"prospect, prospect, anomalism, mineralisation, broader, mineralization, open along strike"
1381,a107684_igo_20151214_final co-funded drilling report neptune_121,a107684_igo_20151214_final co-funded drilling report neptune.json,107684,201,Co-Funded Drilling,121,mineralization,"DHEM plates (green wireframes) A large alteration selvedge, comprising veined pyrrhotite+/-pyrite mineralisation with strong to intense silicasericite+/-haematite alteration also occurs proximal to the primary Narracoota-Karalundi contact shown in Figure 8. An additional, late/brittle vein hosted within a large sandstone package containing pyrite-hemimorphite infill is also intersected within 15BRDD002. Although small the occurrence of hemimorphite is strongly suggestive of (polymetallic) hydrothermal mineralization. PAGE | 19 Figure 7: Blebby, disseminated, banded and veined pyrite hosted within graphitic shale (A) 15BRDD003 (631.3-635.8m) and (B) 15BRDD002 (488.2.4-492.5m) Figure 8: Pyrrhotite-pyrite mineralization with associated sericite-silica alteration within the Karalundi Fm. The Bryah Basin is one of several Paleoproterozoic basins that formed during the Capricorn Orogeny resulting from the collision between the Pilbara and Yilgarn Cratons culminating around 1800 Ma.",False,121,121,,"Bryah Basin, Capricorn, Pilbara","pyrite, hemimorphite, hemimorphite, hydrothermal, pyrite, Pyrrhotite, pyrite, sericite, silica",,"sandstone, shale",,Paleoproterozoic,"mineralisation, mineralization, mineralization"
1350,a105940_c48_2009s_2014_final surrender_144,a105940_c48_2009s_2014_final surrender.json,105940,223,Final Surrender,144,mineralisation,"This conjecture is strengthened by the aeromag data (figure 14). BC08 and BC10 have been historically ground truthed and were found to be barren igneous intrusions (Stockdale, 1998, First and Final Report E45/1849 and Terry Reid, 2012, Spinifex Ridge East Exploration Notes). No work has been carried out in the area of BC09, however it is located at a large structural intersection zone which may be preferential to hosting alteration mineralisation. Targets BC15 and BC16 (figure 15) lie in the South Eastern portion of E45/2596 in a lithologically complex area encompassing the Nobbs Well intrusion and contact zone of the Coppin Gap Granodiorite with the Warrawoona Group greenstones. BC15 is possibly a localized alteration (demagnetization) zone along a NNW trending fault, which is sub-parallel to the Bamboo Creek Fault Zone, within mafic-ultramafics.",False,144,144,"1998, 2012","Spinifex Ridge, Bamboo",,,greenstones,"Coppin Gap Granodiorite, Warrawoona Group",,"mineralisation, possibly"
303,a074138_c47_2006_2006a_17196046_101,a074138_c47_2006_2006a_17196046.json,74138,102,Final Surrender,101,indicate the presence,"Either way we have insufficient constraints to generate a meaningful density model to help design an optimal test for a potash target. The total amplitude range in the gravity field within the survey area is around 3mGal. There is no compelling evidence in the dataset to indicate the presence of a salt diapir, and the survey specifications are sufficiently tight to have confidence that no such structures exist in this area.",False,101,101,,,salt,,,,,indicate the presence
935,a088121_m15_1000_2010a_12709486_121,a088121_m15_1000_2010a_12709486.json,88121,147,Annual,121,significant,"Cobaltinitrite staining of the slabs on their reverse non polished side supports this .See photographs . % SEM scan Thin section count Quartz 25 32 Albite 20 8 Potash feldspar 5 15 Muscovite 10 11 Spodumene 40 33 Others Trace Trace In the SEM scan, the main others detected was apatite, apart from the columbotantalites. <reed> 3 Ref No <22589> ezx gxw tw Tv|tx Ideally the sample should be investigated as a significant weight of crushed product, probably under 1 mm . A series of slides would be made of this material which would give a good representative idea of the interlocking nature of the spodumene if any, and nature of the columbotantalite mineralization. Spodumene was the only lithium mineral detected as previously noted.",False,121,121,20 8,,"Quartz, Albite, feldspar, Muscovite, Spodumene, apatite, spodumene, Spodumene",,,,,"supports, significant, mineralization"
896,a087235_bd_2010a_14229671_71,a087235_bd_2010a_14229671.json,87235,158,Annual,71,"potentially, significant, significance","It should be noted that when isotropic kriging (Surfer plots) are undertaken, extrapolation of contours outside the limits of sampling should not be relied upon. The report format consists of a series of plots with comments beneath without specific reference to, or reliance on, background, previous history, geology, or location. The purpose of this MMI report is to alert the client/user to potentially significant information within MMI data, and to suggest and establish significance levels for various elements and to train and assist the users in making their own interpretations of MMI data. It is based on the raw data supplied, including coordinates and is in bullet form. It is not a comprehensive report, is not based on site visitation and maybe limited in its scope and applicability as a result.",False,71,71,,,,,,,,"potentially, significant, significance"
476,a077952_c316_1993_a07_12261968_80,a077952_c316_1993_a07_12261968.json,77952,132,Annual,80,"mineralisation, mineralisation","Bogada Bore Annual Report for 2007 Page: 9 However, none of the 2007 intersections were sufficiently high-grade to warrant immediate follow-up. The bulk of the gold at Bogada Bore is contained within the Zones 2 and 4. The Zone 4 mineralisation is largely contained within a series of west-dipping and sub-vertical strike parallel shear zones occurring close to the contact between high-Mg basalt, sediment and dolerite (Figure 10), whereas the Zone 2 mineralisation appears localised at or close to the contact between dolerite and tholeiitic basalt. The mineralisation occurs within silicified shears in association with arsenopyrite, pyrite, carbonate and quartz. The random orientation of much of the arsenopyrite indicates that the mineralisation occurred late in the history of the shear zones.",False,80,82,"2007, 2007",,"gold, arsenopyrite, pyrite, carbonate, quartz, arsenopyrite",,"basalt, sediment, dolerite, dolerite, basalt",,,"mineralisation, mineralisation, mineralisation, mineralisation"
1315,a104123_p26_3759_2014s_4,a104123_p26_3759_2014s.json,104123,103,Final Surrender,4,exploration drilling,"The main lithologies comprise upper metamorphosed Archean shale which is underlain by pyroxene spinifex-textured basalt and to a lesser amount ultramafic rock. Work done: Work undertaken on the Wombola project during the reporting year focused on follow up soil survey of a favourable soil anomaly identified in previous soil sampling results and desktop studies. Results from this follow up soil sampling campaign justified initial exploration drilling to be undertaken in the project area. Results: Exploration drilling results on P26/3759 did not show significant gold mineralization associated with the soil survey anomalies recorded earlier in the reporting period. Conclusions: Due to unfavourable results from the first pass of exploration drilling on the Wombola tenement, it has been decided that the tenement group C87/2011 will be surrendered.",False,4,5,the reporting year,,"pyroxene, gold",,"shale, basalt",,Archean,"favourable, exploration drilling, Exploration drilling, significant, mineralization, exploration drilling"
1015,a090971_ml_c39-2010_2011a_combined_17319950_46,a090971_ml_c39-2010_2011a_combined_17319950.json,90971,161,Annual,46,mineralisation,"These are presumed to reflect the granite-mixed sequence domains shown by drilling. A broad relative chargeability high (about twice background, not particularly strong) exists in the east domain with maxima on the northernmost surveyed line. It appears that the responses are relatively shallow and not a reflection of the depth extension of the known mineralisation. The pole-dipole results were equivocal and show a highest chargeability feature at an unrealistic modeled depth of about 400m that could however reflect something shallower but to the side of the surveyed line (water pipeline?). A shallow but much lower-order chargeability feature correlates with the broad gradient high.",False,46,46,,,,,"granite, mixed",,,"broad, mineralisation, broad"
504,a078606_c125-1997-2008a_12703370_485,a078606_c125-1997-2008a_12703370.json,78606,1465,Annual,485,"prospects, anomalous","A description of each target area, an assignment of priority and supporting comments is presented in Table 1 below. Table 1: Summary of Regional Targets in the Indee Project Area Target ID Description Priority Comments IR01 1.8km strike length of the NE trending Mt Constantine anticlinal axis where it is overlain by transported cover between the Charity Well and Toweranna prospects C The Mt Constantine anticlinal axis seems to be the primary regional-scale control on the location of the Toweranna and Charity Well prospects. This structure seems to define the western margin of the Peawah Dome (see Fig 2 above) C This structure does not host any known prospects but regional geochemistry indicates that it is gold anomalous where it occurs in residuum. Figure 17: Western part of the Indee project area showing regional exploration targets (magenta-outlined boxes). Red outline = Indee project tenement area, Blue lines = interpreted major structures, Grey = areas of transported cover, white = areas of residuum and outcrop.",False,485,485,,Grey,gold,,,,,"supporting, prospects, prospects, prospects, anomalous"
830,a086005_kp _2009a_c181_2008_15605727_4,a086005_kp _2009a_c181_2008_15605727.json,86005,158,Annual,4,encouraging,"Detailed study of all information has been carried out and preliminary cross sections from previous drilling have been created at Halfway Hill and Area 9 prospects. An airborne magnetic, radiometric and gradiometric survey was also carried out over all the tenements listed in this report. Results: Results from the various sampling are encouraging. Previous 4m composites from Halfway Hill sampled at 1m have shown promising results both for gold and base metals. Rock chip samples from Jurangie Hill have shown good potential for an iron resource.",False,4,4,,,"gold, iron",base metals,,,,"prospects, potential"
