,event_id,filename,anumber,sentence_count,report_type,sentence_idx,sentence_triggers,event_text,label,lower_idx,upper_idx,DATE,LOCATION,MINERAL,ORE_DEPOSIT,ROCK,STRAT,TIMESCALE,TRIGGER
190,a079092_doir e04-1549 annrepto20jun08_12102843_185,a079092_doir e04-1549 annrepto20jun08_12102843.json,79092,294,Annual,185,possible,"For the present, the geophysical work as reported has adequately described the situation. A portion of the WAPET drill core was found in the state archives and sampled and found to be exceptionally pure sodium chloride with little magnesium and potassium chloride. EL 4 / 1549 Frome Rocks Annual Report Year Ended 30 June 2008 Possible further work on the tenement Eastern Corporation were told that a due diligence hole to 1500 meters would cost of the order of A$2M and this was considered; however because of the extent and shape of the diapir there would be enough salt around the discovery hole for long- term exploitation at conceived rates from 4 to 12M tonnes per annum. It was decided not to carry out due diligence drilling this year and at this stage; Eastern Corporation then commissioned a desk-top study on the simple step of solution mining at Frome Rocks, hydraulic transportation to solar ponds north of Derby and export from the proposed new port at Pt. (This simple exercise ignored the concept of introducing parties from the Chloro-Chemical industry which is the long term objective).",False,185,186,this year,"Derby, long",salt,,,,,"Possible, proposed"
191,a079108_kanownabelle_ann_08_10183016_3802,a079108_kanownabelle_ann_08_10183016.json,79108,4144,Annual,3802,potential,"The sell costs were calculated by applying a 2.5% state gold royalty and AU$0.40/oz refining cost. The following table displays the combined selling price and costs: WMC, Western Mining Corporation, commenced exploration in the Six Mile Area in 1983, after attention was raised during a reconnaissance investigation of the gold potential around the Arrow Lake tenements (Lindsay, 1985). Early exploration consisted of geological mapping, gridding, chip sampling, trenching and drilling (Lindsay, 1985). Six trenches, or costeans, were dug across the main areas of interest, totalling 1040 m. One metre channel samples were taken along the eastern William Cooper 2 wall of each trench, and assayed for gold, plus arsenic in some cases (Lindsay, 1985).",False,3802,3802,"1983, 1985, 1985, 1985",,"gold, gold, gold, arsenic",,,,,potential
192,a079124_c62_2003_westlakecarey_2008s_11864432_78,a079124_c62_2003_westlakecarey_2008s_11864432.json,79124,79,Final Surrender,78,"potential, significant, mineralisation",No significant results were returned from the soil sampling programme with a maximum Au result of 10 ppb Au from sample A153902 in the north eastern corner of E39/1014. Conclusions: Results of the soil sampling programme were disappointing with no significant results returned. Following a review of all available exploration data and with consideration for the geological setting it was considered that tenements E39/1014 and P39/4285 held little potential to host significant gold mineralisation.,False,78,78,,,gold,,,,,"significant, significant, potential, significant, mineralisation"
193,a079135_annual report 2008 e45_2480 - 31july 2008_15960928_44,a079135_annual report 2008 e45_2480 - 31july 2008_15960928.json,79135,101,Annual,44,"prospect, anomalous","During the year ended April 2008, Gondwana undertook field reconnaissance on E45/2480 in the form of geological mapping with accompanying rock chip sampling designed to generate drill targets. The highlight of this work was the discovery of significant copper mineralisation at Comet East. The field investigation at the Dorph-Peterson Copper prospect within the NE corner of the tenement produced strongly anomalous surface samples. This steep, narrow vein protrudes from the hillside and is capped by late, barren cover. No modern exploration i.e.",False,44,45,the year ended April 2008,,"copper, Copper",,,,,"significant, mineralisation, prospect, anomalous"
194,a079164_e 45 2747 tech report ye 2007_14551358_106,a079164_e 45 2747 tech report ye 2007_14551358.json,79164,110,Annual,106,prospective,"Some tenements are prospective for base metals (nickel, copper, zinc, lead) and Baracus Pty Ltd will also assess the potential for these metals as part of their exploration program.",True,106,106,,,"nickel, copper, zinc, lead",base metals,,,,"prospective, potential"
195,a079195_comet south ar 2008_11421487_22,a079195_comet south ar 2008_11421487.json,79195,60,Annual,22,"mineralisation, mineralisation",The tenement lies within the Marble Bar Greenstone Belt which is wrapped around several granitoid complexes.,True,22,22,,Marble Bar,,,granitoid,Greenstone Belt,,
196,a079259_annual report_m70_675_2008_13993756_23,a079259_annual report_m70_675_2008_13993756.json,79259,39,Annual,23,possibly,"Below the cemented layer, the heavy mineral assemblage is more typical of the Yoganup Formation with a greater proportion of unaltered ilmenite with low Al content. Surface deposits (possibly windblown) are found in various sections on top of the basement on the eastern side of the area. The small thin sandy deposits are possibly blown inland from the beach areas onto the harder and older deposits making up the basement of the Yoganup Formation and are often heavily altered and predominantly leucoxene. H o le I D E a s t N o rt h R .L . Drilling was carried out by a reverse circulation (Air Core) drill rig hired from Wallis Drilling.",False,23,24,,,"ilmenite, leucoxene",,,"Yoganup Formation, Yoganup Formation",,"possibly, possibly"
197,a079257_full compilation of report_16797693_127,a079257_full compilation of report_16797693.json,79257,163,Annual,127,mineralisation,"It appears to have been discovered in the early 1950s, as a result of ground prospecting activities of United Uranium. It is not clear whether United Uraniums airborne radiometric survey of the area contributed to the discovery. No United Uranium report has been sighted by the present author, but a Rio Tinto Report of 1955 describes the mineralisation as being on fracture surfaces within, and adjacent to, coarse fault breccia zones which have been intruded by dolerite. The identified uranium mineralisation (mostly torbernite) is hosted by both granite and dolerite, as well as by the breccia clasts which include both Proterozoic sediment and granite. The fault breccia was interpreted to be part of the Dunham Fault (Denham Fault Zone).",False,127,127,"the early 1950s, 1955",Denham,torbernite,"Uranium, Uraniums, Uranium, uranium","fault breccia, dolerite, granite, dolerite, breccia, sediment, granite, fault breccia",,Proterozoic,"discovered, mineralisation, mineralisation"
198,a079289_solaris scoping study-final_12466792_618,a079289_solaris scoping study-final_12466792.json,79289,736,Annual,618,"potential, potential, potentially","whales, dugongs, sharks, turtles and sea snakes) are ecologically significant and protected under the EPBC Act. Twelve threatened species, 29 migratory species and 65 listed marine species may occur in and above the waters off the coast adjacent to the proposed project area (EPBC protected matters database 19/6/07). Potential impacts to marine fauna include the following: Dredging of the shipping channel leading to the physical removal or modification of habitat; Salt barge and ship collisions with marine megafauna (Whales, turtles, dugongs); Noise emissions and vibration from salt barge and ships, which may disturb marine fauna; The introduction exotic marine species with potential to affect native species and local aquaculture; Hydrocarbon spills may potentially impact on some fauna species; and Impacts to beaches used by turtles for nesting. Specialist assessment of the nearshore environment will be required. This would comprise desktop review and field survey.",False,618,618,,,"Salt, salt",,,,,"significant, proposed, Potential, potential, potentially"
199,a079387_e7002732_2008a_11003219_17,a079387_e7002732_2008a_11003219.json,79387,62,Annual,17,anomalism,"Due to current access restrictions, most of the land being covered by farms, all the sampling was done along public roads or tracks. Slightly elevated gold, copper and silver values were reported at several locations, several times higher than background. The best zone of anomalism is located within an area of shearing and quartz veining exposed in a road cutting, seemingly adjacent to the interpreted trace of the Darkan Fault. These reconnaissance sampling results were considered encouraging, supporting the companys exploration concept To advance the project further, a search of the land ownership had to be completed and compensation / access agreements with the landholders put in place. Unfortunately this part proved to be onerous and as this tenement was purely grassroots, not a core element in the companys holdings, E70/2732 was surrendered (Surrender report E70/2732_2008S.pdf September 2008) Page 4 of 20",False,17,18,September 2008,Darkan,"gold, copper, silver, quartz",,,,,"anomalism, supporting"
200,a079427_e69_2253 annual report 2008_11574499_38,a079427_e69_2253 annual report 2008_11574499.json,79427,95,Annual,38,mineralisation,"The general transition from ultramafic-dominated intrusions at Gosses Pile to gabbroic and troctolite-dominated intrusions in the west indicates a shallowing of crustal levels toward the west. Studies of the host rocks confirm shallowing crustal levels in this direction. Copper and Nickel mineralisation is known from layers within the Complex (Abersinghe 2002). 2.2 PROJECT GEOLOGY The Caesar Hill tenement overlies the north-eastern edge of the Palgrave Cauldron association of volcanic and granitic rocks and a portion of the mafic-ultramafic layered Giles Complex intrusives (see Figure 3). Within the tenement boundaries, the edge of the N-S elongate Palgrave cauldron complex is evident from the magnetic signature of radial faults and fractures.",False,38,39,,,"Copper, Nickel",,"troctolite, host rocks, granitic rocks",Giles Complex,,mineralisation
201,a079470_doir annual report 2008 - minnie creek project_12212524_73,a079470_doir annual report 2008 - minnie creek project_12212524.json,79470,186,Annual,73,"broad, trend of","An induced polarization survey was completed at Minnie Springs, showing an extensive elongate and strike parallel chargeability anomaly which lies along the margin of the potassic/sericite alteration zone. Low chargeability at the eastern and western extremities of the grid are probably reflecting more extensive cover over more massive chloritised granitoid around the margins of the alteration system. This broad chargeability anomaly which mirrors the regional trend of the foliation and alteration includes several NNW and NS trending peaks. The central part of the anomaly is split by a NS trending chargeability low which corresponds to the trace of the main dolerite dyke. It appears that the chargeability anomaly is related to sulphide mineralization (mainly pyrite) within the central part of the alteration zone as indicated by the amount of oxides at surface and sulphide outlined in drilling.",False,73,73,,,"sericite, sulphide, pyrite, oxides, sulphide",,"granitoid, dolerite",,,"extensive, extensive, broad, trend of, mineralization"
202,a079520_c113_04_2008a_petrology_15585895_341,a079520_c113_04_2008a_petrology_15585895.json,79520,350,Annual,341,prospect,"A suite of 11 drill core rock samples was received from Mr Kym Revington (Independence Group NL, South Perth, Western Australia) on 11 July 2008. It was indicated that the samples originate from the Frankopan Prospect, an Archaean greenstone-hosted orogenic gold system located 65 km south of Newman in the Pilbara Province of Western Australia. The Frankopan Prospect is part of the Karlawinda Project, and parts of a prior geological report by Ben Grguric and Neil McNaugton for BHP Billiton were provided. That work indicated that amphibolite facies metamorphism had affected intermediate to mafic volcanic rocks, and that gold mineralisation formed in quartz-veined and biotite-pyrite altered potassic alteration zones in a brittle-ductile structural environment under retrograde greenschist facies P-T conditions. While the previous work emphasised the volcanic origin of the rock types, drilling by Independence Group indicates that the lithologies within the Frankopan Prospect appear to be well bedded and are interpreted to be dominated by volcaniclastic to epiclastic lithologies, with minor intermediate to mafic volcanics.",False,341,341,11 July 2008,"Perth, Western Australia, Newman, Pilbara, Western Australia","gold, gold, quartz, biotite, pyrite",,"greenstone, amphibolite, mafic volcanic rocks, greenschist",,Archaean,mineralisation
203,a079542_mt bartle annual 2008a_15853497_188,a079542_mt bartle annual 2008a_15853497.json,79542,302,Annual,188,"prospect, prospecting","report by Samantha Mines for DME Le Blanc Smith G, Pirajno F, Nelson D and Grey K. Base-metal deposits in the Early Proterozoic Glengarry terrane, Western Australia. Geological Survey of Western Australia 1993-94 Annual Review, pp. Duval Mining (Australia) Ltd. Diamond Well Prospect Annual report on prospecting licences 51/15-51/18. Unpub Report RGC Exploration Pty Limited for DME. Finlayson Range Report, unpub.",False,188,188,"1993-94, Annual","Grey, Western Australia, Western Australia, Australia",Diamond,,,,Proterozoic,prospecting
204,a079545_brightstar 2007-08 annual report_14417639_139,a079545_brightstar 2007-08 annual report_14417639.json,79545,170,Annual,139,mineralisation,"The project area lies on a corridor of north-northwest trending mafic volcanics interspersed with narrow bands of ultramafics and volcanogenic sediments, extending in a south easterly trend through the BrightStar Alpha deposit. The area is prospective for further shear-hosted deposits, as tensional gash link structures between north-northwest trending sinistral strike parallel (D2) structures. Most mineralisation is related to these linking structures between major NNW-SSE trending shears such as the Jasper Hills Transfer. Targets include dilation positions along these shear zones especially where intrusive rocks are present, providing pressure shadow areas and dilatant zones that may trap gold. Deformation can be recognised as distinct events.",False,139,139,,,"Jasper, gold",,"sediments, intrusive rocks",,,"prospective, mineralisation"
205,a079561_c16_1997_2008a_14513310_197,a079561_c16_1997_2008a_14513310.json,79561,245,Annual,197,"significantly, favourable",Subsequent to thrusting the belt has been affected by folding and faulting at a high angle to the strike of the belt.,True,197,197,,,,,,,,
206,a079566_t16174 _wannasouth_ar_2008_11069855_35,a079566_t16174 _wannasouth_ar_2008_11069855.json,79566,53,Annual,35,prospective,"Iluka has identified two potential beach barrier systems in the vicinity of the project area, with the major Ooldea barrier system being interpreted to be contained within the tenements and the Barton barrier system to lie to the north. In the first year of tenure Iluka negotiated Land and Mineral Exploration Access Agreements with the Native Title owner of the lease area and acquired publicly available radiometric and magnetic airborne survey data covering the lease area. This data was used along with the government geological mapping to identify a prospective trap site on the Ooldea barrier sequence and design a reconnaissance drill program to test it. Due to problems with obtaining a suitable drill rig to test Ilukas Vernon/Wanna project to the north, no drilling was undertaken in the first year, but is planned for the second year of tenure. The Wanna South tenements sit on the margin of the Eucla and Officer Basins (see Figure 3), where Miocene/Eocene Eucla Basin sediments onlap Permian Officer Basin sediments.",False,35,35,"the first year, the first year, the second year","Eucla, Eucla Basin, Officer Basin",,,"sediments, sediments",,"Miocene, Eocene, Permian","potential, prospective"
207,a079657_nf_e09_1004_2008a_12380872_32,a079657_nf_e09_1004_2008a_12380872.json,79657,151,Annual,32,presence of,"This coincides with an increasing number of igneous intrusions and quartz veins towards the east. The appearance of chlorite, biotite and finally garnet has been observed from west to east within E70/2237, and is consistent with a Barrovian-type metamorphic Page 11 of 17 October 2008 sequence, where temperature increased into amphibolite facies towards the intrusions to the east. The presence of well preserved actinolite appears to be the result of retrograde metamorphism through greenschist facies. Finally, towards the eastern edge of the tenement, the quartzite adopts a gneissic texture, indicative of high grade metamorphic conditions. In general in E09/1004 the rocks have been extensively granitised and in all case both sedimentary and metamorphic textures have been obliterated by the granitisation process except in the migmatite after BIF.",False,32,32,17 October 2008,,"chlorite, biotite, garnet, actinolite",,"quartz veins, amphibolite, greenschist, quartzite, migmatite, BIF",,,"presence of, high grade"
208,a079692_horse_well_partial-surrender-report_2005-8_16596130_115,a079692_horse_well_partial-surrender-report_2005-8_16596130.json,79692,136,Partial Surrender,115,"low grade, anomalism",Conclusions: Areas identified with weak gold anomalies and other untested structural targets require infill and reconnaissance drilling.,True,115,115,,,gold,,,,,
209,a079710_file verification list_14089374_0,a079710_file verification list_14089374.json,79710,7,Annual,0,prospect,Regional Reconnaissance Prospect Underground Costean Aeromagnetics Radiometrics Electromagnetics Gravity Digital terrain modelling Other (specify) Drill sample Stream sediment Soil Rock chip Laterite Water Biogeochemistry Isotope Whole Rock Mineral analysis Other (specify),False,0,1,,,,,"sediment, Laterite",,,
210,a079728_e31_658_2008a_10286131_46,a079728_e31_658_2008a_10286131.json,79728,128,Annual,46,extensive,"Auger drilling over the greenstones did delineate several gold anomalies. No details have been provided. Aust Pacific Resources NL, Aztec Exploration Ltd and Indian Ocean Resources Ltd (Item 4265) Aust Pacific Resources NL, Aztec Exploration Ltd and Indian Ocean Resources Ltd conducted a fairly extensive exploration program, including aerial and ground magnetics, grab, soil and rock chip sampling, auger and RAB drilling during the period 1983 to 1989. Rock chip sampling mainly of dumps yielded values up to 19 ppm Au. RAB drilling returned several anomalous intersections with values greater than 1 ppm Au, the highest being 1m @ 3.54 g/t Au.",False,46,46,the period 1983 to 1989,,gold,,greenstones,,,"delineate, extensive, anomalous"
211,a079782_c065_2001_2008a_12542452_618,a079782_c065_2001_2008a_12542452.json,79782,711,Annual,618,potential,"Memo - TSF Luvironza Option.doc 5/06/2007 Page 6 of 7 Wireframe Volume (m 3 ) Remaining (m 3 ) EOM_Jan03 3,847,000 0 PacMin_1999_Feasibility 7,140,000 3,293,000 Saracen Gold Mines Pty Ltd Memo - TSF Luvironza Option.doc 5/06/2007 Page 7 of 7 4 Cost Summary A preliminary analysis based on current cost estimates for the Carosue Dam project have been used to provide an assessment on the potential of Luvironza.",True,618,618,"5/06/2007, 5/06/2007","Luvironza, Luvironza, Carosue Dam, Luvironza",Gold,,,,,potential
212,a079859_law_ 2008a_16574790_328,a079859_law_ 2008a_16574790.json,79859,631,Annual,328,significant,"To convert the unclassified resource at Leviathan to Indicated and Inferred status [1.6Mt @ 1.73/t for 91,000 ozs]. To collect geotechnical data & provide drill core samples for geotechnical test work and to define the style and orientation of mineralisation through structural analysis of drill core. The location of the collars are shown in Figure 5 and significant intersections are listed in Table 5. Diamond core retrieved from the drilling program was sampled by Golders and Associates and the samples were taken offsite for geotechnical analysis. Drawn: Figure No.",False,328,328,,,Diamond,,,,,"mineralisation, significant"
213,a079888_2008 annual report_14328482_7,a079888_2008 annual report_14328482.json,79888,87,Annual,7,significant,"Diamond drill hole 2 was drilled parallel to the dip of the ore body. Part of the peninsula has been explored for base metals though the work done for these minerals has been minor within recent years 16 RAB, drill holes were placed through deep sand cover northerly of the Great Bingin. Sampling or some or these by previous explorers have returned anomalies results, various parties have sampled and mapped areas of the peninsula though no significant systematic exploration has yet been carried out for gold. More recently two drilling programmes have been completed. Limited costeaning has also been competed.",False,7,7,recent years 16,,"Diamond, gold",base metals,sand,,,significant
214,a079936_p26_3331_2008a_12510799_9,a079936_p26_3331_2008a_12510799.json,79936,107,Annual,9,mineralisation,"GEOLOGY The Mount Monger Project lies within the Kurnalpi Terrane of the Eastern Goldfields Superterrane (EGS), which is discussed below. The EGS hosts a number of Archaean lode-gold, nickel sulphide and nickel laterite deposits of significance. These styles of mineralisation are discussed in reports for previous reporting years (e.g. strike and reverse slip faults; en echelon folds local extension - final uplift stage granite - 'post regional folding': c. 2660Ma Of granite gneiss complexes most abundant phase D2 regional shortening: ENE-WSW granite - 'pre- to syn-regional folding': 2675Ma upright foliation and folds; domain scale thrusting; inversion of extensional structures? post-D1 and pre-D2 east-west extension: post-D1 and pre-D2 felsic porphyry 26746Ma roll-over anticlines, synclinal basins with clastic infill D1 thrusting: Felsic volcanics: minimum age constraints sequence repetition, recumbent folds; major thrust stacking; involves upper felsic volcanic Unit (Kalgoorlie T.) 26815Ma (Kalgoorlie T.), 26753Ma (Gindalbie) DE extension: Early granites: c. 2685 - 2675Ma low angle shearing along granite-greenstone contact; north-to-south movement?",False,9,10,previous reporting years,"Mount Monger, Kurnalpi Terrane, Eastern Goldfields Superterrane, Kalgoorlie, Kalgoorlie, Gindalbie","gold, nickel, sulphide, nickel",lode,"laterite, granite, granite, gneiss, granite, porphyry, Felsic volcanics, granites, granite, greenstone",,Archaean,"significance, mineralisation"
215,a080039_tm_c328_1995_2008a_10044378_41,a080039_tm_c328_1995_2008a_10044378.json,80039,93,Annual,41,mineralisation,"The gold mineralisation is associated several ENE trending quartz veined zones with an overall strike length of approximately five kilometres. The host structures are steeply south dipping (80 o ) or sub vertical and are brittle in nature. They are sub-parallel to the stratigraphy and most mineralisation occurs in doleritic host rocks. Magnetic differentiated dolerites are a common host rock for gold mineralisation as is common in much of the Eastern Goldfields. Furthermore there is some association between higher grades and better vein development within the more magnetic parts of the dolerites, as well as the development of veins and associated magnetite destruction.",False,41,41,,Goldfields,"gold, quartz, gold, magnetite",,"host rocks, dolerites, host rock, dolerites",,,"mineralisation, mineralisation, mineralisation, higher grades"
216,a080059_weebo_2008annualreport_16700632_94,a080059_weebo_2008annualreport_16700632.json,80059,97,Annual,94,significant,"Results: The aeromagnetic interpretation has highlighted several lithostructural targets, which may be prospective for gold mineralisation. The LandSat imagery will assist in planning appropriate near-surface sampling techniques over target areas, while the reconnaissance aircore intersected mafic granite and granite gneiss in an area thought to be an extension of the folded greenstone sequence to the south. There were no significant gold results from this drilling. Conclusions: Where appropriate, reconnaissance, near-surface soil sampling (auger or miniRAB) is required to test litho-structural target areas and thereby identify the gold prospectivity of the project area. Summary of Completed Exploration Exploration Completed Location Aeromagnetic interpretation Entire project LandSat data purchase & interpretation Entire project Reconnaissance aircore 9 vertical holes for 215m; WAC001-009 E36/559 3",False,94,94,,,"gold, gold, gold",,"granite, granite, gneiss, greenstone",,,"prospective, mineralisation, significant, prospectivity"
217,a080079_sw_e04_1591_2008a_10741713_83,a080079_sw_e04_1591_2008a_10741713.json,80079,125,Annual,83,prospects,CORAD PTY LTD Page 10 of 39 4.0 CURRENT EXPLORATION PROGRAMME Corad carried out a desktop study of the tenement area with a view to planning a sampling programme of Secure Bay in the second half of the reporting period. To determine the logistics for a sampling exercise a reconnaissance field trip was made to the site in May 2008 and the tenement investigated by helicopter.,True,83,84,"the second half, May 2008",,,,,,,
