,event_id,filename,anumber,sentence_count,report_type,sentence_idx,sentence_triggers,event_text,label,lower_idx,upper_idx,DATE,LOCATION,MINERAL,ORE_DEPOSIT,ROCK,STRAT,TIMESCALE,TRIGGER
380,a086210_c171_2001ar_2009 cr34842_15515538_91,a086210_c171_2001ar_2009 cr34842_15515538.json,86210,261,Annual,91,prospectivity,"Drilling of the Gateway prospect through 2009 delineated a non-JORC compliant resource of 927Kt @ 10.1gt Au for 300Koz. The project is ongoing with further drilling taking place in 2010. Through 2009 work continued on district scale geological framework study and weights of evidence prospectivity analysis utilising arcGIS; the project will be completed in 2010. During the year the operation began an alteration mapping study using spectral data, the project mapped out the alteration zonation around the lodes; the study is ongoing. The current focus involves analysing the spectral data to see if it can provide a tool which can be used to discriminate gold endowed veins/shears from veins/shears poorly endowed with gold through identification of gold related alteration.",False,91,92,"2009, 10.1gt, 2010, 2009, 2010, the year",,"gold, gold, gold",lodes,,,,"prospect, delineated, further drilling, prospectivity"
381,a086228_e51_1217 annual report 2010_appendix one_15679327_15,a086228_e51_1217 annual report 2010_appendix one_15679327.json,86228,22,Annual,15,possible,"Co-ords for hole collars in existing database are based on the AGD66 datum. As per the image below of drilling at Wilbur, GPS located WMC hole positions (black) in most cases reconcile well with database (grey) as confirmed by several holes which could be positively identified. Holes were given arbitrary hole IDs where no identification was possible (MEKC-*). 14 RC holes were located in this area and appear to be drilled subsequent to the WMC holes (all RC holes drilled towards the east) highlighted in red above. These are not in the database and are assumed to be holes completed by Australasian Gold Mines.",False,15,15,,grey,Gold,,,,,"could be, possible"
382,a086273_bc_iron_2009_annual_combined_report_c58_2006_11176113_199,a086273_bc_iron_2009_annual_combined_report_c58_2006_11176113.json,86273,2123,Annual,199,high grade,"The high Al2O3 and SiO2 values in upper flitches are consistent with the presence of minor soil at the top of the CID profile (Figure 4.8), and the general increase in Fe % with increasing depth is considered to represent a sympathetic increase in the iron oxide component as the proportion of soil decreases. CombinedAnnualReportC58/2006NullagineProject 33 CombinedAnnualReportC58/2006NullagineProject 34 CombinedAnnualReportC58/2006NullagineProject 35 Photograph B shows the surface soil horizon in the pit wall of costean 1. Dashed yellow line shows the boundary between CID interbedded with surface soil and CID high grade ore beneath. Note hammer for scale. CombinedAnnualReportC58/2006NullagineProject 36 4.5.5 Bulk Sampling 135 samples of ~2.2 tonnes each were collected into bulka-bags during the trial mining process (Figure 4.9).",False,199,200,"34, 35",,"iron, oxide","CID, CID, CID",,,,"presence of, high grade"
383,a086289_e29_575_2010s_12494384_80,a086289_e29_575_2010s_12494384.json,86289,365,Final Surrender,80,anomalous,"Element Maximum assay result Ni 0.105% Co 0.006% Pt 15 ppb Pd 7 ppb Cr 2790 ppm Mn 2000 ppm Cu 270 ppm Pb 137 ppm Zn 721 ppm Au 0.012 ppm The coincidental NiCu anomaly was checked in the field and attributed to a silicified olivine mesocumulate. Ledge in ultramafic cap to hill Ultramafic is quite silicified by may originally have been something akin to a UOMC. Three rock samples returned anomalous Ni-Cu results with a Niton XRF and were sent to the laboratory. Conclusions: Rock-chip sampling and field investigation downgraded a prospective, newly identified Ni-Cu in soil anomaly. As all targets had been tested, a decision was made to surrender the tenement E29/575.",False,80,82,,,olivine,,,,,"anomalous, prospective"
384,a086292_c28_2008_2010p_12625909_95,a086292_c28_2008_2010p_12625909.json,86292,377,Partial Surrender,95,anomalous,"A reconnaissance soil sampling program was carried out. Values ranged from 2 ppb to 29 ppb gold, with the highest value being found within the area corresponding to C28/2008 (central southern part of P27/1710). ""No cohesive, anomalous zones were located."" Limited exploration for gold over an Archaean greenstone belt covering a number of non-contiguous tenement blocks, adjacent to a mining operation. Sieved soil samples were analysed for gold.",False,95,95,,,"gold, gold, gold",,,greenstone belt,Archaean,anomalous
385,a086385_c99_1994_cah_a_2009_11248114_31,a086385_c99_1994_cah_a_2009_11248114.json,86385,109,Annual,31,favourable,"Healthy project economics under the assessed conditions, with Option 2 (mining, crushing and treatment at 2.0 Mtpa) providing the best financial performance with indicative NPV and IRR values of A$8.1 M and 69%, respectively at a gold price of A$1,063/oz. 7.0 CONCLUSIONS Cazaly and Waratah Gold Ltd have entered into a JV agreement to develop the Mick Adam and Wadi gold deposits within the Castle Hill project area. Engineering and metallurgical studies have indicated the Mick Adam and Wadi deposits are amenable to heap leaching with favourable recoveries, which will mean a relatively low capital expenditure requirement and low operating costs. The Mick Adam and Wadi pits demonstrate economic viability under the conditions used in their optimisation. Conceptual mine designs have been undertaken for each, with associated schedules produced at processing rates of 2.0 and 1.3Mtpa.",False,31,31,,,"gold, Gold",gold deposits,,,,"favourable, optimisation"
386,a086385_mick adam-wadi-scoping study report_11254280_510,a086385_mick adam-wadi-scoping study report_11254280.json,86385,719,Annual,510,could be,"The cyanide will be mixed and dosed directly into the BL and ILS ponds, as required. A cyanide tank exhaust fan will be installed to prevent any build-up of hydrogen cyanide gas in the cyanide mixing area. Alternatively, the cyanide could be supplied as a pre-mixed solution at approximately 30% solution strength. Cement Cement will be transported in a bulk tanker for pneumatic discharge to a vendor-supplied, 60 tonne silo. The cement is discharged via a variable speed rotary valve feeder onto the Scoping Study Report Page 25 agglomeration drum conveyor (CV04) with the ore.",False,510,510,,,,,"mixed, mixed",,,could be
387,a086387_c117-1997 2009 annual report_12737163_1360,a086387_c117-1997 2009 annual report_12737163.json,86387,6977,Annual,1360,could be,"Rip lines larger than 0.1-0.2 m will provide little long-term benefit to vegetation and will increase the Landloch Pty Ltd -39- risk of erosion occurring (Landloch 2009). Cross-slope ripping must be survey-level as sloping rip lines will increase the risk of unacceptable erosion. Ripping could be done to a depth of 0.4 m, However, care should be taken to ensure that saprolitic materials are not bought to the surface during this process. Bunding Perimeter (crest) and cross-bunding are essential for all landform designs. Uncontrolled discharge of runoff from the tops of constructed landforms onto outer batters slopes is a major cause of gullying on existing landforms within the LGP.",False,1360,1360,2009,long,,,,,,could be
388,a086387_c117-1997 2009 annual report_12737163_4120,a086387_c117-1997 2009 annual report_12737163.json,86387,6977,Annual,4120,proposed,"Much of this area has been extensively disturbed due to historic mining activity and exploration. It is considered unlikely that the localised disturbance associated with the haul road development will impact on the conservation status of any of the species of conservation significance listed in Section 3.7.2. Euro to Barrick Granny Smith Road Final.doc 29 CRESCENT GOLD LIMITED LAVERTON GOLD PROJECT EURO TO BARRICK GRANNY SMITH HAUL ROAD 5.4 TOPSOIL AND SOIL PROFILES 5.4.1 Topsoil Characteristics and Estimated Volumes The dominant soil types within the proposed haul road route are shallow red earths, often with a stony mantle, underlain by either deeply weathered greenstone or a silicified hardpan material. Soil reaction is typically slightly acidic to neutral (pH 5.5 to 7.0). Salinity levels are generally low, except for sequences of shallow duplex soils in areas of restricted drainage.",False,4120,4120,,"Euro, Granny Smith, LAVERTON, EURO, GRANNY SMITH","GOLD, GOLD",,"greenstone, hardpan",,,"significance, proposed"
389,a086400_c230_1998_annual report 2009 final_15241305_88,a086400_c230_1998_annual report 2009 final_15241305.json,86400,218,Annual,88,"could be, economically viable",The work done to date has not revealed any alluvial deposits of signficance; however this avenue of investigation has not been fully exhausted. A systematic programme of exploration is proposed which entails:- RAB and/or RC drilling to test the aeromagnetic targets and any geochemical anomalies associated with them.,True,87,88,,,,alluvial deposits,,,,proposed
390,a086431_mtwebber_atlas_annual_report_e452268_0910_10203382_10210123_196,a086431_mtwebber_atlas_annual_report_e452268_0910_10203382_10210123.json,86431,275,Annual,196,enriched,"No historic workings were located during mapping, however there are several historic workings scattered around the margins of the tenement, which are discussed in Section 8. 18 Background magnetics Southern Geoscience PDOReg_SGC_RTP_SEagcs50 Figure 4 Mad Hatters Alteration & Iron Enrichment 19 Figure 5 Mad Hatters Main Areas of Iron Enrichment INDEX Afe4 Strong enrichment Afe3 Moderate enrichment 1 3 2 20 6. Iron enrichment The Cleaverville Fm sediments in the tight synclines are extensively iron enriched in the fold closures (figure 4), where there is abundant intraformational folding (photo 15). Where the sediments wrap around the more open anticline to the west (outside the tenements) iron enrichment is patchier. The iron enrichment has been rated during the collection of the point data (photos, lithological & structural points), and iron enrichment polygons have been subdivided based on intensity of enrichment.",False,196,196,,,"Iron, Iron, Iron, iron, iron, iron, iron",,"sediments, sediments",,,"enriched, patchier"
391,a086434_selby- western tanami annual report 09_9842922_193,a086434_selby- western tanami annual report 09_9842922.json,86434,429,Annual,193,"prospect, prospect, prospect","6.0 TENL 2009 EXPLORATION Exploration in 2009 focused entirely on the Coyote mine site (Figure 2, 3). Figure 1 Project Location 1 : 500,000 Figure 2 Exploration Index Plan 1: 5,000 Figure 3 Drill Hole Location Plan on Interpreted Geology 1: 5,000 Figure 4 Plan view of underground drill hole traces, the Bommie Lode, the North Zone and the South Zone Figure 5 Coyote Mine Long Section, showing actual (blue) and forecast (red) mine development at the end of September 2009.",True,193,194,"2009, the end of September 2009",Long,,Lode,,,,
392,a086494_combined report 2010 complete_14673088_152,a086494_combined report 2010 complete_14673088.json,86494,512,Annual,152,"discovered, may indicate","Target 1 may have an extension to the NE with a linear mid channel response in Ch 25 along the fault, towards the tenement boundary with a larger conductor (not complete) over the boundary. T2 is 1km east - off the linear magnetic anomaly and could be part of a drainage channel running to the north east towards the salt lake. No massive sulphide strength conductors were discovered along the magnetic anomaly and this may indicate the nickel tenor of the ultramafic is low. A small hill with a conductor beneath is always a good target as hills can show have preferential weathering from alteration along one margin. There is a drainage channel nearby so this may be an older saline filled aquifer.",False,152,152,,,"salt, sulphide, nickel",,,,,"extension to the, could be, discovered, may indicate"
393,a086502_e081773_annual report_0910_13963698_10,a086502_e081773_annual report_0910_13963698.json,86502,40,Annual,10,mineralisation,"Atlas plans to conduct follow up exploration activities over the tenement during the next reporting period. These activities will include further rock chip sampling, and more detailed geological mapping and geophysics. 7 3.1 Iron Ore Mineralisation . 9 5.1 Field Reconnaissance . CONCLUSIONS AND RECOMMENDATIONS .",False,10,11,,,,Iron Ore,,,,
394,a086592_c04_2010_2010a_12431448_183,a086592_c04_2010_2010a_12431448.json,86592,323,Annual,183,prospects,"Ground-truthing of earlier work found that there was a relative error between the positioning of the auger soil samples and the follow-up RAB holes and costeans, and concluded that the latter had not been optimally positioned. Bullion also concluded that RAB drill testing of the Gollum and Saruman targets (see Figure 4) by Goldfields had failed to explain the soil anomalies. Bullion carried RAB drilling programs at various prospects as shown in the table below. - 12 - Bullion RAB drilling results >0.5g/t Au are shown in Table 3 below. The intersection of 4m @ 4.21 g/t Au at Bilbo is presumed to be due to supergene enrichment, but the primary source was not identified.",False,183,183,,Goldfields,,,,,,prospects
395,a086626_m45_494_653_2009a_15080827_88,a086626_m45_494_653_2009a_15080827.json,86626,195,Annual,88,mineralisation,"The very low strain and metamorphic grade has resulted in excellent preservation of the sulphide textures from which textural zonation has been recognized (Vearncombe, 1995). Much of the mineralisation formed by replacement of volcanic and volcaniclastic rocks close to the sea floor.",True,88,89,1995,,sulphide,,volcaniclastic rocks,,,mineralisation
396,a086644_m24_39_ 2009a_8567832_56,a086644_m24_39_ 2009a_8567832.json,86644,163,Annual,56,"high grade, mineralisation","The stratigraphic sequence in descending order of the flow units consists of: 1. Fractionated, layered, heterogeneous gabbro, capped by dolerite and basalt.",True,56,57,,,,,"gabbro, dolerite, basalt",,,
397,a086664_unlock-_c130_96__2009a__17046911_614,a086664_unlock-_c130_96__2009a__17046911.json,86664,788,Annual,614,mineralisation,"Oblique view of mineralisation envelopes with drill holes Kintyre deposit lower left, Whale deposits centre right, Pioneer deposits upper right. View to north and down. Extents of mineralisation as presented in Table 2. Cameco Australia Pty Ltd & Mitsubishi Development Pty Ltd Kintyre Uranium Joint Venture Report No. CSA Global completed a desktop technical review of the historic Rio Tinto during the first quarter of 2009.",False,614,614,the first quarter of 2009,Australia,,Uranium,,,,"mineralisation, mineralisation"
398,a086709_annualleinsterdowns 2010_10483830_108,a086709_annualleinsterdowns 2010_10483830.json,86709,117,Annual,108,anomalous,"Best results returned were from sample 1194979 at 6910769mN 265777mE taken from around the middle of the ultramafic belt with a Ni result of 3790ppm, see Figure 4 below. This sample has a correspondingly low Cu result and is not considered to be an indication of massive sulfide mineralization. No anomalous Au grades were returned. Xstrata Nickel Australasia Pty Ltd-Leinster Downs Project Technical Report No: STR 1097 6 The Rock chip samples were also analysed by consultant geochemist Dr Nigel Brand who found the following. ROCK CHIPS Results from a recent rock chip survey (2009) conducted over the exposed ultramafic lithologies on the Leinster Leases indicated the underlying rocks are high MgO ponded cumulates with a high fO2 and little opportunity to produce a Ni$ deposit.",False,108,108,"1194979, 2009","Leinster, Leinster",Nickel,,massive sulfide,,,"mineralization, anomalous"
399,a086713_c53-2009-2010 annual reportduchess-paradise_9770633_214,a086713_c53-2009-2010 annual reportduchess-paradise_9770633.json,86713,303,Annual,214,could be,"The lowermost unit, apparently resting on peneplaned Permian and Triassic rocks, is a light-toned, sometimes yellowish (ferruginous?) saprolitic layer, shown by red ornamentation on the map. It is followed by a dark, scarp-forming unit (map unit Czl), which could be Cenozoic clastic sedimentary beds or laterite. In the north and extreme west, unit Czl is capped by a regional sandplain (unit Czs) with distinctive E-W linear seif dunes. Preliminary sampling of groundwater from Audreys water bore and one exploration hole recorded no stygofauna.",False,214,214,,,,,laterite,,"Permian, Triassic, Cenozoic",could be
400,a086732_e47_1485_2009a_vr_13970572_5,a086732_e47_1485_2009a_vr_13970572.json,86732,13,Annual,5,"significant, mineralisation, mineralisation",Conclusions: Additional geological mapping is recommended and further RC drilling to test the potential of the mineralised Marra Mamba Iron Formation.,True,5,5,,,,,,Marra Mamba Iron Formation,,potential
401,a086734_c133_2006_2009a_14639307_704,a086734_c133_2006_2009a_14639307.json,86734,1859,Annual,704,"low grade, mineralisation, broader, low grade, mineralisation","Primary Cu-Au mineralisation takes the form of chalcopyrite and pyrite in veins. Mineralised veins are concentrated in a 5 to 30 metre wide zone in the hanging wall of the contact between the low- strain, central calc-alkaline unit with strong ferruginous alteration and intermediate schist with moderate ferruginous alteration. Low grade copper mineralisation generally forms a narrower zone or zones within the broader interval of low-grade gold mineralisation. Copper occurs exclusively as chalcopyrite, commonly associated with pyrite and magnetite, in the primary zone. The oxide gold zone is the up-dip continuation of the primary gold zone.",False,702,706,,,"chalcopyrite, pyrite, copper, gold, Copper, chalcopyrite, pyrite, magnetite, oxide, gold, gold, chalcopyrite, pyrite, copper, gold, Copper, chalcopyrite, pyrite, magnetite, oxide, gold, gold",,"schist, schist",,,"mineralisation, Low grade, mineralisation, broader, low-grade, mineralisation, mineralisation, Low grade, mineralisation, broader, low-grade, mineralisation"
402,a086734_c133_2006_2009a_14639307_704,a086734_c133_2006_2009a_14639307.json,86734,1859,Annual,704,"low grade, mineralisation, broader, low grade, mineralisation","Primary Cu-Au mineralisation takes the form of chalcopyrite and pyrite in veins. Mineralised veins are concentrated in a 5 to 30 metre wide zone in the hanging wall of the contact between the low- strain, central calc-alkaline unit with strong ferruginous alteration and intermediate schist with moderate ferruginous alteration. Low grade copper mineralisation generally forms a narrower zone or zones within the broader interval of low-grade gold mineralisation. Copper occurs exclusively as chalcopyrite, commonly associated with pyrite and magnetite, in the primary zone. The oxide gold zone is the up-dip continuation of the primary gold zone.",False,704,704,,,"chalcopyrite, pyrite, copper, gold, Copper, chalcopyrite, pyrite, magnetite, oxide, gold, gold, chalcopyrite, pyrite, copper, gold, Copper, chalcopyrite, pyrite, magnetite, oxide, gold, gold",,"schist, schist",,,"mineralisation, Low grade, mineralisation, broader, low-grade, mineralisation, mineralisation, Low grade, mineralisation, broader, low-grade, mineralisation"
403,a086734_c133_2006_2009a_14639307_1658,a086734_c133_2006_2009a_14639307.json,86734,1859,Annual,1658,highly prospective,"During the quarter geological activity focused on obtaining regulatory approvals for drilling, geophysical analysis, detailed study of historic oil and gas well data, researching exploration models and developed new targets. The terms of the SA exploration licences required compulsory partial surrender at the end of year 1.",True,1658,1659,the end of year 1,SA,,,,,,
404,a086740_nzul_ann_10_12514643_3,a086740_nzul_ann_10_12514643.json,86740,637,Annual,3,mineralised,"The host basalt consists of massive to pillowed flow units and commonly contains unmineralised quartzcarbonate veins. Alteration is extensive and typically chlorite and carbonate. The basalts are foliated and strongly schistose at or near the mineralised shear zones. Gold mineralisation occurs in three sub-parallel; north trending zones, namely the Main Lode, West Lode and East Lode. The zones lie in sub-vertical shear zones 2 to 10 metres wide.",False,3,3,,East Lode,"chlorite, carbonate, Gold","Lode, Lode","basalt, basalts",,,"extensive, mineralised, mineralisation"
405,a086754_kuk_a_2010_17757146_82,a086754_kuk_a_2010_17757146.json,86754,96,Annual,82,prospect,"The Griffins Find ore body is the only other economic mineralisation that has been documented in the region approximately 15km west of Lake Grace. Large areas of the southwest Yilgarn are obscured by regolith particularly on the Kellerberrin, Corrigin, Newdegate and Dumbleyung 1:250,000 sheets. 3.2 Prospect Geology The tenements are interpreted as lying in the western region of the Lake Grace Terrane as described in regional geology 3.1. Granite and felsic to mafic granulites and gneisses occur as scattered outcrops and subcrops throughout farming paddocks in the tenement group. Regolith varies but is Annual Group Report Kukerin Group C127/2006 2009-2010 3 dominated by thin rocky soils and sands over fresh to partially weathered bedrock and higher areas are dominated by thin sands or soils over pisolitic laterite.",False,82,82,2009-2010,"Lake Grace, southwest, Kellerberrin, Corrigin, Newdegate, Dumbleyung, Lake Grace, Kukerin",,,"regolith, Granite, mafic granulites, Regolith, sands, bedrock, sands, laterite",,,economic mineralisation
406,a086763_c119_2005_hogans ar_2009_10_cr34850_10575413_117,a086763_c119_2005_hogans ar_2009_10_cr34850_10575413.json,86763,172,Annual,117,anomalism,"These holes returned anomalism below the transported interface and displayed an alteration assemblage consisting of chlorite biotite lecoxene haematite within a dioritic host rock. Intersections of lamprophyre were also observed in the area. Aircore is not the ideal method to further test this alteration and anomalism, as blade refusal occurs soon after the transported interface. Following an unsuccessful attempt (excessive groundwater) to twin the anomalous historical Goldfields drill hole SAL1089 with RC, a diamond tail (NEWHGDD0001) was drilled by re-entering SAL1089. The drillers experienced problems casing the hole and cased-off at 92m the total depth for SAL1089 was 96m, although it is possible there has been some deviation down hole after the attempt at extending it with RC.",False,117,118,,Goldfields,"chlorite, biotite, diamond",,"host rock, lamprophyre",,,"anomalism, anomalism, anomalous, possible"
407,a086791_baramine project c144_2009 annual report 2009_ 2010_15965217_103,a086791_baramine project c144_2009 annual report 2009_ 2010_15965217.json,86791,120,Annual,103,significant,"Shaw River intends to commence a 6,000m 8,000m RC drilling program in June 2010 in its search for these high grade bodies.",True,103,103,June 2010,,,,,,,high grade
408,a086838_c73_2008_2010a_14517258_47,a086838_c73_2008_2010a_14517258.json,86838,474,Annual,47,mineralisation,"INTRODUCTION This report outlines the mineral exploration activities carried out over the tenement group C73/2008, which comprised tenements E70/2801 and E70/3000, between 12 March 2009 and 11 March 2010 for the Rocky Gully Project. The primary target in the area was nickelcopper sulphide mineralisation. Herons work indicated that the geology and mineralisation of the project area share similarities with those of the NeboBabel (Musgrave region), Voiseys Bay (Canada), Thunder Bay North (Canada), Talnakh (Norilsk, Siberia) and Santa Rita (Brazil) massive sulphide nickel deposits. Such chonolithconduit mineralisation models have not yet been tested within the AlbanyFraser Orogen. Much of the project area is freehold land.",False,47,47,"between 12 March 2009, 11 March 2010","Rocky Gully, Norilsk, Siberia","sulphide, sulphide",nickel deposits,,,,"mineralisation, mineralisation, mineralisation"
409,a086838_c73_2008_2010a_14517258_458,a086838_c73_2008_2010a_14517258.json,86838,474,Annual,458,rise,"The rock was a black, coarse-grained hornblendite with minor biotite alteration. No key sulphide minerals were observed in the field. This suite gave rise to the maximum assay recorded for gold, which was 11 ppb. Atriplex Ltd, Rocky Gully Project (C73/2008) Annual Report 2010 28 Drilling chips were thin sectioned and petrographically examined by Minerex Services Pty Ltd. The presence of pentlandite, chalcopyrite and pyrrhotite as fine grains up to 200 m in size was confirmed.",False,458,459,2010 28,Rocky Gully,"biotite, sulphide, gold, pentlandite, chalcopyrite, pyrrhotite",,hornblendite,,,"rise, presence of"
410,a086870_ma_c33_2010_2010a_14946696_732,a086870_ma_c33_2010_2010a_14946696.json,86870,1877,Annual,732,proposed,"The project area is located near the north-eastern shores of Lake Barlee, approximately 137 km west of the town of Leonora in the Murchison region of Western Australia. The tenement encompasses a total area of 21,010 hectares. As part of the initial planning stages of the proposed exploration program, Jupiter Mines commissioned Outback Ecology Services (Outback Ecology) to undertake a terrestrial fauna, desktop study in conjunction with vegetation and flora desktop study of the Mt Alfred project area. No site inspection was undertaken and results presented are conclusions based on a desktop study only. A general assessment was made as to the likelihood of particular species of conservation significance occurring within the project area, given the broad habitat types likely to occur.",False,732,733,,"Lake Barlee, Leonora, Murchison, Western Australia",,,,,,"proposed, significance, broad"
