,event_id,filename,anumber,sentence_count,report_type,sentence_idx,sentence_triggers,event_text,label,lower_idx,upper_idx,DATE,LOCATION,MINERAL,ORE_DEPOSIT,ROCK,STRAT,TIMESCALE,TRIGGER
562,a096596_e70_3986_2012a_18170183_130,a096596_e70_3986_2012a_18170183.json,96596,158,Annual,130,delineating,"The detailed interpretation of the low level aeromagnetic survey suggests several conceptual structural targets exist, which warrant further investigation. During 2008 and 2009 an auger program was undertaken over three separate periods within the Duggan tenement. This focussed on delineating targets specified by the aerial magnetic, radiometric and digital elevation model (DEM) surveys. Initially the sampling program was carried out on a 50 x 200m grid using a tractor mounted auger supplied by Roy S. Miles, a Dumbleyung based fencing contractor and later it was completed using a hand auger. 1520 samples were collected to an average depth of 500mm.",False,130,131,"2008, 2009","Duggan, Dumbleyung",,,,,,delineating
563,a096596_e70_3986_2012a_18170183_126,a096596_e70_3986_2012a_18170183.json,96596,158,Annual,126,"mineralisation, mineralisation","As a result of the low level aeromagnetics a detailed Digital Elevation Model (DEM) was produced. During the course of interpreting the results of the surveys, a number of detailed magnetic and radiometric images were produced. These images were invaluable during the re-interpretation of geology (Figure 6 in an interpreted solid geology plan), regolith, gold mineralisation and emphasizing the importance of the historic drilling and gave a greater understanding of the known mineralisation. This reinterpreting phase was primarily done using Discover 3D software. The detailed interpretation of the low level aeromagnetic survey suggests several conceptual structural targets exist, which warrant further investigation.",False,126,126,,,"gold, gold",,"regolith, regolith",,,"mineralisation, mineralisation, mineralisation, mineralisation"
564,a096788_e52-2118 - final surrender report - 03feb13_10907839_40,a096788_e52-2118 - final surrender report - 03feb13_10907839.json,96788,145,Final Surrender,40,"significant, mineralization","The dominant structural feature is a set of parallel west-south westerly trending faults that cross the tenement in the northern half. These are associated with the graben at the edge of the Bangemall Basin. They are thought to be significant foci for the location of hydrothermal Padbury Mining Ltd Final Surrender Report E52/2118 Report No: R131.2013 6 fluids, particularly in relation to mineralization of the Fortnum and Horseshoe Lights gold mines. To the east there is a syncline and to the west a related anticline, both containing BIF and Horseshoe Formation haematitic shales. Recent and Tertiary alluvium from floodplain areas of the Yarlarweelor Creek and tributaries dominate cover sequences across the tenement.",False,40,40,,"Bangemall Basin, Horseshoe","hydrothermal, gold",,"BIF, shales, alluvium",Horseshoe Formation,Tertiary,"significant, mineralization"
565,a096842_c210_2010 combined annual report_12101736_54,a096842_c210_2010 combined annual report_12101736.json,96842,132,Annual,54,"presence of, potentially, mineralisation, mineralisation","It is worth noting however that the anomalous areas are mapped as generally sub cropping basement, whereas the areas between the anomalism are generally mapped as transported colluvium or alluvium, and therefore the anomalism may potentially extend below this transported cover. In the south of the sample area there is a coincident gold (>5ppb Au; maximum value of 40ppb Au), copper (>100ppm; maximum value of 259ppm Cu), nickel (>60ppm Ni; maximum value of 155ppm Ni) and zinc (>50ppm Zn; maximum value of 108ppm Zn) anomaly, which is recorded as being transported alluvium and colluvium.",True,54,55,,,"gold, copper, nickel, zinc",,"colluvium, alluvium, alluvium, colluvium",,,"anomalous, anomalism, anomalism, potentially"
566,a097278_e70_3823_2013s_15717635_11,a097278_e70_3823_2013s_15717635.json,97278,73,Final Surrender,11,economically viable,"A special mining lease covering an area of 12,619km2 of mainly forested Crown land was granted for WANL in 1961. Scout drilling and sampling of the duricrust revealed significant deposits in the Jarrahdale-Dwellingup region to the south-east of Perth, which were later exploited after Aluminium Company of America (Alcoa) joined the WANL venture to become Alcoa World Alumina Australia in 1977.",True,10,11,"1961, 1977","Jarrahdale, Dwellingup, Perth, Australia",Aluminium,,duricrust,,,significant
567,a097499_c61_2005_maitland final surrender report_12774059_63,a097499_c61_2005_maitland final surrender report_12774059.json,97499,115,Final Surrender,63,significant,"3.1 2007 3.1.1 Rock Chip Sampling The main work completed in 2007 over the current combined reporting group included the collection and analysis of 12 rock chip samples as summarised on Table 1 and on Figure 3. Full dataset presented in Appendix 1. These samples were part of reconnaissance rock chip sampling of significant outcrops and workings. Samples consisted of 2-3 kg of rock, collected from a common source within a localised area. All samples were submitted to Kalassays, Kalgoorlie for Au - 40g charge aqua regia digest ICP-MS analysis (submission #KG07111412).",False,63,64,2007,Kalgoorlie,,,,,,significant
568,a097578_final surrender report e74 375 pyramid sub project rev1_11804486_65,a097578_final surrender report e74 375 pyramid sub project rev1_11804486.json,97578,144,Final Surrender,65,mineralisation,Figures 9B and 9C both show two separate peneconcordant redox changes. The second redox is mineralised in these and in other sections. Section H also has weak mineralisation in the reduced facies above the second redox change. The second oxidised facies seems to inter-finger with the reduced here just east of the mineralisation. This seems to suggest that the oxidation was secondary and mobilised mineralisation above it and below it.,False,65,67,,,,,,,,"mineralised, mineralisation, mineralisation, mineralisation"
569,a097600_caz_ear_c101_2012_2012an_10881290_99,a097600_caz_ear_c101_2012_2012an_10881290.json,97600,148,Annual,99,"mineralisation, prospect","There was reasonable coincidence at the western end of the Exploration Licence however, from approximately 2kms eastward the peak gravity readings seemed to trend south of the ironstone outcrop. It would appear that, eastwards of line 289000E, the best magnetite zones may in fact lie out under the sandy spinifex plains and not have a surface expression. 5.2.7 Davis Tube Testing Vector Resources Ltd Magnetite mineralisation intersected at the Ivan Well West prospect during the 2009 exploration campaign returned in-situ iron grades of less than 30% Fe. Therefore, the economic viability of magnetite mineralisation within the Earaheedy Basin depends not only upon the tonnage of resources, but also upon the amenability to upgrade magnetite. Accordingly, fifty seven (57) five meter composite samples of magnetite mineralisation from the RC drilling completed within Exploration Licence E 69/2062 during 2009 were submitted to NAGROM for Davis Tube tests to determine the amenability of mineralisation to be upgraded.",False,99,99,"2009, 2009",Earaheedy Basin,"magnetite, Magnetite, iron, magnetite, magnetite, magnetite",,ironstone,,,"mineralisation, prospect, mineralisation, mineralisation, mineralisation"
570,a097663_final annual report 2013 c228-2007_11026284_62,a097663_final annual report 2013 c228-2007_11026284.json,97663,266,Annual,62,confirmed the presence,This section similar to Section 8 in that only minor intercepts of carbonaceous and/or graphitic materials intercepted. Drilled in new area along fenceline and pwerline. Confirmed the presence of the target sequence Pscc and Pscs but at relatively deeper levels between 32-50m vertical depth. Intercepted the Reduced Zone but lacks higher concentrations of carbonaceousgraphite materials. Tested to downhole depths of blade refusal at 42- 49m Section RGM_PL_Sect11: Holes AC018-AC020.,False,61,63,,,,,,,,"minor intercepts, Confirmed the presence"
571,a097731_pfg_e38_1649_2013amerpt_17336541_24,a097731_pfg_e38_1649_2013amerpt_17336541.json,97731,29,Annual,24,discovered,"The rock types consist of interlayered, basaltic and dacitic, meta-volcanics, subordinate banded iron formations and ultramafic schists. These rocks host rich gold-bearing lodes that in the past have been extensively mined to depths in excess of 150 metres. Paynes Find Gold Project_E59/1649_AMERpt_2013 Page 9 6: Previous Exploration and Mining Gold was first discovered at Paynes Find in 1911 and since that time has been sporadically mined by way of the underground mining of rich gold bearing shoots. More recent mining of surface gold-bearing alluvial and near-surface laterite has been undertaken, returning on average in excess of 0.3g/t Au In 1983, geological mapping of the area was undertaken by the West Australian Geological Survey (GSWA) (Ninghan 1:250,000 Geological Series Lipple et al 1983). In 1987 Falcon Australia Limited (Falcon) carried out exploration of the Carnation Gold Mine.",False,24,24,"9 6, 1911, 1983, 1983, 1987",Australia,"gold, Gold, Gold, gold, surface gold, Gold",lodes,"basaltic, banded iron formations, schists, laterite",,,discovered
572,a097744_mr_c87_2010_2012a_14529325_89,a097744_mr_c87_2010_2012a_14529325.json,97744,154,Annual,89,"prospective, extensive, proposed, prospective",Proposed EM points over the prospective section of Ultramafic at Mt Remarkable.,True,89,89,,,,,,,,"Proposed, prospective"
573,a097772_atr weebacarry e51_1021 2012_14829181_46,a097772_atr weebacarry e51_1021 2012_14829181.json,97772,105,Annual,46,anomalism,"Note that gossans and gossanous black shale horizons occur at the contact between the Main Felsic and the underlying mafic unit. These have been the target of significant historical drilling, both for base metals and gold; Main Felsic package. Comprising felsic to andesitic rocks, this package hosts the alteration, Sb, As and Tl anomalism, and the rock sample containing the gossan clast in felsic matrix, with high pathfinder geochem. The western margin is interpreted to be the exhalative horizon; Upper mafic- developed only in the north, and apparently pinching out in the vicinity of the target conductor; Upper Felsic- again, only developed in the north and pinched out along strike to the south; High magnesian basalt, developed all the way along the western edge of the package; and Granite, again forming along the entire western edge of the project area. The data collected by all workers to date suggests a VMS style alteration package is developed within the Main Felsic, and extends to the north into an Alchemy tenement.",False,46,47,,,gold,"base metals, VMS","gossans, black shale, gossan, basalt, Granite",,,"significant, anomalism"
574,a097754_e08_2077_2013s_15868153_71,a097754_e08_2077_2013s_15868153.json,97754,223,Final Surrender,71,"anomalism, potential, mineralisation","At present (2013) Aurora are actively exploring for manganese at their Capricorn Southeast Project, which lies directly north and east of Mt Augustus (refer Figure 2) and approx. Airborne Geoscience Exploration NL (AGE) 2000-2002 Airborne Geoscience Exploration NLs tenement E08/1154 formed part of their Cheyne Spring Project and overlapped a portion of Shaw Rivers current E08/2077. AGE applied for the tenement on the basis of an interpretation of regional geochemical mapping data published by the Geological Survey of Western Australia (Pye et al., 1998) The data revealed a series of strong zinc stream sediment anomalies with associated silver, cadmium and lead anomalism aligned with stratigraphy and suggesting a potential for strata-bound zinc mineralisation (Agar, 2002). These lithologies are typical of deposition in a shallow marine environment marginal to the Bangemall Basin and are very similar to the lithologies and depositional environment of the Middle Proterozoic Upper McNamara Group, Lawn Hill, Queensland, which hosts the giant Century deposit and many other zinc and lead mineral occurrences (Andrews, 1998, Broadbent et al, 1998). From the regional stream sediment geochemical data AGE identified 2 target areas within the tenement (NW target and SE target).",False,71,71,"2013, 2000-2002, 1998, 2002, Century, 1998, 1998","Capricorn, Western Australia, Bangemall Basin, Queensland","manganese, zinc, silver, cadmium, lead, zinc, zinc, lead",,"sediment, sediment",McNamara Group,Proterozoic,"anomalism, potential, mineralisation"
575,a097794_burracoppin 2013 annual c198-2010_17492535_215,a097794_burracoppin 2013 annual c198-2010_17492535.json,97794,284,Annual,215,anomalous,"Hole ID From To Au (ppb) Bi (ppm) Cu (ppm) BURC028 128 132 426 11.1 153 The four metre re-split result showed that the gold was virtually confined to the one metre interval of 131132 metres, as was the bismuth anomaly; however the copper assays do not closely correlate with gold, see Table 5.",True,215,215,,,"gold, bismuth, copper, gold, gold, tungsten, gold, bismuth, copper, quartz, gold, bismuth, copper, gold",,dolerite,,,"mineralisation, anomalous, broad"
576,a097794_burracoppin 2013 annual c198-2010_17492535_215,a097794_burracoppin 2013 annual c198-2010_17492535.json,97794,284,Annual,215,anomalous,"If this is the case then there is gold/tungsten mineralisation over a strike of approximately 3.7km from the historic Easter Gift deposit to drillhole BURC026. Four drill holes (BURC028031) were drilled just south of Johnstons Road to the northwest of the beak of the Duck. The eastern-most drill hole produced an anomalous gold result of 0.43g/t Au over four metres from 128 metres depth with elevated bismuth and copper assays. This occurred in a broad dolerite interval that was weakly chloritised and had minor quartz veining, see Table 4. Hole ID From To Au (ppb) Bi (ppm) Cu (ppm) BURC028 128 132 426 11.1 153 The four metre re-split result showed that the gold was virtually confined to the one metre interval of 131132 metres, as was the bismuth anomaly; however the copper assays do not closely correlate with gold, see Table 5.",False,215,215,,,"gold, bismuth, copper, gold, gold, tungsten, gold, bismuth, copper, quartz, gold, bismuth, copper, gold",,dolerite,,,"mineralisation, anomalous, broad"
577,a097998_catalyst minnie creek annual report 09_1174_201306_14112167_182,a097998_catalyst minnie creek annual report 09_1174_201306_14112167.json,97998,451,Annual,182,prospect,"The Mundine Well Dolerite Suite has been dated at 755 3 Ma. E09/649 was first granted to Sovereign Resources NL in 1994. Equatorial described the geology of E09/649 as consisting of two distinct types of granite: (1) early stage, gneissic biotite-muscovite adamellite granitoid to the north and (2) late stage, fine to coarse grained and foliated granodiorite and adamellite (similar to the Minnie Springs Prospect host). A series of east-west to east-southeast trending faults through the main granite body were interpreted from LANDSAT, radiometric and aeromagnetic data. A narrow belt of quartzite and quartz schists trends WNW-ESE in the north.",False,182,183,1994,,"biotite, muscovite, quartz",,"granite, adamellite, granitoid, granodiorite, adamellite, granite, quartzite, schists",Mundine Well Dolerite Suite,,
578,a098054_mount danvers (e08-2341) annual report to 15 may 2013_17641181_125,a098054_mount danvers (e08-2341) annual report to 15 may 2013_17641181.json,98054,152,Annual,125,potential,Work Done: The Company acquired all available public geological and geophysical data. All open file exploration reports were acquired and studied. All data was compiled into a data base and layered into a Mapinfo workspace to assess the potential and locate first pass targets for ground exploration. Heritage survey was conducted and approved by native title claimed. Results: Drill targets acquired and approved for RC Drilling.,False,125,126,,,,,,,,potential
579,a098057_p24_4586a_2013_16761888_26,a098057_p24_4586a_2013_16761888.json,98057,248,Annual,26,mineralisation,"Access from Kalgoorlie is via the major Goldfields Highway, from where the tenement can then be reached through station and existing exploration tracks. During the following year exploration activities will include further data analysis of the surrounding areas and attempts to link mineralisation models.",True,26,27,,"Kalgoorlie, Goldfields",,,,,,mineralisation
580,a098084_dmp arc e09-1782 2012-2013 annrep 05jun13_17741979_34,a098084_dmp arc e09-1782 2012-2013 annrep 05jun13_17741979.json,98084,105,Annual,34,"medium grade, extensive","The metamorphic and structural history of each zone also contrasts with the histories of the zones that bound it. The Gascoyne Complex was primarily shaped by four separate orogenic events: The 2005-1960 Ma Glenburgh Orogeny The 1830-1780 Ma Capricorn Orogeny The 1680-1620 Ma Mangaroon Orogeny The 1030-950 Ma Edmundian Orogeny 5 The Gascoyne Complex within E09/1053 is associated with the Mangaroon Orogeny and comprises metasedimentary rocks of the Pooranoo Metamorphics which were deposited at or before 1680Ma (Million Years). During the Mangaroon Orogeny these low to medium-grade mainly psammitic rocks were deformed and metamorphosed and intruded by extensive granites of the Durlacher Supersuite. The supersuite comprises mainly monzogranite, syenogranite and granodiorite. The Gascoyne Complex is fault-bounded to the east by younger Mesoproterozoic rocks belonging to the Edmund sedimentary basin which was affected by the Edmundian Orogeny reactivating faults and shear zones within the Gascoyne Complex as well as folding of sedimentary rocks of the Edmund Group.",False,34,34,"2005-1960, 1830-1780",Capricorn,,,"metasedimentary rocks, granites, monzogranite, syenogranite, granodiorite, sedimentary rocks","Gascoyne Complex, Gascoyne Complex, Pooranoo Metamorphics, Durlacher Supersuite, Gascoyne Complex, Gascoyne Complex, Edmund Group",Mesoproterozoic,"medium-grade, extensive"
581,a098135_c12-2007 annual report mt jackson east 2013_12669484_28,a098135_c12-2007 annual report mt jackson east 2013_12669484.json,98135,62,Annual,28,mineralisation,"Basaltic rocks flank the BIF to the south and have an apparent moderate to steep dip to the north. 3.1.3 Charlton The Charlton prospect hosts small E-W trending, steeply dipping goethite-haematite mineralised body within a jaspilitic BIF bounded by mafic rocks. This mineralisation is partially capped by canga. 3.1.4 Picnic The Picnic prospect is a small mineralised zone hosted within the steeply dipping Jaspilitic BIF. Hanging and footwall lithologies are dominated by basalts and BIFs.",False,28,29,,,goethite,,"Basaltic, BIF, BIF, mafic rocks, BIF, basalts, BIFs",,,"prospect, mineralisation, prospect, mineralised"
582,a098117_e53-1494 annual technical report 2013_10874399_107,a098117_e53-1494 annual technical report 2013_10874399.json,98117,240,Annual,107,"prospect, anomalism","YGWR034 contained a 0.6 ppm anomaly in the top 4 metres which corresponds to the centre of the auger soil anomalism. Dolerite textures remain well-preserved in the upper (indurated) 10 m of the drill holes, becoming much more obscure at the end of the hole. Northwest Arsenic Zone (later known as the Virgo Prospect) This area was drilled to test the strongest arsenic anomalism in the German Well area. Both drill holes (YGWR25-26) were anomalous in arsenic with the highest values (120 and 35 ppm respectively) concentrated at the top of the holes. No gold anomalism was detected.",False,107,107,,,"Arsenic, arsenic, arsenic, gold",,Dolerite,,,"anomalism, anomalism, anomalous, anomalism"
583,a098492_e702839_s_2013_12461964_145,a098492_e702839_s_2013_12461964.json,98492,179,Final Surrender,145,enrich,"Geochemistry is no substitute for geology as samples can have contamination and geologic variance from features such as xenoliths, dykes, interbedding units etc. Alteration may affect chemical composition of mobile elements. Weathering may enrich and deplete certain elements and ratios such as K, Na, Fe and Al. No single geochemical feature can independently distinguish between all rock types at Kukerin but the units each have characteristic chemical compositions. Exploration work type File name Format Office studies Literature search Database compilation Computer modelling Reprocessing of data General research Report preparation E702839_S_2013 Pdf Other (specify) E702839_S_Verification Report Pdf Airborne exploration surveys Aeromagnetics- Appendix 111-Refer to CD Radiometrics Electromagnetics Gravity Digital terrain modelling Other (specify) Remote sensing Aerial photography LANDSAT SPOT MSS Radar Other (specify) Ground exploration surveys Geological Mapping Regional Reconnaissance Prospect Underground Costean Ground geophysics Radiometrics Magnetics.",False,145,145,,Kukerin,,,xenoliths,,,enrich
584,a098535_e57_827 final surrender report 2013_16471779_17,a098535_e57_827 final surrender report 2013_16471779.json,98535,55,Final Surrender,17,potential,"Despite a comprehensive search of WAMEX (Department of Mines and Petroleum) open file reports, no exploration relating to this work is available. It is assumed that this work occurred during the 1970s nickel boom. 1997-1998: Navigator Pty Ltd Navigator Pty Ltd explored the region for gold potential. Several rock chip samples were taken along the southern extension of the Edale Shear Zone with no anomalous base metal or gold values. Navigator noted the historic costeaning described above and similarly, could not find exploration data relating to this work.",False,17,19,"1970s, 1997-1998",,"nickel, gold, gold",base metal,,,,"potential, anomalous"
585,a098596_e77_1355_2013s_16977986_368,a098596_e77_1355_2013s_16977986.json,98596,475,Final Surrender,368,high grade,"After igneous olivine, minor olivine, chromite (stichtite), magnetite Uacs$ Uacs($) Uacm Carbonate. (magnesite-rich) +/- magnetite (high CO2 alteration) Uacm$ Uacm($) Uaclt$ High grade metamorphism. Granular to bladed metamorphic olivine, minor anthophyllite - talc, magnetite Uaclt High grade metamorphism. Granular to bladed metamorphic olivine, minor anthophyllite - talc, magnetite Uacl High grade metamorphism. Granular to bladed metamorphic olivine, minor anthophyllite - talc, magnetite Uaclx High grade metamorphism.",False,368,369,,,"olivine, olivine, chromite, stichtite, magnetite, Carbonate, magnesite, magnetite, olivine, anthophyllite, talc, magnetite, olivine, anthophyllite, talc, magnetite, olivine, anthophyllite, talc, magnetite",,,,,"High grade, High grade, High grade"
586,a098754_e38-1758 2013s_15571203_45,a098754_e38-1758 2013s_15571203.json,98754,54,Final Surrender,45,extensive,"Johnsons Well Mining also completed limited RAB drilling across the tenement in 1996. Location: E38/1758 is located approximately 100kms north of Laverton, Western Australia. Geology: E38/1758 is part of the Moolart Well Project (C82/2011) which covers an extensive area of the Duketon Greenstone Belt and is part of the Archaean Yilgarn Craton. The Duketon Greenstone Belt is a linear to arcuate north-north westerly trending belt of supracrustal rocks bounded within granitic rocks by the Hootanui Fault to the west and the Lulu Fault to the east. K:\Library\Departmental Reporting\4 Surrender Reports\E38-1758\E38-1758 2013S.docx Page 3 of 17 TABLE OF ACTIVITIES FOR TENURE PERIOD Tenement Lag/Soil Sampling AC Drilling RC Drilling Production Bores Samples Holes Metres Holes Metres Holes Metres E38/1758 100 182 12,423 2 320 1 162 Results: There were no significant assay results recorded from the lag/soil sampling or the AC drilling.",False,45,45,1996,"Laverton, Western Australia, Moolart Well, Yilgarn Craton",,,"granitic rocks, Lag, lag","Duketon Greenstone Belt, Duketon Greenstone Belt",Archaean,"extensive, significant"
587,a098877_malcolm p37_6998 annual report 2013_12134046_54,a098877_malcolm p37_6998 annual report 2013_12134046.json,98877,71,Annual,54,future exploration,The data compilation was required as the previous exploration data was all available only in a hard copy format with the data being sourced from numerous file reports requiring significant data entry to create a useable database. Part of the challenge of the visit was to reconcile the local grid conversions to MGA coordinates. The electronic database has allowed an integrated interpretation of all available data which will permit target definition for future exploration programmes. The grid transformation from the Sir Samuel local grid to MGA is shown below. The grid transformation from AMG to MGA is shown below.,False,54,55,,Sir Samuel,,,,,,"significant, future exploration"
588,a098864_mb_1584_2013s_14220107_92,a098864_mb_1584_2013s_14220107.json,98864,239,Final Surrender,92,"zone may extend, extensive","The Companys field crew were remobilised to the site last week and identified more widespread carnotite mineralisation, extending the discovery area. The new carnotite mineralisation was found in low calcrete mounds protruding from beneath the soil cover, up to 200m away from the initial discovery area. The zone may extend for a further 200m before disappearing under extensive sand cover. The project fringes desert country to the north. Last week grab samples were taken from yellow carnotite mineralisation identified in soft, friable calcrete in the new area.",False,92,92,"last week, Last week",,"carnotite, carnotite, carnotite",,"calcrete, sand, calcrete",,,"mineralisation, extending the discovery, mineralisation, zone may extend, extensive, mineralisation"
