,event_id,filename,anumber,sentence_count,report_type,sentence_idx,sentence_triggers,event_text,label,lower_idx,upper_idx,DATE,LOCATION,MINERAL,ORE_DEPOSIT,ROCK,STRAT,TIMESCALE,TRIGGER
0,a071633_27600 morrissey_9355974_51,a071633_27600 morrissey_9355974.json,71633,92,Final Surrender,51,extensive,"The target horizon considered prospective for Broken Hill Style lead-zinc mineralisation was the Lower Proterozoic Morrissey Metamorphics. This unit consists of schist, phyllite, quartzite, micaceous quartzite and thick sequences of quartzo-feldspathic paragneiss. The Morrissey Metamorphics is a metamorphosed sequence of shale, siltstone, sandstone, greywacke, arkose and conglomerate, with extensive migmatite development. Small amphibolite and calc-silicate bodies derived from basalt and carbonate sediments respectively also occur within the sequence. The Morrissey Metamorphics were intruded by early stage gneissic granitoids during or just after peak metamorphism.",False,51,51,,Broken Hill,"lead, zinc, silicate",,"schist, phyllite, quartzite, quartzite, paragneiss, shale, siltstone, sandstone, greywacke, arkose, conglomerate, migmatite, amphibolite, basalt, carbonate sediments, granitoids","Morrissey Metamorphics, Morrissey Metamorphics, Morrissey Metamorphics",Proterozoic,"prospective, mineralisation, extensive"
1,a071816_apollo 2005 annual tech report_11275634_186,a071816_apollo 2005 annual tech report_11275634.json,71816,264,Annual,186,"minor gold, mineralisation","The width of the anomaly is at least 150m and has not been closed off. The anomaly occurs over the felsic-metabasalt contact where it displays a jog. Only minor gold mineralisation was intersected by vertical aircore holes (up to 0.16g/t Au). The anomaly is very similar to the Southern Arsenic anomaly and contains low gold values. At the Camp prospect follow-up bedrock aircore drilling on 80m spaced lines intersected erratically distributed, anomalous gold values in dolerite over a strike length of 1,920m.",False,186,186,,,"gold, Arsenic, gold, gold",,"metabasalt, bedrock, dolerite",,,"mineralisation, prospect, anomalous"
2,a071875_700-100-go-rep-0002_13675165_172,a071875_700-100-go-rep-0002_13675165.json,71875,204,Annual,172,"significance, prospects, follow up work","The Minyari lease areas are known to be covered by deep lateritic and transported gravel and aeolian sand cover, with a varied weathering and erosional profile. Existing regional aeromagnetics, covering the entire Minyari Dome, has highlighted a complexly folded domal structure with existing prospects located within the core region of this dome. The following work program is recommended to test the extent and significance of existing goldcopper prospects shown in Figure 5.1 plus locate new target areas suitable for follow-up work: 1. A limited program of infill RC and diamond drilling is recommended over the Minyari Prospect to test for down dip and down plunge extensions to known mineralisation. Diamond drillholes would need to be strategically located to help define stratigraphy and structure in accordance with the established Newcrest logging and database management systems.",False,172,172,,,"diamond, Diamond",,"gravel, sand",,,"prospects, significance, prospects, mineralisation"
3,a071950_c591_1994_2005a_16001655_730,a071950_c591_1994_2005a_16001655.json,71950,797,Annual,730,high grade,"The deposit was estimated by ResEval using Inverse Distance to Power 2 (ID2) grade interpolation, constrained by resource outlines based on mineralisation envelopes prepared using a nominal 0.5/t cut-off grade and a minimum downhole length of 3m. The block dimensions used in the model were 5m NS x 10m EW x 5m vertical with subcells of 2.5m x 5m x 2.5m. The Mineral Resource is reported using a high grade cut of 20g/t was used for the Horseshoe, Cassidy and Pod zones, whereas a cut of 10g/t was used for the Hangingwall zone. The Mineral Resource was largely classified as Indicated due to the reasonable continuity of the mineralised zones and the adequate drillhole spacing. However, zones defined by wider spaced drilling (>20-30m), poor continuity and therefore lower confidence were classified as Inferred.",False,730,730,,Horseshoe,,,,,,"mineralisation, high grade"
4,a071977_kurnalpi 2005_19331320_138,a071977_kurnalpi 2005_19331320.json,71977,171,Annual,138,mineralization,"The basaltic doleritic units provide an excellent geochemical and rheological host for the gold mineralization. In summary previous exploration on Western Resources Pty Ltds Kurnalpi project has defined numerous zones gold mineralisation associated with quartz veined and altered zones within predominantly weathered mafic volcanics. More recent deeper drilling at one of these prospects areas, the Brilliant Prospect, has returned wide zones of gold mineralisation within strongly quartz veined and intensely altered basaltic to doleritic intrusives.",True,137,139,,Kurnalpi,"gold, gold, quartz, gold, quartz",,"basaltic, basaltic",,,"mineralization, mineralisation, prospects, mineralisation"
5,a072020_goldenvalley_ann_05_11276734_61,a072020_goldenvalley_ann_05_11276734.json,72020,294,Annual,61,prospects,"Face and stockpile sampling was completed by PDAP staff. Drillhole locations are shown in Figure 7. 4.4.1 RB and AC Drilling AC and RB holes were drilled at the Six Mile North, Golden Valley, and Finnimont prospects (Figure 7). Holes were drilled at various azimuths and dips (see Appendix 2 for drill data). Twelve AC holes were drilled at Six Mile North (M27/157).",False,61,61,,,,,,,,prospects
6,a072089_kun_ann_05_17468294_804,a072089_kun_ann_05_17468294.json,72089,944,Annual,804,mineralisation,"The model includes 16 diamond holes drilled between November 2004 and January 2005 that were designed to improve definition of the likely reserve area. The model supersedes the July 2004 (RUG0604) estimate and is intended for feasibility study investigations and for generating publicly released resource/reserve statements. RUG0505 was generated from the same mineralisation wireframes and drill data used to create the April 2005 Rubicon open pit resource model (ROP0405). Model construction is consistent with the May 2004 Hornet underground model (HUG0504), with differences reflecting the specific differences in drill data and mineralisation between the deposits. RUG0505 and HUG0504 have compatible origins and orientations to allow them to be merged into a single model if required.",False,804,804,"November 2004, January 2005, July 2004, April 2005, May 2004",Hornet,diamond,,,,,"mineralisation, mineralisation"
7,a072158_c15_2006_2005a_15133097_63,a072158_c15_2006_2005a_15133097.json,72158,186,Annual,63,mineralisation,"Hard rock production from the Ruby Well Mine is reported total 4,120 ounces of gold from 7,500 tonnes of ore from a series of small shafts and pits set in gold bearing quartz reefs (I5886, A29591).",True,63,63,,,"Ruby, gold, gold, quartz",,,,,
8,a072178_eureka annual report 2005-2006_14675181_50,a072178_eureka annual report 2005-2006_14675181.json,72178,68,Annual,50,"underground resource, underground resource",A common corollary of such enrichment is an area of impoverishment immediately below. Deeper drilling is required to test below the zone of postulated depletion.,True,50,51,,,,,,,,
9,a072262_bhp383165_2006a_14910125_6,a072262_bhp383165_2006a_14910125.json,72262,29,Annual,6,proposed,"Field checking of geochemical sample sites and proposed drill sites was carried out in January 2006 in preparation for drilling however wet weather and heritage concerns lead to the program being postponed. Ground disturbance approval was given by the Department of Industry Resources however the Department of Indigenous Affairs has requested a heritage survey be completed prior to commencement of any ground disturbing activities as there are registered Aboriginal sites in this area. The proposed holes CH7 and CH8 are shown on Figure 3. Prospecting Licence P38/3165 forms part of the Ben Hur project, located 50 kilometres north of Laverton. The licence covers an area of 75.15 hectares extending in a narrow L shaped corridor 3.8 kilometres south to north and 1.7 kilometres east to west infilling gaps remaining between graticular exploration licence applications.",False,6,7,January 2006,Laverton,lead,,,,,"proposed, proposed"
10,a072284_gvjv_19-2005_2006a_12505377_258,a072284_gvjv_19-2005_2006a_12505377.json,72284,654,Annual,258,"prospecting, prospect","Denig, W., 1999: Trough Well, Bullfinch North Data Review, Polaris Metals NL Report No 1999-7 (unpublished). Golden Valley Joint Venture Project Combined Annual Report 2006 Polaris Metals NL Page 13 Dreverman, P., 2004 (July): 2003 Annual Report for Bullfinch North Project, E77/1010, Western Areas NL Report No E77/1010_2003A (unpublished). Evans, W. J., 1985: Annual Report on Prospecting Licence 77/206, Golden Valley Prospect, Jackson SH50-12, Western Australia, CRA Exploration Pty Ltd Report No 13613 (unpublished). Keats, W., 1991: Geology and Gold Mines of the Bullfinch-Parker Range Region, Southern Cross Province, Geological survey of Western Australia, Report No 28. Mathews, L. R., 2005: Lake Deborah Gravity Survey, Resource Potentials Report No 5009 (unpublished).",False,258,258,"1999, 2004, July, 2003, 1985, 1991, 2005","Bullfinch, Bullfinch, Jackson, Western Australia, Bullfinch, Southern Cross, Western Australia",Gold,,,,,
11,a072285_c67_2003_2006a_12640575_78,a072285_c67_2003_2006a_12640575.json,72285,738,Annual,78,potentially,"Emperor and Shogun resource estimates are via a block models (250 m x 250 m x 0.5 m and 100 m x 100 m x 0.5 m respectively) by Robsearch at a 500 ppm U cutoff. The Emperor 1 Resource is that where all blocks had average grade greater than the cut off grade (i.e. The Emperor 2 Resource is that assigned to the full selective mining category; this being where the average grade of a block (which were very large) was under cut off, but a large proportion of the block contained material greater than cut off, which could potentially be recovered by a selective mining process. We include this material in the total resource because of the very high cut off grade of 500 ppm U used by Robsearch for the block model compared to the grade of 200 ppm U that will be used in future studies, and therefore the likelihood that this material will subsequently be classified as part of the resource. A review of the resource estimates was commenced during the year by the Brisbane based consultants Taylor Wall, as part of an authorised due diligence commissioned by Maple Minerals.",False,78,78,the year,,,,,,,potentially
12,a072369_wilthorpe annual report report 2006 vol 2_16888478_70,a072369_wilthorpe annual report report 2006 vol 2_16888478.json,72369,75,Annual,70,mineralisation,"S, Q Z Sm te ? M m n M m te D O L S ?",True,70,71,,,,,,,,
13,a072376_bb_2006a_10327822_344,a072376_bb_2006a_10327822.json,72376,1823,Annual,344,prospect,Holes CWD001-3 were drilled by contractor Major Drilling via an RC precollar using a UDR650 rig with a 5.5 face sampling hammer and an NQ2 sized diamond drill core tail whilst CWD004 was drilled by contractor DWDH using a UDR1000 rig with an RC pre-collar 5.5 face sampling hammer and an NQ2 sized diamond drill core tail. Holes were located via a GPS and picked up accurately by Spectrum Surveys using a DGPS.,True,344,345,,,"diamond, diamond",,,,,
14,a072386_jc_2005a_16148319_71,a072386_jc_2005a_16148319.json,72386,223,Annual,71,mineralisation,"Underground exposure, mapping, sampling and geological understanding is sufficient to classify parts of these zone 250 domains within Lens B Panels 1 and 2 and Lens F Panel 1 north as measured. The ore zone domain boundaries in the Wallaby Underground resource, together with the 3.0g/t cutoff grade, define mineralisation considered to have reasonable prospects for eventual underground economic extraction. The wireframe domain boundaries were created using zones of continuous alteration, structural domain boundaries, structural dip and dip direction symbols, a decoded rock and alteration field and gold mineralisation to a nominal 1g/t cut-off. These parameters have a direct relationship with the visible orezone structures mapped and interpreted in the underground development. Statistical analysis of dry density measurements in fresh rock conglomerate material indicate a dry density value 2.77t/m3.",False,71,71,,Wallaby,gold,,conglomerate,,,"mineralisation, prospects, mineralisation"
15,a072391_c125_2004_2006a_12728776_3510,a072391_c125_2004_2006a_12728776.json,72391,10764,Annual,3510,proposed,"FMG proposes to seek environmental approval for the Cloud Break iron ore mine (No Beneficiation) and associated infrastructure with a life of 12 years at a production rate of 10 to 30 million tonnes per annum (Mtpa) that will be exported via the Port Hedland facility. The proposed ore will not be additional to the 45 Mtpa proposed to be mined from FMGs other mines, but rather will be blended with ore produced from these mines, to allow greater flexibility in terms of product grade control and meeting customer requirements. To ensure that the cumulative impacts of the Cloud Break Project, FMGs other projects and other relevant projects in the area are well understood, cumulative impacts will be a key focus of the studies proposed in this Scoping Document. The specialist consultants for groundwater, surface water, flora and vegetation, and fauna will (have) consider(ed) cumulative impacts. The overall ecological and social impact of Cloud Break, and other mining projects in the area, in particular in the Chichester Ranges, will be assessed in the context of the principles of sustainability.",False,3510,3510,12 years,Port Hedland,,iron ore,,,,"proposes, proposed, proposed, proposed"
16,a072391_c125_2004_2006a_12728776_9651,a072391_c125_2004_2006a_12728776.json,72391,10764,Annual,9651,encourage,"Remove any hydrocarbon contaminated soils for remediation. Contour to restore natural drainage. Rip surface to alleviate compaction and encourage re- growth of native vegetation (refer to Revegetation Plan Section). Train loading yard Leave site in a safe, stable, non-polluting and tidy condition with no remaining plant or infrastructure that is not required for postoperational use. No remaining plant or infrastructure that is not required for postoperational use.",False,9651,9651,,,,,,,,encourage
17,a072398_c0892002_annual reprt_2005a_14670786_120,a072398_c0892002_annual reprt_2005a_14670786.json,72398,210,Annual,120,mineralisation,"The geochemistry of these Tertiary caprock outliers will be significantly different from the surrounding materials. Mobile minerals will be concentrated in the caprock while the surrounding saprolite will be a depletion zone. ORIG DESIGN DATE COMMENTS MGA Coordinates, GDA94 DDDDD D DD D DDD DD D D D D D D D DDD D DD D D DDD D D DD DD D D D D DD DD D D DDDDDDDD D D D D DDD D D DDD DDD D D Check for mineralisation below paleochannel Positive results terminate on edge of paleo land surface. Mineralisation probably extends eastwards into the oxide zone below the surface soils. L L SFC SFC SFC Weak mineralised unit One good result on land surface Low grade anomalism surrounding palaeo surface SFC remnant L Strongly mineralised unit?",False,120,120,,,oxide,,"caprock, caprock, saprolite",,Tertiary,"significantly, mineralisation, Low grade, anomalism"
18,a072426_lpw_2005a_9611955_80,a072426_lpw_2005a_9611955.json,72426,85,Annual,80,significant,In some cases the geological environment of the magnetic anomaly allows a choice to be made between these possibilities. Ultramafic units for example will be stratabound and are unlikely to be found in the middle of thick felsic volcanic sequences. Iron Formation is narrow but with great strike extent it also is generally a well-exposed unit and significant BIF should have been picked up by Hallberg. Areas with potential to host nickel mineralisation are called Targets but none fall within the boundaries of M38/0390. See Figure 2 for Tenement details.,False,80,81,,,nickel,,"Iron Formation, BIF",,,"significant, potential, mineralisation"
19,a072451_c101_2003_2005a_14708906_67,a072451_c101_2003_2005a_14708906.json,72451,85,Annual,67,mineralisation,"9 As accumulations of massive to disseminated Ni + Cu + PGE sulphides at the base of thick differentiated gabbro sills. A good example of this style occurs at the base of the Stillwater gabbro lopolith in Montana. The recent discovery of the Collurabi Ni-CuPGE mineralisation to the north of Laverton may well belong to this style. Ultramafic rocks generally have a strong magnetic signature. However, the known mapped ultramafic units in the Crescent Leases are non-magnetic probably because they are sheared and retrogressed in fault zones.",False,67,67,,Laverton,sulphides,PGE,"gabbro, gabbro",,,mineralisation
20,a072486_c305_1996_2005a_14250496_134,a072486_c305_1996_2005a_14250496.json,72486,209,Annual,134,mineralisation,"The footwall domain: To the west of the calc-alkaline units, the footwall domain is characterised by mafic and ultramafic schist, dolerite and banded iron-formation. 6.0 Project Mineralisation Copper and gold at Admiral Hill display a high degree of spatial correlation, although the greater mobility of copper in the supergene zone causes some separation. As presently known, the main contribution to copper-gold mineralisation is in the supergene zone, approximately coincident with, and beneath, the andalusite-bearing schist ridge. Copper and gold occur sporadically throughout the leached, kaolinitic rock. Copper, mainly as malachite and chalcocite, is concentrated near the base of the supergene zone, but gold is more widespread, being retained in relatively refractory quartz veins.",False,134,134,,,"iron, Copper, gold, copper, copper, gold, andalusite, Copper, gold, Copper, malachite, chalcocite, gold",,"schist, dolerite, schist, quartz veins",,,"correlation, mineralisation"
21,a072649_bwsm36_602annualreport2006_11289231_94,a072649_bwsm36_602annualreport2006_11289231.json,72649,127,Annual,94,possible,"No topsoil was removed. No plastic bags were used during drilling and all rubbish was removed from the area immediately. During drilling care was be taken to spread spoil to allow vegetation to re-establish between sample piles, as small an area as possible was disturbed, salinity of ground water was monitored and water and fines were contained. Rehabilitation was to be carried out immediately after drilling holes were plugged and back filled in accordance with DME/EPA/AuDAX guidelines. An audit has been conducted to determine the state and progress of rehabilitation of old drill sites.",False,94,94,,,,,plastic,,,possible
22,a072652_gms grp 1 annual 2006_14541809_29,a072652_gms grp 1 annual 2006_14541809.json,72652,180,Annual,29,"possible, delineated","The anomalous Hannans South fault structure (NNE fault) which extends into the western and central zones from the Hannans South gold deposit has anomalous historical drilling results within close proximity and requires further exploration. The Several high strain zones within the group of thin ultramafic units are gold mineralisation targets, especially where they intersect N-S and NNE faults. Southern Geoscience Consultants conducted the initial interpretation of the phase 1 gravity survey where four possible drilling targets were delineated. The Bouguer gravity data generated displayed some subtle gravity-high features in the western section of the Group 1 package adjacent to Hannans East open pit. These have been interpreted as buried mafics within the dominant felsic volcanic/sediment package and so were considered good targets for drilling.",False,29,30,,,gold,gold deposit,sediment,,,"anomalous, anomalous, further exploration, mineralisation, possible, delineated"
23,a072707_mtyuleannrep2006_13929682_129,a072707_mtyuleannrep2006_13929682.json,72707,253,Annual,129,could be,"Thus an economic iron ore deposit in the area could be developed as a mine with low infrastructure costs. The area is mostly freehold farmland so native title is less of an issue, and as the area has largely been cleared for farming and grazing and therefore degraded as native vegetation and fauna habitat, environmental issues should be decreased. 7.1 Reconnaissance Trip to E70/2731 Mt Yule Iron Ore Project, June 2005 A first-pass reconnaissance visit was made to MGMs Walebing EL area from June 13th 15th in order to locate areas of interest as well as areas that could be relinquished. Fieldwork was undertaken by geologists John Bridson and Glenn Whalan from a base in New Norcia. Subsequent to this visit a trip was made to the GSWA library in the search for historical exploration data.",False,129,129,"June 2005, June 13th 15th",,,"iron ore deposit, Iron Ore",,,,"could be, could be"
24,a072707_mtyuleannrep2006_13929682_198,a072707_mtyuleannrep2006_13929682.json,72707,253,Annual,198,"prospect, potential",Interest in the Mt.,True,198,198,,,,,,,,
25,a072821_coolgardie_combined_annual_2005_12942716_199,a072821_coolgardie_combined_annual_2005_12942716.json,72821,1235,Annual,199,possible,"10.1 Discussion92 10.2 Exploration Potential.94 10.3 Existing Resources with Potential to Expand and Convert to Mineable Reserves.103 As part of conducting due diligence on behalf of Matador and as part of a technical report, Mr. S. Capp, B.Sc., M.Aus.I.M.M., was commissioned to review the existing Herald Leviathan resource models for the Coolgardie tenements and calculations for both recent and historical data (Besserer et al., 2005, Capp, 2005a). The intent of his review was to comment on the quality of the models, calculations and existing databases from which the models were created, provide comments as to the quality of the existing resources and, where possible, classify the existing resources based upon Best Practice Guidelines for the Estimation of Mineral Resources and Mineral Reserves (CIM, 2003) and CIM Definition and Standards on Mineral Resource and Mineral Reserves (CIM, 2004). A total of 14 geographically separate deposits on the combined RJV tenements, of which 10 are within the Coolgardie tenements, were considered appropriate for the purposes of current resource estimation under NI 43-101. Drilling at the 10 Coolgardie deposits consists of approximately 237,000 m in 3,340 drillholes.",False,199,199,"2005, 2003, 2004","Coolgardie, Coolgardie, Coolgardie",,,,,,"Potential, possible"
26,a073089_mt venn e38_1000 annual 2005-2006_12524913_80,a073089_mt venn e38_1000 annual 2005-2006_12524913.json,73089,128,Annual,80,significant,"Copper and nickel sulphides were encountered in several holes and in one instance a large zone of massive carbonate was encountered. Significant intercepts are reported in Table 2. No significant anomalies in PGE were intercepted. A total of 2459 sample were assayed from the RC drilling and analysed by the schedule set out in Table 3. 7.2 Geological Mapping A short geological mapping program was conducted at 1:10,000 scale.",False,80,80,,,"Copper, nickel, sulphides, carbonate",PGE,,,,"Significant, significant"
27,a073100_annual mineral exploration all 2005-6_14130454_444,a073100_annual mineral exploration all 2005-6_14130454.json,73100,2806,Annual,444,mineralised,"Syncline with In-Fill 2. Stratigraphic Shearing along or within any of the above geological scenarios could cause localised gravity lows within the broader gravity low. A number of Air Core lines will permit an understanding of the gravity lows and whether they are mineralised or of no interest. There are many other gravity lows in between the two bounding magnetic anomalies further south that should be drilled if the initial exploratory holes uncover mineralisation. The following image shows a compilation of drilling (large coloured dots), geochemical surveys (small black dots) which have been gridded to show red as high gold and purple as low gold.",False,444,446,,,"gold, gold",,,,,"broader, mineralised, mineralisation"
28,a073100_annual mineral exploration all 2005-6_14130454_1183,a073100_annual mineral exploration all 2005-6_14130454.json,73100,2806,Annual,1183,prospects,"Access was difficult along this densely vegetated fluvial system, and easy elsewhere with very sparsely scattered bushes/shrubs, several haul roads, and numerous old tracks and trails. The area is covered by arrays of rock chip spoil piles from previous regional RAB and RC drilling programs, which provided useful information of subsurface geology, especially in areas of little to no outcrop. Shallow trenches exposed bedrock at Blackjack and Batavia prospects. Previous studies have referred to the Gabanintha Shear - a supposed regional shear zone that links the deposits of Reedy goldfield in the south, through Yaloginda-Bluebird goldfield to Paddys Flat at Meekatharra in the north (SBM Exploration Annual Report, 1997). A more detailed interpretation was developed by Marjoribanks (1997).",False,1183,1185,"1997, 1997","Gabanintha, Reedy, Meekatharra",,,bedrock,,,prospects
