event_id,filename,sentence_idx,sentence_text,n_trigger_words,trigger_words_in_sentence,trigger_words_in_event,event_text,ORE_DEPOSIT,ROCK,MINERAL,STRAT,LOCATION,TIMESCALE,event_label,reviewed,Near Miss Event,Key trigger phrase
a077536_kunann2007_18499634_1884,a077536_kunann2007_18499634.json,1884,the pegasus underground reserve has been evaluated on the k2 mineralisation from the pegasus underground resource model (pug1006) using the cut off grades as determined in the rubicon underground project feasibility cost model.,1,['mineralisation'],['mineralisation'],"resource memorandum and reports on the pope john resource and scoping study are provided in appendix 6. 5.3 pegasus underground mining reserve the pegasus underground resource model was released in october 2006, and reported in the 2006 kundana annual report. the pegasus underground reserve has been evaluated on the k2 mineralisation from the pegasus underground resource model (pug1006) using the cut off grades as determined in the rubicon underground project feasibility cost model. the resource model includes an indicated tonnes of 263,478 at a grade of 9.86g t for 83,524 contained ounces.",[],[],[],[],['kundana'],[],0,False,,
a077536_kunann2007_18499634_1968,a077536_kunann2007_18499634.json,1968,"ghd07 11, 196.3m hand specimen: the drill core sample represents a patchy grey rock composed of paler grey to white ovoid coalesced felsic patches in medium grey matrix.",1,['patchy'],['patchy'],"ghd07 11, 159.0m hand specimen: the drill core sample represents a massive medium grained dark greenish grey rock with uniformly distributed felsic patches ~2 3 mm in size. rock name : medium intensity biotite chlorite altered meta micrographic quartz dolerite : ghd07 11, 196.3m hand specimen: the drill core sample represents a patchy grey rock composed of paler grey to white ovoid coalesced felsic patches in medium grey matrix. cutting the rock is a single thin fracture containing a loose concentration of small ragged lustrous sulphide grains, with similar grains more sparsely disseminated through the host rock.",[],"['dolerite', 'host rock']","['biotite', 'chlorite', 'quartz', 'sulphide']",[],"['grey', 'grey', 'grey', 'grey']",[],0,False,,
a077536_kunann2007_18499634_1972,a077536_kunann2007_18499634.json,1972,the veins cut patchy grey to white altered host rock which contains a significant amount of disseminated lustrous sulphide including euhedral blocky silvery arsenopyrite crystals.,1,['patchy'],['patchy'],"rock name : calcite sulphide fractured and medium intensity biotite sulphide calcite altered meta granophyre : ghd07 11, 239.3m hand specimen : the drill core sample captures two subparallel white veins ~1 cm wide, filled mostly by translucent grey to white vein quartz and aggregates of lustrous silvery yellow pyrite. the veins cut patchy grey to white altered host rock which contains a significant amount of disseminated lustrous sulphide including euhedral blocky silvery arsenopyrite crystals. rock name : quartz sulphide chlorite gold veined and chlorite sulphide overprinted, biotite altered meta granophyre mason geoscience pty ltd report #3334 22 october 2007 23 barrick gold of australia.",[],"['granophyre', 'host rock', 'granophyre']","['calcite', 'sulphide', 'biotite', 'sulphide', 'calcite', 'quartz', 'pyrite', 'sulphide', 'arsenopyrite', 'crystals', 'quartz', 'sulphide', 'chlorite', 'gold', 'chlorite', 'sulphide', 'biotite', 'gold']",[],"['grey', 'grey', 'australia']",[],0,False,,
a077536_kunann2007_18499634_2114,a077536_kunann2007_18499634.json,2114,"it is possible that a significant proportion of this fine grained foliated mat is actually altered felsic lithic fragments, because some faintly preserved shapes of small angular ?fragments are locally distinguishable.",1,['possible'],['possible'],"sericite is abundant and occurs in different sites: i) most occurs as a fine grained moderately foliated mat throughout the rock. this appears to represent deformed and altered primary fine grained matrix. it is possible that a significant proportion of this fine grained foliated mat is actually altered felsic lithic fragments, because some faintly preserved shapes of small angular ?fragments are locally distinguishable. ii) some sericite occurs as dense replacement mats in angular to wispy patches up to ~ 2 mm long, elongated in the trace of the foliation.",[],[],"['sericite', 'sericite']",[],['long'],[],0,False,,
a077536_kunann2007_18499634_2137,a077536_kunann2007_18499634.json,2137,"strict acquisition procedures were adhered to, which ensured that within reason, as good as possible quality data were collected.",1,['possible'],['possible'],"in this time tdem data were collected along 11 lines using a 100m x 100m moving loop, producing 513 points of data over 13.25 line kilometres. data quality and repeatability were monitored throughout the course of the survey. strict acquisition procedures were adhered to, which ensured that within reason, as good as possible quality data were collected. em instrumentation a zonge multipurpose gdp 32 receiver was used to take all of the em data for this project.",[],[],[],[],[],[],0,False,,
a077536_kunann2007_18499634_2227,a077536_kunann2007_18499634.json,2227,mineralisation and weathering domains mineralisation and weathering domains used for hug1005 and rug0505 are summarised in table 2.1.,2,"['mineralisation', 'mineralisation']","['mineralisation', 'mineralisation', 'mineralisation']","based on the characterisation of uncertainty perceived by the feasibility study personnel, this project appears to be robust and low risk. were no nearby higher quality holes. mineralisation and weathering domains mineralisation and weathering domains used for hug1005 and rug0505 are summarised in table 2.1. both models were based on a similar mineralisation interpretation comprising a central k2 core associated with quartz veining surrounded by a lower grade envelope.",[],[],['quartz'],[],[],[],0,False,,
a077536_kunann2007_18499634_2232,a077536_kunann2007_18499634.json,2232,low grade k2 envelope 3.,1,['low grade'],['low grade'],"rubicon project underground feasibility study east kundana joint venture 02 geology.doc 8 domain description 1. background, predominantly barren 2. low grade k2 envelope 3. k2 core southern central 5.",[],[],[],[],['kundana'],[],0,False,,
a077536_kunann2007_18499634_2237,a077536_kunann2007_18499634.json,2237,low grade k2 envelope 3.,1,['low grade'],"['low grade', 'low grade']","mary fault (not estimated) 1. background, predominantly barren 2. low grade k2 envelope 3. k2 core south of white foil fault low grade 4.",[],[],[],[],['white foil'],[],0,False,,
a077536_kunann2007_18499634_2240,a077536_kunann2007_18499634.json,2240,k2 core north of white foil fault low grade rubicon mineralisation domains 6.,2,"['low grade', 'mineralisation']","['low grade', 'low grade', 'mineralisation']",k2 core south of white foil fault low grade 4. k2 core south of white foil fault high grade 5. k2 core north of white foil fault low grade rubicon mineralisation domains 6. k2 core north of white foil fault high grade 1.,[],[],[],[],"['white foil', 'white foil', 'white foil', 'white foil']",[],0,False,,
a077536_kunann2007_18499634_2261,a077536_kunann2007_18499634.json,2261,"within this southerly plunging envelope, strongest mineralisation continuity direction is moderately plunging to the north.",1,['mineralisation'],['mineralisation'],"indicator variogram models for each deposit, one set of indicator variograms was modelled from k2 composites. overall geometry of higher grade zones is influenced by the intersection of ductile shear zones and the k2 structure giving a steep southerly plunge. within this southerly plunging envelope, strongest mineralisation continuity direction is moderately plunging to the north. the moderate northerly plunging continuity direction is shown by indicator variogram maps and is consistent with stretching lineations measured from pit exposures at rubicon.",[],[],[],[],[],[],0,False,,
a077536_kunann2007_18499634_2266,a077536_kunann2007_18499634.json,2266,"resource classification due to the broad drill spacing relative to mineralisation shapes, limited grade continuity, and the highly skewed grade distribution (which makes estimates sensitive to a small number of very high grade assays), it is inappropriate to classify any remaining k2 mineralisation as measured.",3,"['broad', 'mineralisation', 'mineralisation']","['broad', 'mineralisation', 'mineralisation', 'mineralisation']","search criteria table 2.3 summarises the six progressively more relaxed search passes used for both models. except for boundaries between individual k2 core domains, all domain boundaries were treated as hard. resource classification due to the broad drill spacing relative to mineralisation shapes, limited grade continuity, and the highly skewed grade distribution (which makes estimates sensitive to a small number of very high grade assays), it is inappropriate to classify any remaining k2 mineralisation as measured. for both deposits better understood portions of the k2 mineralisation typically.",[],[],[],[],[],[],0,False,,
a077562_gardner annual report 2007_17543587_3,a077562_gardner annual report 2007_17543587.json,3,gold mineralisation in the kookaburra deposit occurs along the limbs and nose of a syncline and is associated with fold hinge saddle reefs.,1,['mineralisation'],"['mineralisation', 'mineralisation']",table 1 summary of exploration table 2 tenement details table 3 best rock chip assays table 4 lyrebird best drill intercepts of 4m composite samples table 5 tent hill east assay results of a 4m at 0.38g t au composite sample re sampled as 1m samples table 6 sandpiper resource reserve estimate the kookaburra and sandpiper deposits are approximately 300m apart and both are hosted by the proterozoic bald hill member. gold mineralisation in the kookaburra deposit occurs along the limbs and nose of a syncline and is associated with fold hinge saddle reefs. at sandpiper the gold mineralisation appears to be largely confined to the southern limb of an anticline.,[],[],"['gold', 'gold']",[],[],['proterozoic'],0,False,,
a077562_gardner annual report 2007_17543587_20,a077562_gardner annual report 2007_17543587.json,20,several anomalies were outlined and followed up with further drilling.,1,['further drilling'],['further drilling'],"the top of fresh rock occurs at between 100m and 75m depth, shallowing to the northwest of both deposits. 5.0 previous exploration exploration work on tenements of the gardner project has been carried out over 14 years by the following companies: 1993 1994 dominion gold operations pty ltd (e80 1526) 1994 2000 tanami exploration nl (e80 1735) 1994 2000 glengarry mining nl 2000 2004 barrick gold of australia ltd 2004 today tanami exploration nl early exploration programmes included a low level aeromagnetic survey and several surface geochemical and drilling programmes, including regional auger sampling, lag sampling, soil sampling, termitaria sampling, vacuum drilling and rab drilling. several anomalies were outlined and followed up with further drilling. all prospect locations are shown on figure 2.",[],['lag'],"['gold', 'gold']",[],['australia'],[],0,False,,
a077562_gardner annual report 2007_17543587_44,a077562_gardner annual report 2007_17543587.json,44,"assay results were overall disappointing, with the best ones being returned from the bikini prospect, where a broad wnw trending zone of low level gold anomalism and associated strong arsenic anomalism extends over seven kilometres strike length indicating potential for smaller resources.",2,"['broad', 'potential']","['broad', 'potential', 'mineralisation']","follow up aircore drilling defined a number of prospects, which were tested with further aircore drilling. beneath 20 60 metres of transported cover drilling intersected greywacke, shale, siltstone, carbonaceous shale and dolerite of the killi killi formation. assay results were overall disappointing, with the best ones being returned from the bikini prospect, where a broad wnw trending zone of low level gold anomalism and associated strong arsenic anomalism extends over seven kilometres strike length indicating potential for smaller resources. in 2004 tenl commenced exploration with an assessment of previous exploration in particular focusing on previously defined mineralisation and resources.",[],"['greywacke', 'shale', 'siltstone', 'shale', 'dolerite']","['gold', 'arsenic']",['killi killi formation'],[],[],0,False,,
a077562_gardner annual report 2007_17543587_55,a077562_gardner annual report 2007_17543587.json,55,"tanami exploration nl c97 2004 gardner project 2007 annual report 7 field exploration in 2005 focussed on strike extensions of possible nw se controlling structures, with emphasis on following up on higher grade prospects, rather than persisting with targeting bald hill sequence host rocks only.",1,['possible'],['possible'],"in july 2005 tenl commissioned a high resolution sub audio magnetic (sam) survey over the bald hill area, one covering the area from lyrebird to kookaburra sandpiper and a smaller one over the koobaburra sandpiper area only. in may 2005 geoscience australia, in partnership with tanami gold and newmont mining completed a 2d seismic survey across the tanami desert, which included two traverses, one north south and the other east west, across the gardner project area. tanami exploration nl c97 2004 gardner project 2007 annual report 7 field exploration in 2005 focussed on strike extensions of possible nw se controlling structures, with emphasis on following up on higher grade prospects, rather than persisting with targeting bald hill sequence host rocks only. first pass surface geochemistry was completed at a variety of prospects.",[],['host rocks'],['gold'],[],['australia'],[],0,False,,
a077562_gardner annual report 2007_17543587_63,a077562_gardner annual report 2007_17543587.json,63,infill rab at hawk south sandpiper (e80 1905) tested the possibility of joining the two zones of mineralisation.,1,['mineralisation'],"['mineralisation', 'low grade', 'mineralisation']",a four metre composite sample from a hole drilled beneath outcropping quartz veins containing visible gold failed to return positive assay results. this indicates the presence of nuggety gold at lyrebird and confirms the necessity to resample any anomalous composite samples and any intersections containing quartz veining. infill rab at hawk south sandpiper (e80 1905) tested the possibility of joining the two zones of mineralisation. only low grade gold mineralisation was intersected.,[],['quartz veins'],"['gold', 'gold', 'quartz', 'gold']",[],[],[],0,False,,
a077562_gardner annual report 2007_17543587_72,a077562_gardner annual report 2007_17543587.json,72,slightly elevated gold mineralisation of 4m @ 0.12 g t au from 4.00m was intersected in gda0008.,1,['mineralisation'],['mineralisation'],"follow up rab drilling of ten holes at eagle (e80 2036) failed to intersect any significant gold beneath the 6.66g t au rock chip sample but returned significant intersections beneath the 1.97g t au quartz veins with 1m at 2.01g t au from 33m in lgb0599, and 1m at 1.55g t au from 48m and 1m at 1.22g t au from 99m in lgb0600. eleven rab aircore holes were drilled on an east west orientated line across tenement e80 2453 to test two magnetic lineaments interpreted as northern continuations of the quartz ridge dolerite and or bald hill sequence. slightly elevated gold mineralisation of 4m @ 0.12 g t au from 4.00m was intersected in gda0008. aircore drilling to follow up a 0.7g t au aircore anomaly (sheldrake) in the tern palaeochannel from 2004, south of tern south returned the only significant intercept of 3m @ 0.93 g t au from 42.00m in lga0186.",[],"['quartz veins', 'dolerite']","['gold', 'quartz', 'gold']",[],[],[],0,False,,
a077562_gardner annual report 2007_17543587_86,a077562_gardner annual report 2007_17543587.json,86,the program rationale was based on the potential of un drilled sections of gold host lithological units and structural settings known to host mineralisation at bald hill.,2,"['potential', 'mineralisation']","['potential', 'mineralisation']","rab aircore drilling in the dove tern area encountered anomalous results including 4m @ 0.12g t au from 44m in gdb0065, whilst drilling on tent hill east returned a best intercept of 8m at 0.1g t au from 44m in gdb0085. 6.0 tenl exploration in 2007 tenl carried out a review of the tenements of the gardner project area, which led to the relinquishment of e80 3379. the program rationale was based on the potential of un drilled sections of gold host lithological units and structural settings known to host mineralisation at bald hill. a total of 64 rab holes for 5,654m and 24 aircore holes for 2,194m were completed within the gardner project area.",[],[],['gold'],[],[],[],0,False,,
a077562_gardner annual report 2007_17543587_103,a077562_gardner annual report 2007_17543587.json,103,no significant gold mineralisation was intersected.,1,['mineralisation'],['mineralisation'],"the best assay result was returned from gda0060 with 4m at 0.49g t au from 40m. approximately 300m north west of the tern south prospect one traverse of 7 aircore holes with an 80m spacing, totaling 617m, were drilled targeting a fold closure of the bald hill sequence (ptsb). no significant gold mineralisation was intersected. difficult drilling conditions for rab ac indicate that rc is required in future to comprehensively test both prospect.",[],[],['gold'],[],[],[],0,False,,
a077562_gardner annual report 2007_17543587_109,a077562_gardner annual report 2007_17543587.json,109,"the second part of the program, 800m to the north, tested the possible northwest vulture trend extension with a single four drill hole rab traverse with a 240m hole spacing.",1,['possible'],['possible'],"the step out drill holes with a 400m x 240m spacing north and south of the 2006 drilling encountered weak mineralization and confirmed consistent low level anomalism peaking at 51ppb au. the anomalism is coincident with a synformal fold closure of both quartz ridge dolerite and bald hill member lithological units. the second part of the program, 800m to the north, tested the possible northwest vulture trend extension with a single four drill hole rab traverse with a 240m hole spacing. one hole on that line (lgb0608) returned a spot value of 4m at 0.38g t au from 28m associated with quartz veining hosted within a fine grained metasediment.",[],['dolerite'],"['quartz', 'quartz']",[],[],[],0,False,,
a077562_gardner annual report 2007_17543587_130,a077562_gardner annual report 2007_17543587.json,130,geology and potential for gold mineralisation in the billiluna tanami area (including discussions of gold potential and proposed exploration of el80 292 and 323).,3,"['potential', 'mineralisation', 'potential']","['potential', 'mineralisation', 'potential', 'mineralisation']","anglogold internal company memorandum. and gascoine d.r. geology and potential for gold mineralisation in the billiluna tanami area (including discussions of gold potential and proposed exploration of el80 292 and 323). coyote gold project, western australia geology and mineralisation of the kookaburra and sandpiper gold deposits.",['gold deposits'],[],"['gold', 'gold', 'gold']",[],['western australia'],[],0,False,,
a077562_gardner annual report 2007_17543587_170,a077562_gardner annual report 2007_17543587.json,170,"western tanami coyote deep diamond drilling report for further potential anglogold internal report nt.12189 smith, r. 2000.",1,['potential'],"['potential', 'mineralisation']","anglogold internal company report. sinclair, j. western tanami coyote deep diamond drilling report for further potential anglogold internal report nt.12189 smith, r. 2000. report on structural observations and interpretations in the western tanami with specific reference to the mineralisation at coyote.",[],[],['diamond'],[],['sinclair'],[],0,False,,
a077562_gardner annual report 2007_17543587_213,a077562_gardner annual report 2007_17543587.json,213,gd_wadl3_dhassay_2007a.txt downhole assays gd_wasg3_surf_2007a.txt surface sampling gd_wasg3_ssassay_2007a surface sampling assays gd_wasl3_coll_2007a.txt drillhole collars gd_wadl3_geol_2007a.txt downhole geology gd_wadg3_dhsamp_2007a.txt downhole samples and assays gd_wads3_dhsurv_2007a.txt downhole survey tgnl geological codes.pdf geology codes gd_wadl3_alt_2007a.txt downhole alteration gd_wadl3_vein_2007a.txt downhole veining gd_wadl3_weat_2007a.txt downhole weathering tanami exploration nl c97 2004 gardner project 2007 annual report 1 1.0 summary tanami gold nl identified the potential for palaeoproterozoic gold mineralisation in the western tanami area in 1994.,2,"['potential', 'mineralisation']","['potential', 'mineralisation']","the very high grade assay values were not repeated, however the elevated gold mineralization of the vein was confirmed by the following assay results: the rock chip samples, which tested quartz veining along strike hosted within bald hill member sediments did not returned significant assaying results. a maximum assay of 170ppb au was returned approx 100m to the se along strike of vulture. gd_wadl3_dhassay_2007a.txt downhole assays gd_wasg3_surf_2007a.txt surface sampling gd_wasg3_ssassay_2007a surface sampling assays gd_wasl3_coll_2007a.txt drillhole collars gd_wadl3_geol_2007a.txt downhole geology gd_wadg3_dhsamp_2007a.txt downhole samples and assays gd_wads3_dhsurv_2007a.txt downhole survey tgnl geological codes.pdf geology codes gd_wadl3_alt_2007a.txt downhole alteration gd_wadl3_vein_2007a.txt downhole veining gd_wadl3_weat_2007a.txt downhole weathering tanami exploration nl c97 2004 gardner project 2007 annual report 1 1.0 summary tanami gold nl identified the potential for palaeoproterozoic gold mineralisation in the western tanami area in 1994. the gardner project comprises six exploration licences and three mining leases (figures 1 and 2).",[],['sediments'],"['gold', 'quartz', 'gold', 'gold']",[],[],[],0,False,,
a077562_gardner annual report 2007_17543587_227,a077562_gardner annual report 2007_17543587.json,227,the rab aircore drilling on tent hill east (e80 3378) tested an area around a 130ppb au intercept returned in 2006 drilling and tested the possible northwest southeast vulture trend extension.,1,['possible'],['possible'],the best interval encountered of both the aircore and the rab drilling at the vulture prospect was from gda0060 with 4m at 0.49g t au from 40m. no significant gold mineralization was intersected from the rab drilling near the tern south prospect (e80 2036) targeting a fold closure of the bald hill sequence (ptsb). the rab aircore drilling on tent hill east (e80 3378) tested an area around a 130ppb au intercept returned in 2006 drilling and tested the possible northwest southeast vulture trend extension. the step out program from last years drilling encountered weak mineralization confirming consistent low level anomalism peaking at 51ppb au.,[],[],['gold'],[],[],[],0,False,,
a077656_e09_1043_2007ps_10916998_11,a077656_e09_1043_2007ps_10916998.json,11,"diamond drilling at the south yangibana and east frasers well prospects intersected base metal mineralisation (up to 0.65% zn, 0.55% pb, 5g t ag) hosted by a carbonate rich bif magnetite muscovite schist.",1,['mineralisation'],['mineralisation'],"from 1974 to 1975, newmont pty ltd (newmont) explored the area for base metals and focused on five prospects within the tenements and surrounding area by completing rock chip sampling and diamond drilling. rock chip sampling results identified lead zinc rich gossans (from 0.3%pb and 0.1%zn up to 3%pb and 1% zn) with uranium levels up to 58ppm u at the yangibana east (noranda gossan), south yangibana and east frasers well prospects. diamond drilling at the south yangibana and east frasers well prospects intersected base metal mineralisation (up to 0.65% zn, 0.55% pb, 5g t ag) hosted by a carbonate rich bif magnetite muscovite schist. analyses for the diamond drilling program did not include uranium.","['base metals', 'uranium', 'base metal', 'uranium']","['gossans', 'gossan', 'bif', 'schist']","['diamond', 'lead', 'zinc', 'diamond', 'carbonate', 'magnetite', 'muscovite', 'diamond']",[],[],[],0,False,,
a077656_e09_1043_2007ps_10916998_18,a077656_e09_1043_2007ps_10916998.json,18,"challenger calculated average grade and bulk mineralisation tonnage for each prospect which they then totalled into a resource that they acknowledge required more drilling, but which apparently was not undertaken.",1,['mineralisation'],['mineralisation'],"between 1985 and 1991, challenger mining corporation nl and hurlston pty ltd (challenger) drilled a total of 80 reverse circulation holes on ten ree prospects over a total strike length of 7km (figure 6). the majority of the holes intersected anomalous rees in the oxide zone of the metasedimentary horizons identified by noranda and newmont. challenger calculated average grade and bulk mineralisation tonnage for each prospect which they then totalled into a resource that they acknowledge required more drilling, but which apparently was not undertaken. there is no record of any uranium analyses from this work.",['uranium'],['metasedimentary'],['oxide'],[],[],[],0,False,,
