event_id,filename,sentence_idx,sentence_text,n_trigger_words,trigger_words_in_sentence,trigger_words_in_event,event_text,ORE_DEPOSIT,ROCK,MINERAL,STRAT,LOCATION,TIMESCALE,event_label,reviewed,Near Miss Event,Key trigger phrase
a079900_0780-2008-01_11701485_196,a079900_0780-2008-01_11701485.json,196,"the survey was designed to provide a more complete picture of the geology of the jv area than previous drilling and geophysical surveys had shown, delineate structures which may be controls on gold mineralisation, and possibly locate discrete chargeability resistivity anomalies which may represent direct drill targets (concentrations of sulphides, graphite, silica etc).",1,['mineralisation'],['mineralisation'],"the 950ppb anomaly (in lka065 from 2006 2007 drilling programs) appears to be supergene the sample is still weathered and recent sampling of the fresher chips did not return a significant anomaly but the 300ppb anomaly (lka 064) appears more interesting, largely confirmed by recent re sampling. in mid august 2007, fugro airborne surveys pty ltd carried out a 936 km tempest (time domain based em using a fixed wing aircraft) plus magnetic survey on 200m spaced, 045225o oriented flight lines. the survey was designed to provide a more complete picture of the geology of the jv area than previous drilling and geophysical surveys had shown, delineate structures which may be controls on gold mineralisation, and possibly locate discrete chargeability resistivity anomalies which may represent direct drill targets (concentrations of sulphides, graphite, silica etc). appendix 5 contains fugros acquisition and processing report.",[],[],"['gold', 'sulphides', 'graphite', 'silica']",[],[],[],0,False,,
a079900_0780-2008-01_11701485_204,a079900_0780-2008-01_11701485.json,204,"one of the 295o structures appears to be a possible control on the hannans south gold deposit, just off the mid western boundary of the golden mile south property.",1,['possible'],['possible'],"structural trends were seen on two main orientations: 330o, sub parallel to regional strike, and 295o, a trend not seen in any other datasets for the area. the 295o structures are thought to possibly represent splays off the boulder lefroy fault, the widely inferred major regional strike parallel structure along the kalgoorliest ives anticline. one of the 295o structures appears to be a possible control on the hannans south gold deposit, just off the mid western boundary of the golden mile south property. resource potentials defined four discrete areas from the em data that had been only partially tested by pre sbm or sbms first aircore drilling program; these were major target areas for the second drilling program, as referred to in 3.1.",['gold deposit'],[],[],[],['boulder'],[],0,False,,
a079900_0780-2008-01_11701485_274,a079900_0780-2008-01_11701485.json,274,"the sferic monitor indicates where at least the high frequency portion of a sferic has been successfully removed, but it is quite possible that lower frequency elements of the sferic event may have eluded detection, passing through to the window amplitude data.",1,['possible'],['possible'],"many sferics have a characteristic form that is well illustrated by figure 2 in garner and thiel (2000). the high frequency, initial part of a sferic event can be detected and filtered more easily than the later, low frequency portion. the sferic monitor indicates where at least the high frequency portion of a sferic has been successfully removed, but it is quite possible that lower frequency elements of the sferic event may have eluded detection, passing through to the window amplitude data. thus, discrete anomalies coincident with sferic activity as indicated by the sferic monitor should be down weighted relative to features clear of any sign of sferic activity.",[],[],[],[],[],[],0,False,,
a079900_0780-2008-01_11701485_301,a079900_0780-2008-01_11701485.json,301,towards the end of the reporting year consulting geologist geophysicist jayson myers (resource potentials) was commissioned to re examine all geophysical and drilling data for the purpose of producing an updated geological interpretation and possible additional target areas.,1,['possible'],['possible'],during this manoeuvre the relative position of the towed sensor is deliberately made to vary relative to the aircraft. the em data are monitored by the airborne operator to confirm correct operation of the system during the manoeuvre. towards the end of the reporting year consulting geologist geophysicist jayson myers (resource potentials) was commissioned to re examine all geophysical and drilling data for the purpose of producing an updated geological interpretation and possible additional target areas. this work ongoing at the end of the reporting year is expected to be the basis of any further exploration of the project area.,[],[],[],[],[],[],0,False,,
a079900_0780-2008-01_11701485_333,a079900_0780-2008-01_11701485.json,333,the holes were initially sampled in 4m composites the rationale being that these should reliably reflect the presence of any gold mineralisation in remobilised saprolite hosted sub horizontal blankets and in semi fresh bedrock (saprock).,1,['mineralisation'],['mineralisation'],"the holes were drilled to refusal (an average of 65m) at 200m intervals, with some closing down to 100m, along variably spaced (mainly 800 1000m in the first and 200 400m in the second program) traverses on the local grid orientation of 04502250. the collars were set out by gps, the (all vertical) holes were drilled by raglan drilling of kalgoorlie and the samples were delivered to genalysis laboratory services facility in kalgoorlie for sample preparation prior to analysis in genalysis perth laboratory. the holes were initially sampled in 4m composites the rationale being that these should reliably reflect the presence of any gold mineralisation in remobilised saprolite hosted sub horizontal blankets and in semi fresh bedrock (saprock). anomalous zones from several anomalous intervals were subsequently re sampled at 1m intervals.",[],"['saprolite', 'bedrock', 'saprock']",['gold'],[],"['kalgoorlie', 'kalgoorlie', 'perth']",[],0,False,,
a079900_0780-2008-01_11701485_351,a079900_0780-2008-01_11701485.json,351,subsequent sampling and analyses were carried out from (mainly) unweathered chips from 15 selected pre sbm and sbm aircore drill holes which had end of hole gold anomalism (based on routine gold analyses) but had no obvious physical signs of mineralisation.,1,['mineralisation'],['mineralisation'],"following the drilling programs, available pre sbm aircore drilling data were re examined in detail to try to determine (inconsistent logging data notwithstanding) where in the regolith depositional or residual domains recorded gold anomalism relates to, and the results were collated with sbm drilling data to produce plans showing gold anomalies in transported cover, in weathered (saprolitic) bedrock and at the bottom of the holes. plan 2 shows the three classes of gold anomalies. subsequent sampling and analyses were carried out from (mainly) unweathered chips from 15 selected pre sbm and sbm aircore drill holes which had end of hole gold anomalism (based on routine gold analyses) but had no obvious physical signs of mineralisation. in most cases the new gold results were non or only mildly anomalous, indicating the original anomalism was contained in the more weathered powdered returns, suggesting either that it was supergene or that the sampled chips represented the less altered mineralised parts of an in situ mineralised zone.",[],"['regolith', 'bedrock']","['gold', 'gold', 'gold', 'gold', 'gold', 'gold']",[],[],[],0,False,,
a079900_0780-2008-01_11701485_391,a079900_0780-2008-01_11701485.json,391,this is done to artificially create the most extreme possible attitude the aircraft may encounter whilst on.,1,['possible'],['possible'],"this involves flying a series of tests on the survey line heading and approximately 15 degrees either side to accommodate small heading variations whilst flying survey lines. the data for each heading consists of a series of aircraft manoeuvres, including pitches, rolls and yaws. this is done to artificially create the most extreme possible attitude the aircraft may encounter whilst on the low frequency monitor (lfm) makes use of amplitudes at frequencies below the base frequency which are present in the streamed data to estimate the amplitude of coil motion (earth magnetic field) noise at the base frequency in log10(pv sqrt(hz) sq.m).",[],[],[],[],[],[],0,False,,
a079900_0780-2008-01_11701485_398,a079900_0780-2008-01_11701485.json,398,"though some bedrock anomalism was located, there were no indications of significant mineralisation and subsequent multielement geochemical analysis also did not support a major mineralised system underlying the area, the bedrock geology of which is dominated by the black flag beds felsic volcanic, volcaniclastic and sedimentary stratigraphic package west of a major strike parallel structure and a mafic volcanic dominated package to the east.",1,['mineralisation'],"['mineralisation', 'potential']","this situation can be inferred when both the lfm and sferic monitors show a discrete kick. the project area extends approximately 10 32km southeast of the city of kalgoorlie boulder. though some bedrock anomalism was located, there were no indications of significant mineralisation and subsequent multielement geochemical analysis also did not support a major mineralised system underlying the area, the bedrock geology of which is dominated by the black flag beds felsic volcanic, volcaniclastic and sedimentary stratigraphic package west of a major strike parallel structure and a mafic volcanic dominated package to the east. exploration to date is not considered to have negated the potential of the area to host small to medium sized gold deposits particularly if thin and further drill targeting work is ongoing.",['gold deposits'],"['bedrock', 'bedrock']",[],[],"['kalgoorlie', 'boulder', 'black flag']",[],0,False,,
a080211_psr_e45_2603_2008r_verify_12521068_9,a080211_psr_e45_2603_2008r_verify_12521068.json,9,work done: activity outcome review open file and public domain data and compilation compilation of gis dataset landsat tm interpretation identify potential iron ore mineralisation purchase dli ortho rectified aerial photography geological interpretation api management pty ltd updated: 28 11 2008 page 2 of 4 api management pty ltd updated: 28 11 2008 page 3 of 4 file verification listing exploration work type file name format office studies literature search psr_e45_2603_2008r.pdf pdf database compilation psr_e45_2603_2008r.pdf pdf computer modelling reprocessing of data general research report preparation psr_e45_2603_2008r.pdf psr_e45_2603_2008r_verify pdf pdf other (specify.,2,"['potential', 'mineralisation']","['potential', 'mineralisation']","volcanic rocks of the warrawoona group and sedimentary rocks of the gorge creek group of the pilbara supergroup occur in the northern part of the project area where they occupy a regional scale syncline. the warrawoona volcanics are poorly exposed within the tenement, with bif and chert of the gorge creek group forming prominent ridges. work done: activity outcome review open file and public domain data and compilation compilation of gis dataset landsat tm interpretation identify potential iron ore mineralisation purchase dli ortho rectified aerial photography geological interpretation api management pty ltd updated: 28 11 2008 page 2 of 4 api management pty ltd updated: 28 11 2008 page 3 of 4 file verification listing exploration work type file name format office studies literature search psr_e45_2603_2008r.pdf pdf database compilation psr_e45_2603_2008r.pdf pdf computer modelling reprocessing of data general research report preparation psr_e45_2603_2008r.pdf psr_e45_2603_2008r_verify pdf pdf other (specify) regional reconnaissance prospect underground costean.",['iron ore'],"['volcanic rocks', 'sedimentary rocks', 'bif', 'chert']",[],"['warrawoona group', 'gorge creek group', 'pilbara supergroup', 'gorge creek group']",[],[],0,False,,
a080224_e25_296_annualreport_2008_16628826_1,a080224_e25_296_annualreport_2008_16628826.json,1,the rainfall distribution varies from general light winter falls (may to august) to patchy heavier summerautumn falls (december to april).,1,['patchy'],['patchy'],"the climate is semiarid; the area has an annual rainfall of about 250 mm and annual evaporation of about 2300 mm. the rainfall distribution varies from general light winter falls (may to august) to patchy heavier summerautumn falls (december to april). occasional tropical cyclones which move in from the northwest bring more general, and sometimes flooding, rains to the region.",[],[],[],[],[],[],0,False,,
a080224_e25_296_annualreport_2008_16628826_8,a080224_e25_296_annualreport_2008_16628826.json,8,"significant work has been completed on the nyborgs golden fence area and has highlighted the potential for both laterite and fresh rock gold sources, but has yet to define any mineralisation of significance.",2,"['potential', 'mineralisation']","['potential', 'mineralisation', 'mineralisation']","the weather pattern is sometimes dominated by easterly moving cold fronts which bring strong winds, showers and, occasionally, hail. historic exploration on tenement e25 296 has included the full array of exploration techniques including soil sampling to rc drilling. significant work has been completed on the nyborgs golden fence area and has highlighted the potential for both laterite and fresh rock gold sources, but has yet to define any mineralisation of significance. ground mapping, interpretation of aeromagnetics combined with the literature review of previous workers suggest that the western margin of the licence has significantly less prospects of containing significant mineralisation than the eastern margin of the tenement.",[],['laterite'],['gold'],[],[],[],0,False,,
a080224_e25_296_annualreport_2008_16628826_81,a080224_e25_296_annualreport_2008_16628826.json,81,the presence of ultramafic rocks (interpreted from aeromagnetic imagery also represents the potential for nickel mineralisation to be present on the lease.,2,"['potential', 'mineralisation']","['potential', 'mineralisation']","to date the exploration focus at east bulong has been on primary epigenetic gold deposits (taylor 1999) and to a lesser extent alluvial, placer deposits, located on the unconformity between the tertiary sediments and the archaean bedrock (julia mines, 1997). the epigenetic gold has been associated with narrow (1 5cm); steeply dipping cross cutting quartz scheelite carbonate pyrite veins (hanna, 1993) hosted primarily in felsic volcanic and volcaniclastic rocks. the presence of ultramafic rocks (interpreted from aeromagnetic imagery also represents the potential for nickel mineralisation to be present on the lease. the tenement can be accessed via sealed road from kalgoorlie to bulong and then via station tracks for the western and southern margins margin (during wet conditions unsealed roads and tracks are generally impassable).",['gold deposits'],"['sediments', 'bedrock', 'volcaniclastic rocks']","['gold', 'quartz', 'scheelite', 'carbonate', 'pyrite', 'nickel']",[],"['bulong', 'kalgoorlie', 'bulong']","['tertiary', 'archaean']",0,False,,
a080353_e630938_doir submitted_2007_2008_16853562_22,a080353_e630938_doir submitted_2007_2008_16853562.json,22,once all data has been assimilated into the norseman gold systems then a review will be possible and an exploration program designed.,1,['possible'],['possible'],"during the short period between gaining ownership of the tenements and the end of the report period, data received as part of the purchase of the tenements has (and still is) being integrated within norseman gold database and libraries. unfortunately there was no one available from mawson west, the previous owner, who could advise of work done during the balance of the reporting period. once all data has been assimilated into the norseman gold systems then a review will be possible and an exploration program designed. the norseman area lies at the southern extent of the norseman wiluna greenstone belt of the eastern goldfields province of the yilgarn block, western australia.",[],[],"['gold', 'gold']",['greenstone belt'],"['norseman', 'mawson', 'norseman', 'norseman', 'norseman', 'wiluna', 'goldfields', 'yilgarn block', 'western australia']",[],0,False,,
a080353_e630938_doir submitted_2007_2008_16853562_33,a080353_e630938_doir submitted_2007_2008_16853562.json,33,the discovery of gold mineralisation at scotia in the 1980s shifted the focus along strike to the south.,1,['mineralisation'],['mineralisation'],the norseman gold field has a rich history of gold production and gold exploration. the focus of mining and exploration for most of the 1930s to 1990s has been on the mainfield deposits that extends from the iron king area south of the town northwards to the harlequin and north royal areas located to the north of the jimberlana dyke. the discovery of gold mineralisation at scotia in the 1980s shifted the focus along strike to the south. from the mid 1990s to 2001 the exploration focus moved to other areas outside of the mainfield including the penneshaw formation to the east where the daisy and gladstone deposits were discovered and to the mt kirk formation to the west where the cobbler deposit was discovered.,[],[],"['gold', 'gold', 'gold', 'iron', 'gold']",['penneshaw formation'],"['norseman', 'harlequin', 'north royal', 'jimberlana dyke', 'gladstone']",[],0,False,,
a080353_e630938_doir submitted_2007_2008_16853562_37,a080353_e630938_doir submitted_2007_2008_16853562.json,37,"at harlequin, targets included extensions on major n s shears (hv6 and hv10) and potential east west cross link targets similar to hv1, which led to the discovery of the marlin deposit.",1,['potential'],"['potential', 'potential']","from 2001, exploration activity intensified within the mainfield and the greater harlequin area, primarily on extensional targets, whilst regional exploration work continued simultaneously. targets within the mainfield included the mararoa reef and st patricks. at harlequin, targets included extensions on major n s shears (hv6 and hv10) and potential east west cross link targets similar to hv1, which led to the discovery of the marlin deposit. other extensional targets included daisy deeps, golden dragon underground potential, slippers and scotia.",[],[],[],[],"['harlequin', 'harlequin', 'slippers']",[],0,False,,
a080418_c223_1998_2008v_11011048_4,a080418_c223_1998_2008v_11011048.json,4,the southdown magnetite deposit was first recognised in the early 1980s from regional bmr aeromagnetic contour maps and exploration drilling during 1986 1987 identified significant magnetite mineralisation in the western 2km of the deposit.,1,['mineralisation'],['mineralisation'],"the southdown magnetite deposit has a total strike length of approximately 12 km and comprises an east west striking zone of quartzmagnetite gneiss and granulite hosted by a quartz biotite dominant metasedimentary gneiss and migmatite assemblage. the western 6km portion of the deposit lies mostly within m70 433 and the remainder of the deposit trends ene through the eastern portion of e70 2512. the southdown magnetite deposit was first recognised in the early 1980s from regional bmr aeromagnetic contour maps and exploration drilling during 1986 1987 identified significant magnetite mineralisation in the western 2km of the deposit. grange acquired title to mining leases m70 433, m70 718 and m70 719 during late 2003 and in 2004 commenced a detailed evaluation of the western 6km of the magnetite deposit located within these tenements.","['magnetite deposit', 'magnetite deposit', 'magnetite deposit']","['gneiss', 'granulite', 'metasedimentary', 'gneiss', 'migmatite']","['quartz', 'biotite', 'magnetite']",[],[],[],0,False,,
a080436_e31_692_2008s_14584246_8,a080436_e31_692_2008s_14584246.json,8,item 2351 title yilgangi gold project period 1982 1984 companies electrolytic zinc company of australasia ltd exploration by ez was conducted on the basis of a conceptual model for volcanogenic sulphide hosted gold and base metal mineralisation within acid intermediate volcanics and associated sedimentary rocks.,1,['mineralisation'],['mineralisation'],"in the 1980s the exploration emphasis changed to targeting gold deposits. a summary of the gold exploration history of the project area is given below. item 2351 title yilgangi gold project period 1982 1984 companies electrolytic zinc company of australasia ltd exploration by ez was conducted on the basis of a conceptual model for volcanogenic sulphide hosted gold and base metal mineralisation within acid intermediate volcanics and associated sedimentary rocks. during the period 1982 to 1984 exploration activities included shallow geochemical rab and vacuum drilling, reconnaissance vacuum and rab drilling.","['gold deposits', 'base metal']",['sedimentary rocks'],"['gold', 'gold', 'zinc', 'sulphide', 'gold']",[],[],[],0,False,,
a080436_e31_692_2008s_14584246_11,a080436_e31_692_2008s_14584246.json,11,a broad linear arsenic anomaly (with minor gold anomalism) from bedrock samples was identified over 6 kilometres strike length.,2,"['broad', 'minor gold']","['broad', 'minor gold']","during the period 1982 to 1984 exploration activities included shallow geochemical rab and vacuum drilling, reconnaissance vacuum and rab drilling. follow up rc drilling, costean mapping and ground magnetic surveys. a broad linear arsenic anomaly (with minor gold anomalism) from bedrock samples was identified over 6 kilometres strike length. although ez concluded that the anomalies had not been adequately tested, it appears they did not carry out further work.",[],['bedrock'],"['arsenic', 'gold']",[],[],[],0,False,,
a080436_e31_692_2008s_14584246_17,a080436_e31_692_2008s_14584246.json,17,indian ocean resources also carried out exploration south of golden rainbow where shallow auger drilling defined a broad au as anomalous zone interpreted to be the northerly strike extension from the yilgangi queen mine.,1,['broad'],"['broad', 'mineralisation']","exploration in 1987 88 by indian ocean ltd included 1: 10,000 scale colour aerial photography and rab drilling. most of the drilling was carried out in the region of the old rainbow workings, with a best intercept of 4m @ 8.20 ppm au. indian ocean resources also carried out exploration south of golden rainbow where shallow auger drilling defined a broad au as anomalous zone interpreted to be the northerly strike extension from the yilgangi queen mine. follow up rab drilling did not intersect significant bedrock mineralisation.",[],['bedrock'],[],[],[],[],0,False,,
a080436_e31_692_2008s_14584246_21,a080436_e31_692_2008s_14584246.json,21,"rc drilling was mainly undertaken at golden rainbow and further defined a north northwesterly trending zone of mineralisation, which has an approximate strike length of 1.2 km.",1,['mineralisation'],['mineralisation'],"item gswa ref no. m8464 title rainbow project period 1992 1997 companies merritt mining nl exploration undertaken by merritt included geological mapping and costean sampling, interpretation of geophysical data and rab and rc drilling. rc drilling was mainly undertaken at golden rainbow and further defined a north northwesterly trending zone of mineralisation, which has an approximate strike length of 1.2 km. an indicated resource estimate was carried out and gave 192,000t @ 2.0 g t au to a depth of 60m.",[],[],[],[],[],[],0,False,,
a080436_e31_692_2008s_14584246_88,a080436_e31_692_2008s_14584246.json,88,"the barba hills domain lies on the eastern limb of a regional anticline, the core of which is largely represented by an extensive granitoid complex.",1,['extensive'],['extensive'],"both the barba hills and yarri domains contain several basaltic and felsic volcaniclastic sequences with thin and or discontinuous ultramafic (komatiite) layers. within both domains, low angle regional shear zones bound or truncate lithologic stratigraphic packages. the barba hills domain lies on the eastern limb of a regional anticline, the core of which is largely represented by an extensive granitoid complex. the yarri domain appears to form a west dipping homoclinal sequence.",[],"['basaltic', 'komatiite', 'granitoid']",[],[],"['yarri', 'yarri']",[],0,False,,
a080436_e31_692_2008s_14584246_108,a080436_e31_692_2008s_14584246.json,108,gold mineralisation is present in several linear zones of alteration in a variety of host rocks.,1,['mineralisation'],['mineralisation'],"exploration activities conducted during the life of the tenement comprised a project appraisal, target definition and field reconnaisance (figure 2).a summary of exploration activities is given in table 1, below. 1 jackson minerals limited 1 department of industry and resources yilgangi project e31 692 surrender report: 14th february 2006 to 21st november 2008 page 2 of 20 gold mineralisation is present in several linear zones of alteration in a variety of host rocks. the porphyry mine was the only major producer (about 4.5 mt) in the area.",[],"['host rocks', 'porphyry']",['gold'],[],['jackson'],[],0,False,,
