event_id,filename,sentence_idx,sentence_text,n_trigger_words,trigger_words_in_sentence,trigger_words_in_event,event_text,ORE_DEPOSIT,ROCK,MINERAL,STRAT,LOCATION,TIMESCALE,event_label,reviewed,Near Miss Event,Key trigger phrase
a075943_bul_report_2007s_15531707_36,a075943_bul_report_2007s_15531707.json,36,"other significant events in terms of mineralisation models are the emplacement of voluminous amounts of mafic magma at ca 1800 ma (carson volcanics and hart dolerite) and 500 ma (antrim plateau volcanics), together with at least four separate episodes of potassic mantle derived magmatism at 1860 ma (butchers gully and maude headley members), 1200 ma (argyle diamond pipe), 800 ma (north kimberley and phillips range diamond fields and cummins range carbonatite) and <120 12 ma (speewah carbonatite and ellendale diamond field).",1,['mineralisation'],['mineralisation'],"the north trending lineaments are more prominent on the interpretation of the dem image, suggesting that they may correspond to relatively young structures. 3 there are four major orogenies that are recognised in the kimberley region (blake et al., 2000). other significant events in terms of mineralisation models are the emplacement of voluminous amounts of mafic magma at ca 1800 ma (carson volcanics and hart dolerite) and 500 ma (antrim plateau volcanics), together with at least four separate episodes of potassic mantle derived magmatism at 1860 ma (butchers gully and maude headley members), 1200 ma (argyle diamond pipe), 800 ma (north kimberley and phillips range diamond fields and cummins range carbonatite) and <120 12 ma (speewah carbonatite and ellendale diamond field). the last three events are particularly significant, in that they demonstrate that long lived deep mantletapping structures are a feature of the kimberley region.",[],['carbonatite'],"['diamond', 'diamond', 'diamond']","['carson volcanics', 'hart dolerite', 'antrim plateau volcanics', 'maude headley members', 'cummins range carbonatite']","['kimberley', 'argyle', 'kimberley', 'ellendale', 'long', 'kimberley']",[],0,True,False,
a075943_bul_report_2007s_15531707_39,a075943_bul_report_2007s_15531707.json,39,2.2 known gold mineralisation all known gold mineralisation in the kimberley is undated.,2,"['mineralisation', 'mineralisation']","['mineralisation', 'mineralisation']","the last three events are particularly significant, in that they demonstrate that long lived deep mantletapping structures are a feature of the kimberley region. argyle and cummins range lie on one of a number of prominent east south east trending lineaments in the east kimberley, and linear arrays of lamproites in the ellendale diamond field define probable structures that are coincident with northtrending lineaments in the kimberley basin to the north (fig. 2.2 known gold mineralisation all known gold mineralisation in the kimberley is undated. they have been assumed to be paleoproterozoic by some workers, but recent work (e.g., blake et al., 2000; ian tyler, personal communication) shows that the structures that host these gold deposits post date the halls creek orogeny.",['gold deposits'],['lamproites'],"['diamond', 'gold', 'gold']",[],"['long', 'kimberley', 'argyle', 'kimberley', 'ellendale', 'kimberley basin', 'kimberley', 'halls creek']",['paleoproterozoic'],0,True,False,
a075943_bul_report_2007s_15531707_45,a075943_bul_report_2007s_15531707.json,45,gold mineralisation has been identified in a number of locations outside the halls creek and king leopold orogens (fig.,1,['mineralisation'],"['mineralisation', 'possible', 'mineralisation']","the halls creek fault first formed around 1000 ma and underwent sinistral movement during all three aforementioned orogenies. galena is a common accessory mineral in gold deposits of the halls creek area, but pb isotope ratios are highly radiogenic (e.g., sanders, 1999) such that any calculated model ages based on the cummins and richards growth curve are meaningless (many give a time in the future). gold mineralisation has been identified in a number of locations outside the halls creek and king leopold orogens (fig. 7), but apart from some surface sampling and drilling at 88 creek ( possible epithermal mineralisation) in the northern kimberley basin, gold exploration data are very sparse and there has been no systematic work on any of these prospects.",['gold deposits'],[],"['gold', 'gold']",[],"['halls creek', 'galena', 'halls creek', 'halls creek', 'king leopold', 'kimberley basin']",[],0,True,False,
a075943_bul_report_2007s_15531707_48,a075943_bul_report_2007s_15531707.json,48,"the regional alteration includes extensive zones of pyrophyllite bearing alteration, but gold mineralisation tends to be best developed immediately adjacent to, rather than within, these zones.",2,"['extensive', 'mineralisation']","['possible', 'mineralisation', 'extensive', 'mineralisation', 'mineralisation']","7), but apart from some surface sampling and drilling at 88 creek ( possible epithermal mineralisation) in the northern kimberley basin, gold exploration data are very sparse and there has been no systematic work on any of these prospects. the 88 creek group of mineral prospects (reportedly discovered as a result of alteration identified in a confidential multi channel spectral survey by diamond explorer, de beers are developed within a regional zone of phyllosilicate alteration and comprise tabular zones of sulphidic quartzsandstone with anomalous gold values up to 1.4 ppm au. the regional alteration includes extensive zones of pyrophyllite bearing alteration, but gold mineralisation tends to be best developed immediately adjacent to, rather than within, these zones. north west, north and north east trending faults appear to control over the location and distribution of mineralisation (napier minerals prospectus, 2003).",[],[],"['gold', 'diamond', 'gold', 'pyrophyllite', 'gold']",[],['kimberley basin'],[],0,True,False,
a075943_bul_report_2007s_15531707_51,a075943_bul_report_2007s_15531707.json,51,"7), targeting thrust related gold mineralisation.",1,['mineralisation'],"['mineralisation', 'mineralisation']","north west, north and north east trending faults appear to control over the location and distribution of mineralisation (napier minerals prospectus, 2003). cra exploration drilled one hole through the king leopold sandstone at mount bell (fig. 7), targeting thrust related gold mineralisation. three separate metre long intervals of hematite altered sandstone from 127, 305 and 433 m assayed 0.69, 0.30, and 0.64 g t au respectively.",[],['sandstone'],"['gold', 'hematite']",['king leopold sandstone'],['long'],[],0,True,False,
a075943_bul_report_2007s_15531707_85,a075943_bul_report_2007s_15531707.json,85,"factor 3 has a subdued, but still significant loading for au, in conjunction with a pathfinder suite of elements that might be expected with significant mineralisation.",1,['mineralisation'],['mineralisation'],"in the centre of the project there is an 18 ppb au anomaly, and there are also low order anomalies in the north of the project (fig. the 18 ppb au and 6 ppb au anomaly were followed up (see below) factor analysis of the lag data produced the following factors factor 1 ni cu co mn y tl (zn mo) factor 2 fe in as cr bi pb factor 3 mo te w (sb au) factor 4 ba ca tl mn y (pb zn) factor5 sb zn factor6 au u 7 factors 1 and 2 correspond to co precipitation of chalcophile elements with mn and fe respectively. factor 3 has a subdued, but still significant loading for au, in conjunction with a pathfinder suite of elements that might be expected with significant mineralisation. factor 4 is the same ba mn factor recognised in many surface geochemical datasets, with additional elements that are presumably present in the ba mn mineral(s).",[],['lag'],[],[],[],[],0,True,False,
a075943_bul_report_2007s_15531707_88,a075943_bul_report_2007s_15531707.json,88,"alternatively, they may represent hydrothermal mineralisation, or the au u association might simply reflect heavy mineral concentration.",1,['mineralisation'],['mineralisation'],"factor 4 is the same ba mn factor recognised in many surface geochemical datasets, with additional elements that are presumably present in the ba mn mineral(s). factor 5 and 6 are difficult to interpret and could be spurious. alternatively, they may represent hydrothermal mineralisation, or the au u association might simply reflect heavy mineral concentration. the 18 ppb au lag anomaly also has a very high factor 3 score of 3.1 ( figs 10 & 11) confirming that this anomaly has pathfinder element support.",[],['lag'],['hydrothermal'],[],[],[],0,True,False,
a075943_bul_report_2007s_15531707_104,a075943_bul_report_2007s_15531707.json,104,"from start of altered interval to end of altered interval intensity overall alteration intensity: w weakly altered m moderately altered s strongly altered u uncertain style overall style of alteration: pv pervasive pj patchy blotchy vn vein vs selvage ws wispy ds disseminated min1, min2 mineral qualifiers refer to the geological reference for codes; common alteration minerals are: cb carbonate calcareous ch chlorite ep epidote he hematite py pyrite qz quartz se sericite si silicified siliceous sulphide data (*sul*.txt) hole drill hole no.",1,['patchy'],['patchy'],"sample_tag same as sample except for lab repeats, when the sample no. will be suffixed rpt fraction fraction of the sample if appropriate qc_type analysis hierarchy: routine original analysis check lab check split analysis of sample split reject analysis of reject portion of sample standard analysis of standard lithological data (*geo*.txt) (refer to the geological reference for appropriate geological codes) hole drill hole no. from start of altered interval to end of altered interval intensity overall alteration intensity: w weakly altered m moderately altered s strongly altered u uncertain style overall style of alteration: pv pervasive pj patchy blotchy vn vein vs selvage ws wispy ds disseminated min1, min2 mineral qualifiers refer to the geological reference for codes; common alteration minerals are: cb carbonate calcareous ch chlorite ep epidote he hematite py pyrite qz quartz se sericite si silicified siliceous sulphide data (*sul*.txt) hole drill hole no. from start of measured interval to end of measured interval mag_sus magnetic susceptibility reading instrument name of instrument si_units measurement unit (eg 10p 5 as 10 to the power of 5) recovery rqd fracture data (*geot*.txt) hole drill hole no.",[],[],"['carbonate', 'chlorite', 'epidote', 'hematite', 'pyrite', 'quartz', 'sericite', 'sulphide']",[],[],[],0,True,False,
a076239_e59_1198_2007a_10564359_46,a076239_e59_1198_2007a_10564359.json,46,auger holes collared in the lake and along the northern shore showed uranium contents considered indicative of more widespread mineralisation.,1,['mineralisation'],['mineralisation'],"figure 1 map showing airborne radiometric anomaly and auger hole locations. figure 2 map showing auger hole location, location of historic holes on geology backdrop. auger holes collared in the lake and along the northern shore showed uranium contents considered indicative of more widespread mineralisation. the auger holes were intended as a guide only to ascertain that the airborne radiometric anomaly was not due to daughter products.",['uranium'],[],[],[],[],[],0,True,False,
a076239_e59_1198_2007a_10564359_50,a076239_e59_1198_2007a_10564359.json,50,"2 to the north of lake moore, the auger drill results suggest the calcretes to be devoid of uranium mineralisation.",1,['mineralisation'],"['mineralisation', 'mineralisation']","the assays returned suggest that this is not the case and a fence of aircore or rab holes is recommended to test whether uranium bearing calcretes and or clays is present at depth. the deeper universal milling holes were all collared well to the south of the airborne radiometric anomaly and did not test the ground covered by the radiometric anomaly. 2 to the north of lake moore, the auger drill results suggest the calcretes to be devoid of uranium mineralisation. these results combined with the airborne radiometric data suggest that there is little prospect in finding mineralisation further to the north.","['uranium', 'uranium']","['calcretes', 'clays', 'calcretes']",[],[],[],[],0,True,False,
a076261_e15_598_ann07_16621183_4,a076261_e15_598_ann07_16621183.json,4,geology and mineralisation .,1,['mineralisation'],['mineralisation'],location and access. tenement status and reporting. geology and mineralisation . airborne magnetic interpretation.,[],[],[],[],[],[],0,True,False,
a076261_e15_598_ann07_16621183_14,a076261_e15_598_ann07_16621183.json,14,conclusions and recommendations based on the current understanding of the area some of e15 598 has moderate potential.,1,['potential'],"['potential', 'mineralisation']",preparation for auger geochemical drilling program (drilling in progress october 2007). geological review of the tenement setting. conclusions and recommendations based on the current understanding of the area some of e15 598 has moderate potential. the tenement overlies an intermediate felsic volcanic complex and volcaniclastics 30km south of the st ives gold camp and between higginsville and lake cowan mineralisation.,[],[],['gold'],[],['higginsville'],[],0,True,False,
a076261_e15_598_ann07_16621183_45,a076261_e15_598_ann07_16621183.json,45,e15 598 overlies a folded intermediate felsic volcaniclastic sequence and a felsic volcanic complex that strikes nnw and is situated 30km south of the st ives gold camp and between the higginsville mining centre and gold mineralisation at lake cowan.,1,['mineralisation'],"['mineralisation', 'potential']",the area is interpreted to have undergone periods of intense folding and transposition. the area has a metamorphic grade averaging mid greenschist facies with local higher grade thermal hornfelsing proximal to the binneringie dyke. e15 598 overlies a folded intermediate felsic volcaniclastic sequence and a felsic volcanic complex that strikes nnw and is situated 30km south of the st ives gold camp and between the higginsville mining centre and gold mineralisation at lake cowan. potential exists for new discoveries within the soil covered and underexplored volcaniclastic sequence.,[],['greenschist'],"['gold', 'gold']",['binneringie dyke'],['higginsville'],[],0,True,True,
a076261_e15_598_ann07_16621183_71,a076261_e15_598_ann07_16621183.json,71,these could be significant in the context of gold mineralisation where they intersect brittle host rocks at optimum angles.,1,['mineralisation'],['mineralisation'],to the north east of this boundary more strike concordant magnetic entities are present than to the south west. the north east trending ghost fracture sets may be late stage corridors of minor sinistral displacement of d4? these could be significant in the context of gold mineralisation where they intersect brittle host rocks at optimum angles. aerial photography (fig.,[],['host rocks'],['gold'],[],['south west'],[],0,True,False,
a076261_e15_598_ann07_16621183_78,a076261_e15_598_ann07_16621183.json,78,a potential problem was identified in that a fair proportion of e15 598 is covered by a thin veneer of washed alluvial and aeolian sands.,1,['potential'],['potential'],"7.2 review of previous soil sampling program introduction during regional mapping and confirmation of regional geology (k. weber 2006, r. finnigan 2007) a review of the surface soil sample program of anglogold (2000) was undertaken. the sampling methodology undertaken by anglogold was judged appropriate in the regional sense. a potential problem was identified in that a fair proportion of e15 598 is covered by a thin veneer of washed alluvial and aeolian sands. theoretically these surficial deposits would not comprise an optimum sample medium for soil geochemistry, especially over iron poor volcaniclastics and felsic volcanics that tend not to fix gold in the near surface weathered profile.",[],"['sands', 'felsic volcanics']","['iron', 'gold']",[],[],[],0,True,False,
a076261_e15_598_ann07_16621183_92,a076261_e15_598_ann07_16621183.json,92,"this erosion has incised the regolith over extensive areas, exposing bedrock south of the dyke and generating a slightly undulating relief comprising hillocks and rises of outcrop separated by colluvium filled swales.",1,['extensive'],['extensive'],"this prevented headward erosion emanating from the lake cowan palaeo drainage from disturbing areas north of the dyke. south of the dyke the processes of recent erosion are apparent with dendritic drainage channels presently feeding onto the lake surface. this erosion has incised the regolith over extensive areas, exposing bedrock south of the dyke and generating a slightly undulating relief comprising hillocks and rises of outcrop separated by colluvium filled swales. the erosion effect distal from the active drainage systems is not so apparent and there are a few areas, particularly near the western boundaries of the tenement, that have a preserved soil profile.",[],"['regolith', 'bedrock', 'colluvium']",[],[],[],[],0,True,False,
a076324_p28.1017_12329277_10,a076324_p28.1017_12329277.json,10,bedrock gold mineralisation is associated with the major avoca shear zone and with the northeast trending faults.,1,['mineralisation'],['mineralisation'],"tertiary and quaternary deposits of various origins cover the bedrock sequence and dominate much of the area where outcrops are generally sparse. mausimm, pp consulting contracting geologists p.o. bedrock gold mineralisation is associated with the major avoca shear zone and with the northeast trending faults. gold derived from the bedrock structures has entered the alluvial sequences and was a major source of the gold produced during the active mining period at kurnalpi.",[],"['bedrock', 'bedrock', 'bedrock']","['gold', 'gold', 'gold']",[],['kurnalpi'],"['tertiary', 'quaternary']",0,True,False,
a076324_p28.1017_12329277_13,a076324_p28.1017_12329277.json,13,nickel mineralisation is present mainly in the west of the kurnalpi property where it is present both in the laterite weathering profile overlying ultramafic sequences and also in the bedrock.,1,['mineralisation'],['mineralisation'],gold derived from the bedrock structures has entered the alluvial sequences and was a major source of the gold produced during the active mining period at kurnalpi. the gold was noted as being coarse grained and nuggety in distribution. nickel mineralisation is present mainly in the west of the kurnalpi property where it is present both in the laterite weathering profile overlying ultramafic sequences and also in the bedrock. work programme 3.1 mapping a geological reconnaissance survey of the area indicated the presence of a ne mineralised structure on p28 1017 by the presence of a shaft and gold workings immediately south of the southern boundary.,[],"['bedrock', 'laterite', 'bedrock']","['gold', 'gold', 'gold', 'nickel', 'gold']",[],"['kurnalpi', 'kurnalpi']",[],0,True,False,
a076324_p28.1017_12329277_27,a076324_p28.1017_12329277.json,27,the only prominent topographic features are low extensive scarps or breakaways that commonly mark an abrupt junction between the old and new plateau surfaces and only occur in deeply weathered or kaolinized rock.,1,['extensive'],['extensive'],this road is well maintained and cuts across much of the tenement group. the topography is subdued and characterized by low rounded hills with the relief ranging between 100 and 200m. the only prominent topographic features are low extensive scarps or breakaways that commonly mark an abrupt junction between the old and new plateau surfaces and only occur in deeply weathered or kaolinized rock. the climate is semi arid with an annual average rainfall of between 225 250mm.,[],[],[],[],[],[],0,True,False,
a076691_snake well annual rept tojuly 07_10323557_20,a076691_snake well annual rept tojuly 07_10323557.json,20,"total gold resources at snake well at 30 june 2007 comprised 170,000 ounces within 2.85 million tonnes @ 1.8 g t gold at snake well, in lode mineralisation and near surface laterite hosted mineralisation.",2,"['mineralisation', 'mineralisation']","['mineralisation', 'mineralisation', 'mineralisation']","most geological contacts are interpreted as southerly dipping thrusts. all rocks are cut by numerous late stage, variably magnetic dykes. total gold resources at snake well at 30 june 2007 comprised 170,000 ounces within 2.85 million tonnes @ 1.8 g t gold at snake well, in lode mineralisation and near surface laterite hosted mineralisation. mafic rocks host the major rabbit well anomaly in the south of the project area which hosts gold mineralisation associated with shearing, porphyry intrusives and quartz veining (mixy and calisi lodes), along with widespread gold in near surface lateritic gravels (lop, buckshot, warren and 1080 deposits).","['lode', 'lodes']","['laterite', 'mafic rocks', 'porphyry', 'gravels']","['gold', 'gold', 'gold', 'quartz', 'gold']",[],[],[],0,True,False,
a076691_snake well annual rept tojuly 07_10323557_25,a076691_snake well annual rept tojuly 07_10323557.json,25,"a zone of possible volcanic hosted massive sulphide (""vhms"") style zinc mineralisation at the conquistador prospect, 10 kilometres along strike from a zone was page 9 joint ventured to zinc spin off zinc co australia limited in a commodity specific farm out, with giralia retaining certain gold rights.",2,"['possible', 'mineralisation']","['possible', 'mineralisation']","the mafic schist hosted royal standard lode at the eastern end of the tenement package produced approximately 68,000 tonnes of ore at a recovered grade of 13.1 grams per tonne (""g t"") gold between 18971937, from underground mining to a depth of only 75 metres below surface, which remains the only recorded gold production from the belt. the felsic sequence in the north of the greenstone belt at snake well hosts a gold resource with unusual copper lead zinc and silver credits (a zone), and the constrictor and rabbit north prospects. a zone of possible volcanic hosted massive sulphide (""vhms"") style zinc mineralisation at the conquistador prospect, 10 kilometres along strike from a zone was page 9 joint ventured to zinc spin off zinc co australia limited in a commodity specific farm out, with giralia retaining certain gold rights. an independent resource audit and estimate completed in january 2007 by consultants ravensgate has confirmed the total indicated and inferred resource at the mixy lode as 619,030 tonnes @ 2.77 g t gold including 179,918 tonnes @ 5.22 g t gold.","['lode', 'vhms', 'lode']",['mafic schist'],"['gold', 'gold', 'gold', 'copper', 'lead', 'zinc', 'silver', 'sulphide', 'zinc', 'zinc', 'zinc', 'gold', 'gold', 'gold']",['greenstone belt'],['australia'],[],0,True,False,
a076691_snake well annual rept tojuly 07_10323557_28,a076691_snake well annual rept tojuly 07_10323557.json,28,"gold production opportunities presented by the favourable gravity and heap leach metallurgical characteristics of mixy and the nearby lop and buckshot laterite deposits continued to be the focus of continuing scoping studies into a low capital cost start up mining operation based on gravity and heap leach treatment of mixy and the nearby lop and buckshot laterite deposits, to provide early cash flow without the initial need for the substantial investment required to establish a conventional cip cil plant at snake well.",1,['favourable'],['favourable'],"an independent resource audit and estimate completed in january 2007 by consultants ravensgate has confirmed the total indicated and inferred resource at the mixy lode as 619,030 tonnes @ 2.77 g t gold including 179,918 tonnes @ 5.22 g t gold. the new independent estimate for mixy validates giralia's previous in house estimates and provides the foundation for more detailed mining studies. gold production opportunities presented by the favourable gravity and heap leach metallurgical characteristics of mixy and the nearby lop and buckshot laterite deposits continued to be the focus of continuing scoping studies into a low capital cost start up mining operation based on gravity and heap leach treatment of mixy and the nearby lop and buckshot laterite deposits, to provide early cash flow without the initial need for the substantial investment required to establish a conventional cip cil plant at snake well. gravity metallurgical testwork on a bulk samples from the mixy lode show exceptional gravity recoverable gold (""grg"") (95.4% grg).","['lode', 'lode']","['laterite', 'laterite']","['gold', 'gold', 'gold', 'gold']",[],[],[],0,True,False,
